sentence_id,sentence,cleaned_sentence,tokens
95,"A day or two later a rumour (probably started by the knowledgeable Sam) was spread about that there were going to be fireworks  fireworks, what is more, such as had not been seen in the Shire for nigh on a century, not indeed since the Old Took died.",a day or two later a rumour probably started by the knowledgeable sam was spread about that there were going to be fireworks fireworks what is more such as had not been seen in the shire for nigh on a century not indeed since the old took died,day two later rumour probably started knowledgeable sam spread going fireworks fireworks seen shire nigh century indeed since old took died
96,Days passed and The Day drew nearer.,days passed and the day drew nearer,days passed day drew nearer
97,An odd-looking waggon laden with odd-looking packages rolled into Hobbiton one evening and toiled up the Hill to Bag End.,an oddlooking waggon laden with oddlooking packages rolled into hobbiton one evening and toiled up the hill to bag end,oddlooking waggon laden oddlooking packages rolled hobbiton one evening toiled hill bag end
98,The startled hobbits peered out of lamplit doors to gape at it.,the startled hobbits peered out of lamplit doors to gape at it,startled hobbits peered lamplit doors gape
99,"It was driven by outlandish folk, singing strange songs: dwarves with long beards and deep hoods.",it was driven by outlandish folk singing strange songs dwarves with long beards and deep hoods,driven outlandish folk singing strange songs dwarves long beards deep hoods
100,A few of them remained at Bag End.,a few of them remained at bag end,remained bag end
101,At the end of the second week in September a cart came in through Bywater from the direction of the Brandywine Bridge in broad daylight.,at the end of the second week in september a cart came in through bywater from the direction of the brandywine bridge in broad daylight,end second week september cart came bywater direction brandywine bridge broad daylight
102,An old man was driving it all alone.,an old man was driving it all alone,old man driving alone
103,"He wore a tall pointed blue hat, a long grey cloak, and a silver scarf.",he wore a tall pointed blue hat a long grey cloak and a silver scarf,wore tall pointed blue hat long grey cloak silver scarf
104,He had a long white beard and bushy eyebrows that stuck out beyond the brim of his hat.,he had a long white beard and bushy eyebrows that stuck out beyond the brim of his hat,long white beard bushy eyebrows stuck beyond brim hat
105,Small hobbit-children ran after the cart all through Hobbiton and right up the hill.,small hobbitchildren ran after the cart all through hobbiton and right up the hill,small hobbitchildren ran cart hobbiton right hill
106,"It had a cargo of fireworks, as they rightly guessed.",it had a cargo of fireworks as they rightly guessed,cargo fireworks rightly guessed
107,"At Bilbo's front door the old man began to unload: there were great bundles of fireworks of all sorts and shapes, each labelled with a large red G  and the elf-rune, .",at bilbos front door the old man began to unload there were great bundles of fireworks of all sorts and shapes each labelled with a large red g and the elfrune,bilbos front door old man began unload great bundles fireworks sorts shapes labelled large red g elfrune
108,"That was Gandalf's mark, of course, and the old man was Gandalf the Wizard, whose fame in the Shire was due mainly to his skill with fires, smokes, and lights.",that was gandalfs mark of course and the old man was gandalf the wizard whose fame in the shire was due mainly to his skill with fires smokes and lights,gandalfs mark course old man gandalf wizard whose fame shire due mainly skill fires smokes lights
109,"His real business was far more difficult and dangerous, but the Shire-folk knew nothing about it.",his real business was far more difficult and dangerous but the shirefolk knew nothing about it,real business far difficult dangerous shirefolk knew nothing
110,To them he was just one of the 'attractions' at the Party.,to them he was just one of the attractions at the party,one attractions party
111,Hence the excitement of the hobbit-children.,hence the excitement of the hobbitchildren,hence excitement hobbitchildren
112,'G for Grand!',g for grand,g grand
113,"they shouted, and the old man smiled.",they shouted and the old man smiled,shouted old man smiled
114,"They knew him by sight, though he only appeared in Hobbiton occasionally and never stopped long; but neither they nor any but the oldest of their elders had seen one of his firework displays  they now belonged to the legendary past.",they knew him by sight though he only appeared in hobbiton occasionally and never stopped long but neither they nor any but the oldest of their elders had seen one of his firework displays they now belonged to the legendary past,knew sight though appeared hobbiton occasionally never stopped long neither oldest elders seen one firework displays belonged legendary past
115,"When the old man, helped by Bilbo and some dwarves, had finished unloading.",when the old man helped by bilbo and some dwarves had finished unloading,old man helped bilbo dwarves finished unloading
116,"Bilbo gave a few pennies away; but not a single squib or cracker was forthcoming, to the disappointment of the onlookers.",bilbo gave a few pennies away but not a single squib or cracker was forthcoming to the disappointment of the onlookers,bilbo gave pennies away single squib cracker forthcoming disappointment onlookers
117,'Run away now!',run away now,run away
118,said Gandalf.,said gandalf,said gandalf
119,'You will get plenty when the time comes.',you will get plenty when the time comes,get plenty time comes
120,"Then he disappeared inside with Bilbo, and the door was shut.",then he disappeared inside with bilbo and the door was shut,disappeared inside bilbo door shut
121,"The young hobbits stared at the door in vain for a while, and then made off, feeling that the day of the party would never come.",the young hobbits stared at the door in vain for a while and then made off feeling that the day of the party would never come,young hobbits stared door vain made feeling day party would never come
122,"Inside Bag End, Bilbo and Gandalf were sitting at the open window of a small room looking out west on to the garden.",inside bag end bilbo and gandalf were sitting at the open window of a small room looking out west on to the garden,inside bag end bilbo gandalf sitting open window small room looking west garden
123,The late afternoon was bright and peaceful.,the late afternoon was bright and peaceful,late afternoon bright peaceful
124,"The flowers glowed red and golden: snap-dragons and sun-flowers, and nasturtiums trailing all over the turf walls and peeping in at the round windows.",the flowers glowed red and golden snapdragons and sunflowers and nasturtiums trailing all over the turf walls and peeping in at the round windows,flowers glowed red golden snapdragons sunflowers nasturtiums trailing turf walls peeping round windows
125,'How bright your garden looks!',how bright your garden looks,bright garden looks
126,said Gandalf.,said gandalf,said gandalf
127,"'Yes,' said Bilbo.",yes said bilbo,yes said bilbo
128,"I am very fond indeed of it, and of all the dear old Shire; but I think I need a holiday.'",i am very fond indeed of it and of all the dear old shire but i think i need a holiday,fond indeed dear old shire think need holiday
129,'You mean to go on with your plan then?',you mean to go on with your plan then,mean go plan
130,'I do.,i do,
131,"I made up my mind months ago, and I haven't changed it.'",i made up my mind months ago and i havent changed it,made mind months ago havent changed
132,'Very well.,very well,well
133,It is no good saying any more.,it is no good saying any more,good saying
134,"Stick to your plan  your whole plan, mind  and I hope it will turn out for the best, for you, and for all of us.'",stick to your plan your whole plan mind and i hope it will turn out for the best for you and for all of us,stick plan whole plan mind hope turn best us
135,'I hope so.,i hope so,hope
136,"Anyway I mean to enjoy myself on Thursday, and have my little joke.'",anyway i mean to enjoy myself on thursday and have my little joke,anyway mean enjoy thursday little joke
137,"'Who will laugh, I wonder?'",who will laugh i wonder,laugh wonder
138,"said Gandalf, shaking his head.",said gandalf shaking his head,said gandalf shaking head
139,"'We shall see,' said Bilbo.",we shall see said bilbo,shall see said bilbo
140,"The next day more carts rolled up the Hill, and still more carts.",the next day more carts rolled up the hill and still more carts,next day carts rolled hill still carts
141,"There might have been some grumbling about 'dealing locally', but that very week orders began to pour out of Bag End for every kind of provision, commodity, or luxury that could be obtained in Hobbiton or Bywater or anywhere in the neighbourhood.",there might have been some grumbling about dealing locally but that very week orders began to pour out of bag end for every kind of provision commodity or luxury that could be obtained in hobbiton or bywater or anywhere in the neighbourhood,might grumbling dealing locally week orders began pour bag end every kind provision commodity luxury could obtained hobbiton bywater anywhere neighbourhood
142,"People became enthusiastic; and they began to tick off the days on the calendar; and they watched eagerly for the postman, hoping for invitations.",people became enthusiastic and they began to tick off the days on the calendar and they watched eagerly for the postman hoping for invitations,people became enthusiastic began tick days calendar watched eagerly postman hoping invitations
143,"Before long the invitations began pouring out, and the Hobbiton post-office was blocked, and the Bywater post-office was snowed under, and voluntary assistant postmen were called for.",before long the invitations began pouring out and the hobbiton postoffice was blocked and the bywater postoffice was snowed under and voluntary assistant postmen were called for,long invitations began pouring hobbiton postoffice blocked bywater postoffice snowed voluntary assistant postmen called
144,"There was a constant stream of them going up the Hill, carrying hundreds of polite variations on _Thank you, I shall certainly come._
     A notice appeared on the gate at Bag End: NO ADMITTANCE EXCEPT ON PARTY BUSINESS.",there was a constant stream of them going up the hill carrying hundreds of polite variations on thank you i shall certainly come a notice appeared on the gate at bag end no admittance except on party business,constant stream going hill carrying hundreds polite variations thank shall certainly come notice appeared gate bag end admittance except party business
145,"Even those who had, or pretended to have Party Business were seldom allowed inside.",even those who had or pretended to have party business were seldom allowed inside,even pretended party business seldom allowed inside
146,"Bilbo was busy: writing invitations, ticking off answers, packing up presents, and making some private preparations of his own.",bilbo was busy writing invitations ticking off answers packing up presents and making some private preparations of his own,bilbo busy writing invitations ticking answers packing presents making private preparations
147,From the time of Gandalf's arrival he remained hidden from view.,from the time of gandalfs arrival he remained hidden from view,time gandalfs arrival remained hidden view
148,"One morning the hobbits woke to find the large field, south of Bilbo's front door, covered with ropes and poles for tents and pavilions.",one morning the hobbits woke to find the large field south of bilbos front door covered with ropes and poles for tents and pavilions,one morning hobbits woke find large field south bilbos front door covered ropes poles tents pavilions
149,"A special entrance was cut into the bank leading to the road, and wide steps and a large white gate were built there.",a special entrance was cut into the bank leading to the road and wide steps and a large white gate were built there,special entrance cut bank leading road wide steps large white gate built
150,"The three hobbit-families of Bagshot Row, adjoining the field, were intensely interested and generally envied.",the three hobbitfamilies of bagshot row adjoining the field were intensely interested and generally envied,three hobbitfamilies bagshot row adjoining field intensely interested generally envied
151,Old Gaffer Gamgee stopped even pretending to work in his garden.,old gaffer gamgee stopped even pretending to work in his garden,old gaffer gamgee stopped even pretending work garden
152,The tents began to go up.,the tents began to go up,tents began go
153,"There was a specially large pavilion, so big that the tree that grew in the field was right inside it, and stood proudly near one end, at the head of the chief table.",there was a specially large pavilion so big that the tree that grew in the field was right inside it and stood proudly near one end at the head of the chief table,specially large pavilion big tree grew field right inside stood proudly near one end head chief table
154,Lanterns were hung on all its branches.,lanterns were hung on all its branches,lanterns hung branches
155,More promising still (to the hobbits' mind): an enormous open-air kitchen was erected in the north corner of the field.,more promising still to the hobbits mind an enormous openair kitchen was erected in the north corner of the field,promising still hobbits mind enormous openair kitchen erected north corner field
156,"A draught of cooks, from every inn and eating-house for miles around, arrived to supplement the dwarves and other odd folk that were quartered at Bag End.",a draught of cooks from every inn and eatinghouse for miles around arrived to supplement the dwarves and other odd folk that were quartered at bag end,draught cooks every inn eatinghouse miles around arrived supplement dwarves odd folk quartered bag end
157,Excitement rose to its height.,excitement rose to its height,excitement rose height
158,Then the weather clouded over.,then the weather clouded over,weather clouded
159,That was on Wednesday the eve of the Party.,that was on wednesday the eve of the party,wednesday eve party
160,Anxiety was intense.,anxiety was intense,anxiety intense
161,"Then Thursday, September the 22nd, actually dawned.",then thursday september the nd actually dawned,thursday september nd actually dawned
162,"The sun got up, the clouds vanished, flags were unfurled and the fun began.",the sun got up the clouds vanished flags were unfurled and the fun began,sun got clouds vanished flags unfurled fun began
163,"Bilbo Baggins called it a _party,_ but it was really a variety of entertainments rolled into one.",bilbo baggins called it a party but it was really a variety of entertainments rolled into one,bilbo baggins called party really variety entertainments rolled one
164,Practically everybody living near was invited.,practically everybody living near was invited,practically everybody living near invited
165,"A very few were overlooked by accident, but as they turned up all the same, that did not matter.",a very few were overlooked by accident but as they turned up all the same that did not matter,overlooked accident turned matter
166,Many people from other parts of the Shire were also asked; and there were even a few from outside the borders.,many people from other parts of the shire were also asked and there were even a few from outside the borders,many people parts shire also asked even outside borders
167,Bilbo met the guests (and additions) at the new white gate in person.,bilbo met the guests and additions at the new white gate in person,bilbo met guests additions new white gate person
168,He gave away presents to all and sundry  the latter were those who went out again by a back way and came in again by the gate.,he gave away presents to all and sundry the latter were those who went out again by a back way and came in again by the gate,gave away presents sundry latter went back way came gate
169,Hobbits give presents to other people on their own birthdays.,hobbits give presents to other people on their own birthdays,hobbits give presents people birthdays
170,"Not very expensive ones, as a rule, and not so lavishly as on this occasion; but it was not a bad system.",not very expensive ones as a rule and not so lavishly as on this occasion but it was not a bad system,expensive ones rule lavishly occasion bad system
171,"Actually in Hobbiton and Bywater every day in the year it was somebody's birthday, so that every hobbit in those parts had a fair chance of at least one present at least once a week.",actually in hobbiton and bywater every day in the year it was somebodys birthday so that every hobbit in those parts had a fair chance of at least one present at least once a week,actually hobbiton bywater every day year somebodys birthday every hobbit parts fair chance least one present least week
172,But they never got tired of them.,but they never got tired of them,never got tired
173,On this occasion the presents were unusually good.,on this occasion the presents were unusually good,occasion presents unusually good
174,The hobbit-children were so excited that for a while they almost forgot about eating.,the hobbitchildren were so excited that for a while they almost forgot about eating,hobbitchildren excited almost forgot eating
175,"There were toys the like of which they had never seen before, all beautiful and some obviously magical.",there were toys the like of which they had never seen before all beautiful and some obviously magical,toys like never seen beautiful obviously magical
176,"Many of them had indeed been ordered a year before, and had come all the way from the Mountain and from Dale, and were of real dwarf-make.",many of them had indeed been ordered a year before and had come all the way from the mountain and from dale and were of real dwarfmake,many indeed ordered year come way mountain dale real dwarfmake
177,"When every guest had been welcomed and was finally inside the gate, there were songs, dances, music, games, and, of course, food and drink.",when every guest had been welcomed and was finally inside the gate there were songs dances music games and of course food and drink,every guest welcomed finally inside gate songs dances music games course food drink
178,"There were three official meals: lunch, tea, and dinner (or supper).",there were three official meals lunch tea and dinner or supper,three official meals lunch tea dinner supper
179,But lunch and tea were marked chiefly by the fact that at those times all the guests were sitting down and eating together.,but lunch and tea were marked chiefly by the fact that at those times all the guests were sitting down and eating together,lunch tea marked chiefly fact times guests sitting eating together
180,"At other times there were merely lots of people eating and drinking  continuously from elevenses until six-thirty, when the fireworks started.",at other times there were merely lots of people eating and drinking continuously from elevenses until sixthirty when the fireworks started,times merely lots people eating drinking continuously elevenses sixthirty fireworks started
181,"The fireworks were by Gandalf: they were not only brought by him, but designed and made by him; and the special effects, set pieces, and flights of rockets were let off by him.",the fireworks were by gandalf they were not only brought by him but designed and made by him and the special effects set pieces and flights of rockets were let off by him,fireworks gandalf brought designed made special effects set pieces flights rockets let
182,"But there was also a generous distribution of squibs, crackers, backarappers, sparklers, torches, dwarf-candles, elf-fountains, goblin-barkers and thunder-claps.",but there was also a generous distribution of squibs crackers backarappers sparklers torches dwarfcandles elffountains goblinbarkers and thunderclaps,also generous distribution squibs crackers backarappers sparklers torches dwarfcandles elffountains goblinbarkers thunderclaps
183,They were all superb.,they were all superb,superb
184,The art of Gandalf improved with age.,the art of gandalf improved with age,art gandalf improved age
185,There were rockets like a flight of scintillating birds singing with sweet voices.,there were rockets like a flight of scintillating birds singing with sweet voices,rockets like flight scintillating birds singing sweet voices
186,"There were green trees with trunks of dark smoke: their leaves opened like a whole spring unfolding in a moment, and their shining branches dropped glowing flowers down upon the astonished hobbits, disappearing with a sweet scent just before they touched their upturned faces.",there were green trees with trunks of dark smoke their leaves opened like a whole spring unfolding in a moment and their shining branches dropped glowing flowers down upon the astonished hobbits disappearing with a sweet scent just before they touched their upturned faces,green trees trunks dark smoke leaves opened like whole spring unfolding moment shining branches dropped glowing flowers upon astonished hobbits disappearing sweet scent touched upturned faces
187,"There were fountains of butterflies that flew glittering into the trees; there were pillars of coloured fires that rose and turned into eagles, or sailing ships, or a phalanx of flying swans; there was a red thunderstorm and a shower of yellow rain; there was a forest of silver spears that sprang suddenly into the air with a yell like an embattled army, and came down again into the Water with a hiss like a hundred hot snakes.",there were fountains of butterflies that flew glittering into the trees there were pillars of coloured fires that rose and turned into eagles or sailing ships or a phalanx of flying swans there was a red thunderstorm and a shower of yellow rain there was a forest of silver spears that sprang suddenly into the air with a yell like an embattled army and came down again into the water with a hiss like a hundred hot snakes,fountains butterflies flew glittering trees pillars coloured fires rose turned eagles sailing ships phalanx flying swans red thunderstorm shower yellow rain forest silver spears sprang suddenly air yell like embattled army came water hiss like hundred hot snakes
188,"And there was also one last surprise, in honour of Bilbo, and it startled the hobbits exceedingly, as Gandalf intended.",and there was also one last surprise in honour of bilbo and it startled the hobbits exceedingly as gandalf intended,also one last surprise honour bilbo startled hobbits exceedingly gandalf intended
189,The lights went out.,the lights went out,lights went
190,A great smoke went up.,a great smoke went up,great smoke went
191,"It shaped itself like a mountain seen in the distance, and began to glow at the summit.",it shaped itself like a mountain seen in the distance and began to glow at the summit,shaped like mountain seen distance began glow summit
192,It spouted green and scarlet flames.,it spouted green and scarlet flames,spouted green scarlet flames
193,"Out flew a red-golden dragon  not life-size, but terribly life-like: fire came from his jaws, his eyes glared down; there was a roar, and he whizzed three times over the heads of the crowd.",out flew a redgolden dragon not lifesize but terribly lifelike fire came from his jaws his eyes glared down there was a roar and he whizzed three times over the heads of the crowd,flew redgolden dragon lifesize terribly lifelike fire came jaws eyes glared roar whizzed three times heads crowd
194,"They all ducked, and many fell flat on their faces.",they all ducked and many fell flat on their faces,ducked many fell flat faces
195,"The dragon passed like an express train, turned a somersault, and burst over Bywater with a deafening explosion.",the dragon passed like an express train turned a somersault and burst over bywater with a deafening explosion,dragon passed like express train turned somersault burst bywater deafening explosion
196,'That is the signal for supper!',that is the signal for supper,signal supper
197,said Bilbo.,said bilbo,said bilbo
198,"The pain and alarm vanished at once, and the prostrate hobbits leaped to their feet.",the pain and alarm vanished at once and the prostrate hobbits leaped to their feet,pain alarm vanished prostrate hobbits leaped feet
199,"There was a splendid supper for everyone; for everyone, that is, except those invited to the special family dinner-party.",there was a splendid supper for everyone for everyone that is except those invited to the special family dinnerparty,splendid supper everyone everyone except invited special family dinnerparty
200,This was held in the great pavilion with the tree.,this was held in the great pavilion with the tree,held great pavilion tree
