sentence_id,sentence,cleaned_sentence,tokens
398,"They were beginning to look out for a place off the Road, where they could camp for the night, when they heard a sound that brought sudden fear back into their hearts: the noise of hoofs behind them.",they were beginning to look out for a place off the road where they could camp for the night when they heard a sound that brought sudden fear back into their hearts the noise of hoofs behind them,beginning look place road could camp night heard sound brought sudden fear back hearts noise hoofs behind
399,"They looked back, but they could not see far because of the many windings and rollings of the Road.",they looked back but they could not see far because of the many windings and rollings of the road,looked back could see far many windings rollings road
400,"As quickly as they could they scrambled off the beaten way and up into the deep heather and bilberry brushwood on the slopes above, until they came to a small patch of thick-growing hazels.",as quickly as they could they scrambled off the beaten way and up into the deep heather and bilberry brushwood on the slopes above until they came to a small patch of thickgrowing hazels,quickly could scrambled beaten way deep heather bilberry brushwood slopes came small patch thickgrowing hazels
401,"As they peered out from among the bushes, they could see the Road, faint and grey in the failing light, some thirty feel below them.",as they peered out from among the bushes they could see the road faint and grey in the failing light some thirty feel below them,peered among bushes could see road faint grey failing light thirty feel
402,The sound of hoofs drew nearer.,the sound of hoofs drew nearer,sound hoofs drew nearer
403,"They were going fast, with a light _clippety-clippely-clip._ Then faintly, as if it was blown away from them by the breeze, they seemed to catch a dim ringing, as of small bells tinkling.",they were going fast with a light clippetyclippelyclip then faintly as if it was blown away from them by the breeze they seemed to catch a dim ringing as of small bells tinkling,going fast light clippetyclippelyclip faintly blown away breeze seemed catch dim ringing small bells tinkling
404,'That does not sound like a Black Rider's horse!',that does not sound like a black riders horse,sound like black riders horse
405,"said Frodo, listening intently.",said frodo listening intently,said frodo listening intently
406,"The other hobbits agreed hopefully that it did not, but they all remained full of suspicion.",the other hobbits agreed hopefully that it did not but they all remained full of suspicion,hobbits agreed hopefully remained full suspicion
407,They had been in fear of pursuit for so long that any sound from behind seemed ominous and unfriendly.,they had been in fear of pursuit for so long that any sound from behind seemed ominous and unfriendly,fear pursuit long sound behind seemed ominous unfriendly
408,"But Strider was now leaning forward, stooped to the ground, with a hand to his ear, and a look of joy on his face.",but strider was now leaning forward stooped to the ground with a hand to his ear and a look of joy on his face,strider leaning forward stooped ground hand ear look joy face
409,"The light faded, and the leaves on the bushes rustled softly.",the light faded and the leaves on the bushes rustled softly,light faded leaves bushes rustled softly
410,"Clearer and nearer now the bells jingled, and _clippety-clip_ came the quick trotting feet.",clearer and nearer now the bells jingled and clippetyclip came the quick trotting feet,clearer nearer bells jingled clippetyclip came quick trotting feet
411,"Suddenly into view below came a white horse, gleaming in the shadows, running swiftly.",suddenly into view below came a white horse gleaming in the shadows running swiftly,suddenly view came white horse gleaming shadows running swiftly
412,"In the dusk its headstall flickered and flashed, as if it were studded with gems like living stars.",in the dusk its headstall flickered and flashed as if it were studded with gems like living stars,dusk headstall flickered flashed studded gems like living stars
413,"The rider's cloak streamed behind him, and his hood was thrown back; his golden hair flowed shimmering in the wind of his speed.",the riders cloak streamed behind him and his hood was thrown back his golden hair flowed shimmering in the wind of his speed,riders cloak streamed behind hood thrown back golden hair flowed shimmering wind speed
414,"To Frodo it appeared that a white light was shining through the form and raiment of the rider, as if through a thin veil.",to frodo it appeared that a white light was shining through the form and raiment of the rider as if through a thin veil,frodo appeared white light shining form raiment rider thin veil
415,"Strider sprang from hiding and dashed down towards the Road, leaping with a cry through the heather; but even before he had moved or called, the rider had reined in his horse and halted, looking up towards the thicket where they stood.",strider sprang from hiding and dashed down towards the road leaping with a cry through the heather but even before he had moved or called the rider had reined in his horse and halted looking up towards the thicket where they stood,strider sprang hiding dashed towards road leaping cry heather even moved called rider reined horse halted looking towards thicket stood
416,"When he saw Strider, he dismounted and ran to meet him calling out: _Ai na vedui Dnadan!",when he saw strider he dismounted and ran to meet him calling out ai na vedui dunadan,saw strider dismounted ran meet calling ai na vedui dunadan
417,Mae govannen!_ His speech and clear ringing voice left no doubt in their hearts: the rider was of the Elven-folk.,mae govannen his speech and clear ringing voice left no doubt in their hearts the rider was of the elvenfolk,mae govannen speech clear ringing voice left doubt hearts rider elvenfolk
418,No others that dwelt in the wide world had voices so fair to hear.,no others that dwelt in the wide world had voices so fair to hear,others dwelt wide world voices fair hear
419,"But there seemed to be a note of haste or fear in his call, and they saw that he was now speaking quickly and urgently to Strider.",but there seemed to be a note of haste or fear in his call and they saw that he was now speaking quickly and urgently to strider,seemed note haste fear call saw speaking quickly urgently strider
420,"Soon Strider beckoned to them, and the hobbits left the bushes and hurried down to the Road.",soon strider beckoned to them and the hobbits left the bushes and hurried down to the road,soon strider beckoned hobbits left bushes hurried road
421,"'This is Glorfindel, who dwells in the house of Elrond,' said Strider.",this is glorfindel who dwells in the house of elrond said strider,glorfindel dwells house elrond said strider
422,"'Hail, and well met at last!'",hail and well met at last,hail well met last
423,said the Elf-lord to Frodo.,said the elflord to frodo,said elflord frodo
424,'I was sent from Rivendell to look for you.,i was sent from rivendell to look for you,sent rivendell look
425,We feared that you were in danger upon the road.',we feared that you were in danger upon the road,feared danger upon road
426,'Then Gandalf has reached Rivendell?',then gandalf has reached rivendell,gandalf reached rivendell
427,cried Frodo joyfully.,cried frodo joyfully,cried frodo joyfully
428,'No.,no,
429,"He had not when I departed; but that was nine days ago,' answered Glorfindel.",he had not when i departed but that was nine days ago answered glorfindel,departed nine days ago answered glorfindel
430,'Elrond received news that troubled him.,elrond received news that troubled him,elrond received news troubled
431,"Some of my kindred, journeying in your land beyond the Baranduin, learned that things were amiss, and sent messages as swiftly as they could.",some of my kindred journeying in your land beyond the baranduin learned that things were amiss and sent messages as swiftly as they could,kindred journeying land beyond baranduin learned things amiss sent messages swiftly could
432,"They said that the Nine were abroad, and that you were astray bearing a great burden without guidance, for Gandalf had not returned.",they said that the nine were abroad and that you were astray bearing a great burden without guidance for gandalf had not returned,said nine abroad astray bearing great burden without guidance gandalf returned
433,"There are few even in Rivendell that can ride openly against the Nine; but such as there were, Elrond sent out north, west, and south.",there are few even in rivendell that can ride openly against the nine but such as there were elrond sent out north west and south,even rivendell ride openly nine elrond sent north west south
434,"It was thought that you might turn far aside to avoid pursuit, and become lost in the Wilderness.",it was thought that you might turn far aside to avoid pursuit and become lost in the wilderness,thought might turn far aside avoid pursuit become lost wilderness
435,"'It was my lot to take the Road, and I came to the Bridge of Mitheithel, and left a token there, nigh on seven days ago.",it was my lot to take the road and i came to the bridge of mitheithel and left a token there nigh on seven days ago,lot take road came bridge mitheithel left token nigh seven days ago
436,"Three of the servants of Sauron were upon the Bridge, but they withdrew and I pursued them westward.",three of the servants of sauron were upon the bridge but they withdrew and i pursued them westward,three servants sauron upon bridge withdrew pursued westward
437,"I came also upon two others, but they turned away southward.",i came also upon two others but they turned away southward,came also upon two others turned away southward
438,Since then I have searched for your trail.,since then i have searched for your trail,since searched trail
439,"Two days ago I found it, and followed it over the Bridge; and today I marked where you descended from the hills again.",two days ago i found it and followed it over the bridge and today i marked where you descended from the hills again,two days ago found followed bridge today marked descended hills
440,But come!,but come,come
441,There is no time for further news.,there is no time for further news,time news
442,Since you are here we must risk the peril of the Road and go.,since you are here we must risk the peril of the road and go,since must risk peril road go
443,"There are five behind us, and when they find your trail upon the Road they will ride after us like the wind.",there are five behind us and when they find your trail upon the road they will ride after us like the wind,five behind us find trail upon road ride us like wind
444,And they are not all.,and they are not all,
445,"Where the other four may be, I do not know.",where the other four may be i do not know,four may know
446,I fear that we may find the Ford is already held against us.',i fear that we may find the ford is already held against us,fear may find ford already held us
447,While Glorfindel was speaking the shades of evening deepened.,while glorfindel was speaking the shades of evening deepened,glorfindel speaking shades evening deepened
448,Frodo felt a great weariness come over him.,frodo felt a great weariness come over him,frodo felt great weariness come
449,"Ever since the sun began to sink the mist before his eyes had darkened, and he felt that a shadow was coming between him and the faces of his friends.",ever since the sun began to sink the mist before his eyes had darkened and he felt that a shadow was coming between him and the faces of his friends,ever since sun began sink mist eyes darkened felt shadow coming faces friends
450,"Now pain assailed him, and he felt cold.",now pain assailed him and he felt cold,pain assailed felt cold
451,"He swayed, clutching at Sam's arm.",he swayed clutching at sams arm,swayed clutching sams arm
452,"'My master is sick and wounded,' said Sam angrily.",my master is sick and wounded said sam angrily,master sick wounded said sam angrily
453,'He can't go on riding after nightfall.,he cant go on riding after nightfall,cant go riding nightfall
454,He needs rest.',he needs rest,needs rest
455,"Glorfindel caught Frodo as he sank to the ground, and taking him gently in his arms he looked in his face with grave anxiety.",glorfindel caught frodo as he sank to the ground and taking him gently in his arms he looked in his face with grave anxiety,glorfindel caught frodo sank ground taking gently arms looked face grave anxiety
456,"Briefly Strider told of the attack on their camp under Weathertop, and of the deadly knife.",briefly strider told of the attack on their camp under weathertop and of the deadly knife,briefly strider told attack camp weathertop deadly knife
457,"He drew out the hilt, which he had kept, and handed it to the Elf.",he drew out the hilt which he had kept and handed it to the elf,drew hilt kept handed elf
458,"Glorfindel shuddered as he took it, but he looked intently at it.",glorfindel shuddered as he took it but he looked intently at it,glorfindel shuddered took looked intently
459,"'There are evil things written on this hilt,' he said; 'though maybe your eyes cannot see them.",there are evil things written on this hilt he said though maybe your eyes cannot see them,evil things written hilt said though maybe eyes see
460,"Keep it, Aragorn, till we reach the house of Elrond!",keep it aragorn till we reach the house of elrond,keep aragorn till reach house elrond
461,"But be wary, and handle it as little as you may!",but be wary and handle it as little as you may,wary handle little may
462,Alas!,alas,alas
463,the wounds of this weapon are beyond my skill to heal.,the wounds of this weapon are beyond my skill to heal,wounds weapon beyond skill heal
464,I will do what I can  but all the more do I urge you now to go on without rest.',i will do what i can but all the more do i urge you now to go on without rest,urge go without rest
465,"He searched the wound on Frodo's shoulder with his fingers, and his face grew graver, as if what he learned disquieted him.",he searched the wound on frodos shoulder with his fingers and his face grew graver as if what he learned disquieted him,searched wound frodos shoulder fingers face grew graver learned disquieted
466,"But Frodo felt the chill lessen in his side and arm; a little warmth crept down from his shoulder to his hand, and the pain grew easier.",but frodo felt the chill lessen in his side and arm a little warmth crept down from his shoulder to his hand and the pain grew easier,frodo felt chill lessen side arm little warmth crept shoulder hand pain grew easier
467,"The dusk of evening seemed to grow lighter about him, as if a cloud had been withdrawn.",the dusk of evening seemed to grow lighter about him as if a cloud had been withdrawn,dusk evening seemed grow lighter cloud withdrawn
468,"He saw his friends' faces more clearly again, and a measure of new hope and strength returned.",he saw his friends faces more clearly again and a measure of new hope and strength returned,saw friends faces clearly measure new hope strength returned
469,"'You shall ride my horse,' said Glorfindel.",you shall ride my horse said glorfindel,shall ride horse said glorfindel
470,"'I will shorten the stirrups up to the saddle-skins, and you must sit as tight as you can.",i will shorten the stirrups up to the saddleskins and you must sit as tight as you can,shorten stirrups saddleskins must sit tight
471,But you need not fear: my horse will not let any rider fall that I command him to bear.,but you need not fear my horse will not let any rider fall that i command him to bear,need fear horse let rider fall command bear
472,"His pace is light and smooth; and if danger presses too near, he will bear you away with a speed that even the black steeds of the enemy cannot rival.'",his pace is light and smooth and if danger presses too near he will bear you away with a speed that even the black steeds of the enemy cannot rival,pace light smooth danger presses near bear away speed even black steeds enemy rival
473,"'No, he will not!'",no he will not,
474,said Frodo.,said frodo,said frodo
475,"'I shall not ride him, if I am to be carried off to Rivendell or anywhere else, leaving my friends behind in danger.'",i shall not ride him if i am to be carried off to rivendell or anywhere else leaving my friends behind in danger,shall ride carried rivendell anywhere else leaving friends behind danger
476,Glorfindel smiled.,glorfindel smiled,glorfindel smiled
477,"'I doubt very much,' he said, 'if your friends would be in danger if you were not with them!",i doubt very much he said if your friends would be in danger if you were not with them,doubt much said friends would danger
478,"The pursuit would follow you and leave us in peace, I think.",the pursuit would follow you and leave us in peace i think,pursuit would follow leave us peace think
479,"It is you, Frodo, and that which you bear that brings us all in peril.'",it is you frodo and that which you bear that brings us all in peril,frodo bear brings us peril
480,"To that Frodo had no answer, and he was persuaded to mount Glorfindel's white horse.",to that frodo had no answer and he was persuaded to mount glorfindels white horse,frodo answer persuaded mount glorfindels white horse
481,"The pony was laden instead with a great part of the others' burdens, so that they now marched lighter, and for a time made good speed; but the hobbits began to find it hard to keep up with the swift tireless feet of the Elf.",the pony was laden instead with a great part of the others burdens so that they now marched lighter and for a time made good speed but the hobbits began to find it hard to keep up with the swift tireless feet of the elf,pony laden instead great part others burdens marched lighter time made good speed hobbits began find hard keep swift tireless feet elf
482,"On he led them, into the mouth of darkness, and still on under the deep clouded night.",on he led them into the mouth of darkness and still on under the deep clouded night,led mouth darkness still deep clouded night
483,There was neither star nor moon.,there was neither star nor moon,neither star moon
484,Not until the grey of dawn did he allow them to halt.,not until the grey of dawn did he allow them to halt,grey dawn allow halt
485,"Pippin, Merry, and Sam were by that time nearly asleep on their stumbling legs; and even Strider seemed by the sag of his shoulders to be weary.",pippin merry and sam were by that time nearly asleep on their stumbling legs and even strider seemed by the sag of his shoulders to be weary,pippin merry sam time nearly asleep stumbling legs even strider seemed sag shoulders weary
486,Frodo sat upon the horse in a dark dream.,frodo sat upon the horse in a dark dream,frodo sat upon horse dark dream
487,"They cast themselves down in the heather a few yards from the road-side, and fell asleep immediately.",they cast themselves down in the heather a few yards from the roadside and fell asleep immediately,cast heather yards roadside fell asleep immediately
488,"They seemed hardly to have closed their eyes when Glorfindel, who had set himself to watch while they slept, awoke them again.",they seemed hardly to have closed their eyes when glorfindel who had set himself to watch while they slept awoke them again,seemed hardly closed eyes glorfindel set watch slept awoke
489,"The sun had now climbed far into the morning, and the clouds and mists of the night were gone.",the sun had now climbed far into the morning and the clouds and mists of the night were gone,sun climbed far morning clouds mists night gone
490,'Drink this!',drink this,drink
491,"said Glorfindel to them, pouring for each in turn a little liquor from his silver-studded flask of leather.",said glorfindel to them pouring for each in turn a little liquor from his silverstudded flask of leather,said glorfindel pouring turn little liquor silverstudded flask leather
492,"It was clear as spring water and had no taste, and it did not feel either cool or warm in the mouth; but strength and vigour seemed to flow into all their limbs as they drank it.",it was clear as spring water and had no taste and it did not feel either cool or warm in the mouth but strength and vigour seemed to flow into all their limbs as they drank it,clear spring water taste feel either cool warm mouth strength vigour seemed flow limbs drank
493,Eaten after that draught the stale bread and dried fruit (which was now all that they had left) seemed to satisfy their hunger better than many a good breakfast in the Shire had done.,eaten after that draught the stale bread and dried fruit which was now all that they had left seemed to satisfy their hunger better than many a good breakfast in the shire had done,eaten draught stale bread dried fruit left seemed satisfy hunger better many good breakfast shire done
494,They had rested rather less than five hours when they took to the Road again.,they had rested rather less than five hours when they took to the road again,rested rather less five hours took road
495,"Glorfindel still urged them on, and only allowed two brief halts during the day's march.",glorfindel still urged them on and only allowed two brief halts during the days march,glorfindel still urged allowed two brief halts days march
496,"In this way they covered almost twenty miles before nightfall, and came to a point where the Road bent right and ran down towards the bottom of the valley, now making straight for the Bruinen.",in this way they covered almost twenty miles before nightfall and came to a point where the road bent right and ran down towards the bottom of the valley now making straight for the bruinen,way covered almost twenty miles nightfall came point road bent right ran towards bottom valley making straight bruinen
497,"So far there had been no sign or sound of pursuit that the hobbits could see or hear; but often Glorfindel would halt and listen for a moment, if they lagged behind, and a look of anxiety clouded his face.",so far there had been no sign or sound of pursuit that the hobbits could see or hear but often glorfindel would halt and listen for a moment if they lagged behind and a look of anxiety clouded his face,far sign sound pursuit hobbits could see hear often glorfindel would halt listen moment lagged behind look anxiety clouded face
498,Once or twice he spoke to Strider in the elf-tongue.,once or twice he spoke to strider in the elftongue,twice spoke strider elftongue
499,"But however anxious their guides might be, it was plain that the hobbits could go no further that night.",but however anxious their guides might be it was plain that the hobbits could go no further that night,however anxious guides might plain hobbits could go night
500,"They were stumbling along dizzy with weariness, and unable to think of anything but their feet and legs.",they were stumbling along dizzy with weariness and unable to think of anything but their feet and legs,stumbling along dizzy weariness unable think anything feet legs
501,"Frodo's pain had redoubled, and during the day things about him faded to shadows of ghostly grey.",frodos pain had redoubled and during the day things about him faded to shadows of ghostly grey,frodos pain redoubled day things faded shadows ghostly grey
502,"He almost welcomed the coming of night, for then the world seemed less pale and empty.",he almost welcomed the coming of night for then the world seemed less pale and empty,almost welcomed coming night world seemed less pale empty
503,"The hobbits were still weary, when they set out again early next morning.",the hobbits were still weary when they set out again early next morning,hobbits still weary set early next morning
504,"There were many miles yet to go between them and the Ford, and they hobbled forward at the best pace they could manage.",there were many miles yet to go between them and the ford and they hobbled forward at the best pace they could manage,many miles yet go ford hobbled forward best pace could manage
505,"'Our peril will be greatest just ere we reach the river,' said Glorfindel; 'for my heart warns me that the pursuit is now swift behind us, and other danger may be waiting by the Ford.'",our peril will be greatest just ere we reach the river said glorfindel for my heart warns me that the pursuit is now swift behind us and other danger may be waiting by the ford,peril greatest ere reach river said glorfindel heart warns pursuit swift behind us danger may waiting ford
506,"The Road was still running steadily downhill, and there was now in places much grass at either side, in which the hobbits walked when they could, to ease their tired feet.",the road was still running steadily downhill and there was now in places much grass at either side in which the hobbits walked when they could to ease their tired feet,road still running steadily downhill places much grass either side hobbits walked could ease tired feet
507,"In the late afternoon they came to a place where the Road went suddenly under the dark shadow of tall pine-trees, and then plunged into a deep cutting with steep moist walls of red stone.",in the late afternoon they came to a place where the road went suddenly under the dark shadow of tall pinetrees and then plunged into a deep cutting with steep moist walls of red stone,late afternoon came place road went suddenly dark shadow tall pinetrees plunged deep cutting steep moist walls red stone
508,Echoes ran along as they hurried forward; and there seemed to be a sound of many footfalls following their own.,echoes ran along as they hurried forward and there seemed to be a sound of many footfalls following their own,echoes ran along hurried forward seemed sound many footfalls following
