sentence_id,sentence,cleaned_sentence,tokens
0,"_
            Flight to the Ford

     When Frodo came to himself he was still clutching the Ring desperately.",flight to the ford when frodo came to himself he was still clutching the ring desperately,flight ford frodo came still clutching ring desperately
1,"He was lying by the fire, which was now piled high and burning brightly.",he was lying by the fire which was now piled high and burning brightly,lying fire piled high burning brightly
2,His three companions were bending over him.,his three companions were bending over him,three companions bending
3,'What has happened?,what has happened,happened
4,Where is the pale king?',where is the pale king,pale king
5,he asked wildly.,he asked wildly,asked wildly
6,They were too overjoyed to hear him speak to answer for a while; nor did they understand his question.,they were too overjoyed to hear him speak to answer for a while nor did they understand his question,overjoyed hear speak answer understand question
7,At length he gathered from Sam that they had seen nothing but the vague shadowy shapes coming towards them.,at length he gathered from sam that they had seen nothing but the vague shadowy shapes coming towards them,length gathered sam seen nothing vague shadowy shapes coming towards
8,"Suddenly to his horror Sam found that his master had vanished; and at that moment a black shadow rushed past him, and he fell.",suddenly to his horror sam found that his master had vanished and at that moment a black shadow rushed past him and he fell,suddenly horror sam found master vanished moment black shadow rushed past fell
9,"He heard Frodo's voice, but it seemed to come from a great distance, or from under the earth, crying out strange words.",he heard frodos voice but it seemed to come from a great distance or from under the earth crying out strange words,heard frodos voice seemed come great distance earth crying strange words
10,"They saw nothing more, until they stumbled over the body of Frodo, lying as if dead, face downwards on the grass with his sword beneath him.",they saw nothing more until they stumbled over the body of frodo lying as if dead face downwards on the grass with his sword beneath him,saw nothing stumbled body frodo lying dead face downwards grass sword beneath
11,"Strider ordered them to pick him up and lay him near the fire, and then he disappeared.",strider ordered them to pick him up and lay him near the fire and then he disappeared,strider ordered pick lay near fire disappeared
12,That was now a good while ago.,that was now a good while ago,good ago
13,"Sam plainly was beginning to have doubts again about Strider; but while they were talking he returned, appearing suddenly out of the shadows.",sam plainly was beginning to have doubts again about strider but while they were talking he returned appearing suddenly out of the shadows,sam plainly beginning doubts strider talking returned appearing suddenly shadows
14,"They started, and Sam drew his sword and stood over Frodo; but Strider knelt down swiftly at his side.",they started and sam drew his sword and stood over frodo but strider knelt down swiftly at his side,started sam drew sword stood frodo strider knelt swiftly side
15,"'I am not a Black Rider, Sam,' he said gently, 'nor in league with them.",i am not a black rider sam he said gently nor in league with them,black rider sam said gently league
16,I have been trying to discover something of their movements; but I have found nothing.,i have been trying to discover something of their movements but i have found nothing,trying discover something movements found nothing
17,I cannot think why they have gone and do not attack again.,i cannot think why they have gone and do not attack again,think gone attack
18,But there is no feeling of their presence anywhere at hand.',but there is no feeling of their presence anywhere at hand,feeling presence anywhere hand
19,"When he heard what Frodo had to tell, he became full of concern, and shook his head and sighed.",when he heard what frodo had to tell he became full of concern and shook his head and sighed,heard frodo tell became full concern shook head sighed
20,"Then he ordered Pippin and Merry to heat as much water as they could in their small kettles, and to bathe the wound with it.",then he ordered pippin and merry to heat as much water as they could in their small kettles and to bathe the wound with it,ordered pippin merry heat much water could small kettles bathe wound
21,"'Keep the fire going well, and keep Frodo warm!'",keep the fire going well and keep frodo warm,keep fire going well keep frodo warm
22,he said.,he said,said
23,"Then he got up and walked away, and called Sam to him.",then he got up and walked away and called sam to him,got walked away called sam
24,"'I think I understand things better now,' he said in a low voice.",i think i understand things better now he said in a low voice,think understand things better said low voice
25,'There seem only to have been five of the enemy.,there seem only to have been five of the enemy,seem five enemy
26,"Why they were not all here, I don't know; but I don't think they expected to be resisted.",why they were not all here i dont know but i dont think they expected to be resisted,dont know dont think expected resisted
27,They have drawn off for the time being.,they have drawn off for the time being,drawn time
28,"But not far, I fear.",but not far i fear,far fear
29,"They will come again another night, if we cannot escape.",they will come again another night if we cannot escape,come another night escape
30,"They are only waiting, because they think that their purpose is almost accomplished, and that the Ring cannot fly much further.",they are only waiting because they think that their purpose is almost accomplished and that the ring cannot fly much further,waiting think purpose almost accomplished ring fly much
31,"I fear, Sam, that they believe your master has a deadly wound that will subdue him to their will.",i fear sam that they believe your master has a deadly wound that will subdue him to their will,fear sam believe master deadly wound subdue
32,We shall see!',we shall see,shall see
33,Sam choked with tears.,sam choked with tears,sam choked tears
34,'Don't despair!',dont despair,dont despair
35,said Strider.,said strider,said strider
36,'You must trust me now.,you must trust me now,must trust
37,"Your Frodo is made of sterner stuff than I had guessed, though Gandalf hinted that it might prove so.",your frodo is made of sterner stuff than i had guessed though gandalf hinted that it might prove so,frodo made sterner stuff guessed though gandalf hinted might prove
38,"He is not slain, and I think he will resist the evil power of the wound longer than his enemies expect.",he is not slain and i think he will resist the evil power of the wound longer than his enemies expect,slain think resist evil power wound longer enemies expect
39,I will do all I can to help and heal him.,i will do all i can to help and heal him,help heal
40,"Guard him well, while I am away!'",guard him well while i am away,guard well away
41,He hurried off and disappeared again into the darkness.,he hurried off and disappeared again into the darkness,hurried disappeared darkness
42,"Frodo dozed, though the pain of his wound was slowly growing, and a deadly chill was spreading from his shoulder to his arm and side.",frodo dozed though the pain of his wound was slowly growing and a deadly chill was spreading from his shoulder to his arm and side,frodo dozed though pain wound slowly growing deadly chill spreading shoulder arm side
43,"His friends watched over him, warming him, and bathing his wound.",his friends watched over him warming him and bathing his wound,friends watched warming bathing wound
44,The night passed slowly and wearily.,the night passed slowly and wearily,night passed slowly wearily
45,"Dawn was growing in the sky, and the dell was filling with grey light, when Strider at last returned.",dawn was growing in the sky and the dell was filling with grey light when strider at last returned,dawn growing sky dell filling grey light strider last returned
46,'Look!',look,look
47,he cried; and stooping he lifted from the ground a black cloak that had lain there hidden by the darkness.,he cried and stooping he lifted from the ground a black cloak that had lain there hidden by the darkness,cried stooping lifted ground black cloak lain hidden darkness
48,A foot above the lower hem there was a slash.,a foot above the lower hem there was a slash,foot lower hem slash
49,"'This was the stroke of Frodo's sword,' he said.",this was the stroke of frodos sword he said,stroke frodos sword said
50,"'The only hurt that it did to his enemy, I fear; for it is unharmed, but all blades perish that pierce that dreadful King.",the only hurt that it did to his enemy i fear for it is unharmed but all blades perish that pierce that dreadful king,hurt enemy fear unharmed blades perish pierce dreadful king
51,More deadly to him was the name of Elbereth.',more deadly to him was the name of elbereth,deadly name elbereth
52,'And more deadly to Frodo was this!',and more deadly to frodo was this,deadly frodo
53,He stooped again and lifted up a long thin knife.,he stooped again and lifted up a long thin knife,stooped lifted long thin knife
54,There was a cold gleam in it.,there was a cold gleam in it,cold gleam
55,As Strider raised it they saw that near the end its edge was notched and the point was broken off.,as strider raised it they saw that near the end its edge was notched and the point was broken off,strider raised saw near end edge notched point broken
56,"But even as he held it up in the growing light, they gazed in astonishment, for the blade seemed to melt, and vanished like a smoke in the air, leaving only the hilt in Strider's hand.",but even as he held it up in the growing light they gazed in astonishment for the blade seemed to melt and vanished like a smoke in the air leaving only the hilt in striders hand,even held growing light gazed astonishment blade seemed melt vanished like smoke air leaving hilt striders hand
57,'Alas!',alas,alas
58,he cried.,he cried,cried
59,'It was this accursed knife that gave the wound.,it was this accursed knife that gave the wound,accursed knife gave wound
60,Few now have the skill in healing to match such evil weapons.,few now have the skill in healing to match such evil weapons,skill healing match evil weapons
61,But I will do what I can.',but i will do what i can,
62,"He sat down on the ground, and taking the dagger-hilt laid it on his knees, and he sang over it a slow song in a strange tongue.",he sat down on the ground and taking the daggerhilt laid it on his knees and he sang over it a slow song in a strange tongue,sat ground taking daggerhilt laid knees sang slow song strange tongue
63,"Then setting it aside, he turned to Frodo and in a soft tone spoke words the others could not catch.",then setting it aside he turned to frodo and in a soft tone spoke words the others could not catch,setting aside turned frodo soft tone spoke words others could catch
64,From the pouch at his belt he drew out the long leaves of a plant.,from the pouch at his belt he drew out the long leaves of a plant,pouch belt drew long leaves plant
65,"'These leaves,' he said, 'I have walked far to find; for this plant does not grow in the bare hills; but in the thickets away south of the Road I found it in the dark by the scent of its leaves.'",these leaves he said i have walked far to find for this plant does not grow in the bare hills but in the thickets away south of the road i found it in the dark by the scent of its leaves,leaves said walked far find plant grow bare hills thickets away south road found dark scent leaves
66,"He crushed a leaf in his fingers, and it gave out a sweet and pungent fragrance.",he crushed a leaf in his fingers and it gave out a sweet and pungent fragrance,crushed leaf fingers gave sweet pungent fragrance
67,"'It is fortunate that I could find it, for it is a healing plant that the Men of the West brought to Middle-earth.",it is fortunate that i could find it for it is a healing plant that the men of the west brought to middleearth,fortunate could find healing plant men west brought middleearth
68,"_Athelas_ they named it, and it grows now sparsely and only near places where they dwelt or camped of old; and it is not known in the North, except to some of those who wander in the Wild.",athelas they named it and it grows now sparsely and only near places where they dwelt or camped of old and it is not known in the north except to some of those who wander in the wild,athelas named grows sparsely near places dwelt camped old known north except wander wild
69,"It has great virtues, but over such a wound as this its healing powers may be small.'",it has great virtues but over such a wound as this its healing powers may be small,great virtues wound healing powers may small
70,He threw the leaves into boiling water and bathed Frodo's shoulder.,he threw the leaves into boiling water and bathed frodos shoulder,threw leaves boiling water bathed frodos shoulder
71,"The fragrance of the steam was refreshing, and those that were unhurt felt their minds calmed and cleared.",the fragrance of the steam was refreshing and those that were unhurt felt their minds calmed and cleared,fragrance steam refreshing unhurt felt minds calmed cleared
72,"The herb had also some power over the wound, for Frodo felt the pain and also the sense of frozen cold lessen in his side; but the life did not return to his arm, and he could not raise or use his hand.",the herb had also some power over the wound for frodo felt the pain and also the sense of frozen cold lessen in his side but the life did not return to his arm and he could not raise or use his hand,herb also power wound frodo felt pain also sense frozen cold lessen side life return arm could raise use hand
73,"He bitterly regretted his foolishness, and reproached himself for weakness of will; for he now perceived that in putting on the Ring he obeyed not his own desire but the commanding wish of his enemies.",he bitterly regretted his foolishness and reproached himself for weakness of will for he now perceived that in putting on the ring he obeyed not his own desire but the commanding wish of his enemies,bitterly regretted foolishness reproached weakness perceived putting ring obeyed desire commanding wish enemies
74,"He wondered if he would remain maimed for life, and how they would now manage to continue their journey.",he wondered if he would remain maimed for life and how they would now manage to continue their journey,wondered would remain maimed life would manage continue journey
75,He fell too weak to stand.,he fell too weak to stand,fell weak stand
76,The others were discussing this very question.,the others were discussing this very question,others discussing question
77,They quickly decided to leave Weathertop as soon as possible.,they quickly decided to leave weathertop as soon as possible,quickly decided leave weathertop soon possible
78,"'I think now,' said Strider, 'that the enemy has been watching this place for some days.",i think now said strider that the enemy has been watching this place for some days,think said strider enemy watching place days
79,"If Gandalf ever came here, then he must have been forced to ride away, and he will not return.",if gandalf ever came here then he must have been forced to ride away and he will not return,gandalf ever came must forced ride away return
80,"In any case we are in great peril here after dark, since the attack of last night, and we can hardly meet greater danger wherever we go.'",in any case we are in great peril here after dark since the attack of last night and we can hardly meet greater danger wherever we go,case great peril dark since attack last night hardly meet greater danger wherever go
81,"As soon as the daylight was full, they had some hurried food and packed.",as soon as the daylight was full they had some hurried food and packed,soon daylight full hurried food packed
82,"It was impossible for Frodo to walk, so they divided the greater part of their baggage among the four of them, and put Frodo on the pony.",it was impossible for frodo to walk so they divided the greater part of their baggage among the four of them and put frodo on the pony,impossible frodo walk divided greater part baggage among four put frodo pony
83,"In the last few days the poor beast had improved wonderfully; it already seemed fatter and stronger, and had begun to show an affection for its new masters, especially for Sam.",in the last few days the poor beast had improved wonderfully it already seemed fatter and stronger and had begun to show an affection for its new masters especially for sam,last days poor beast improved wonderfully already seemed fatter stronger begun show affection new masters especially sam
84,Bill Ferny's treatment must have been very hard for the journey in the wild to seem so much better than its former life.,bill fernys treatment must have been very hard for the journey in the wild to seem so much better than its former life,bill fernys treatment must hard journey wild seem much better former life
85,They started off in a southerly direction.,they started off in a southerly direction,started southerly direction
86,"This would mean crossing the Road, but.",this would mean crossing the road but,would mean crossing road
87,it was the quickest way to more wooded country.,it was the quickest way to more wooded country,quickest way wooded country
88,"And they needed fuel; for Strider said that Frodo must be kept warm, especially at night, while fire would be some protection for them all.",and they needed fuel for strider said that frodo must be kept warm especially at night while fire would be some protection for them all,needed fuel strider said frodo must kept warm especially night fire would protection
89,It was also his plan to shorten their journey by cutting across another great loop of the Road: east beyond Weathertop it changed its course and took a wide bend northwards.,it was also his plan to shorten their journey by cutting across another great loop of the road east beyond weathertop it changed its course and took a wide bend northwards,also plan shorten journey cutting across another great loop road east beyond weathertop changed course took wide bend northwards
90,"They made their way slowly and cautiously round the south-western slopes of the hill, and came in a little while to the edge of the Road.",they made their way slowly and cautiously round the southwestern slopes of the hill and came in a little while to the edge of the road,made way slowly cautiously round southwestern slopes hill came little edge road
91,There was no sign of the Riders.,there was no sign of the riders,sign riders
92,But even as they were hurrying across they heard far away two cries: a cold voice calling and a cold voice answering.,but even as they were hurrying across they heard far away two cries a cold voice calling and a cold voice answering,even hurrying across heard far away two cries cold voice calling cold voice answering
93,"Trembling they sprang forward, and made for the thickets that lay ahead.",trembling they sprang forward and made for the thickets that lay ahead,trembling sprang forward made thickets lay ahead
94,"The land before them sloped away southwards, but it was wild and pathless; bushes and stunted trees grew in dense patches with wide barren spaces in between.",the land before them sloped away southwards but it was wild and pathless bushes and stunted trees grew in dense patches with wide barren spaces in between,land sloped away southwards wild pathless bushes stunted trees grew dense patches wide barren spaces
95,"The grass was scanty, coarse, and grey; and the leaves in the thickets were faded and falling.",the grass was scanty coarse and grey and the leaves in the thickets were faded and falling,grass scanty coarse grey leaves thickets faded falling
96,"It was a cheerless land, and their journey was slow and gloomy.",it was a cheerless land and their journey was slow and gloomy,cheerless land journey slow gloomy
97,They spoke little as they trudged along.,they spoke little as they trudged along,spoke little trudged along
98,"Frodo's heart was grieved as he watched them walking beside him with their heads down, and their backs bowed under their burdens.",frodos heart was grieved as he watched them walking beside him with their heads down and their backs bowed under their burdens,frodos heart grieved watched walking beside heads backs bowed burdens
99,Even Strider seemed tired and heavy-hearted.,even strider seemed tired and heavyhearted,even strider seemed tired heavyhearted
100,"Before the first day's march was over Frodo's pain began to grow again, but he did not speak of it for a long time.",before the first days march was over frodos pain began to grow again but he did not speak of it for a long time,first days march frodos pain began grow speak long time
101,"Four days passed, without the ground or the scene changing much, except that behind them Weathertop slowly sank, and before them the distant mountains loomed a little nearer.",four days passed without the ground or the scene changing much except that behind them weathertop slowly sank and before them the distant mountains loomed a little nearer,four days passed without ground scene changing much except behind weathertop slowly sank distant mountains loomed little nearer
102,Yet since that far cry they had seen and heard no sign that the enemy had marked their flight or followed them.,yet since that far cry they had seen and heard no sign that the enemy had marked their flight or followed them,yet since far cry seen heard sign enemy marked flight followed
103,"They dreaded the dark hours, and kept watch in pairs by night, expecting at any time to see black shapes stalking in the grey night, dimly lit by the cloud-veiled moon; but they saw nothing, and heard no sound but the sigh of withered leaves and grass.",they dreaded the dark hours and kept watch in pairs by night expecting at any time to see black shapes stalking in the grey night dimly lit by the cloudveiled moon but they saw nothing and heard no sound but the sigh of withered leaves and grass,dreaded dark hours kept watch pairs night expecting time see black shapes stalking grey night dimly lit cloudveiled moon saw nothing heard sound sigh withered leaves grass
104,Not once did they feel the sense of present evil that had assailed them before the attack in the dell.,not once did they feel the sense of present evil that had assailed them before the attack in the dell,feel sense present evil assailed attack dell
105,It seemed too much to hope that the Riders had already lost their trail again.,it seemed too much to hope that the riders had already lost their trail again,seemed much hope riders already lost trail
106,Perhaps they were waiting to make some ambush in a narrow place?,perhaps they were waiting to make some ambush in a narrow place,perhaps waiting make ambush narrow place
107,At the end of the fifth day the ground began once more to rise slowly out of the wide shallow valley into which they had descended.,at the end of the fifth day the ground began once more to rise slowly out of the wide shallow valley into which they had descended,end fifth day ground began rise slowly wide shallow valley descended
108,"Strider now turned their course again north-eastwards, and on the sixth day they reached the top of a long slow-climbing slope, and saw far ahead a huddle of wooded hills.",strider now turned their course again northeastwards and on the sixth day they reached the top of a long slowclimbing slope and saw far ahead a huddle of wooded hills,strider turned course northeastwards sixth day reached top long slowclimbing slope saw far ahead huddle wooded hills
109,Away below them they could see the Road sweeping round the feet of the hills; and to their right a grey river gleamed pale in the thin sunshine.,away below them they could see the road sweeping round the feet of the hills and to their right a grey river gleamed pale in the thin sunshine,away could see road sweeping round feet hills right grey river gleamed pale thin sunshine
110,In the distance they glimpsed yet another river in a stony valley half-veiled in mist.,in the distance they glimpsed yet another river in a stony valley halfveiled in mist,distance glimpsed yet another river stony valley halfveiled mist
111,"""I am afraid we must go back to the Road here for a while,' said Strider.",i am afraid we must go back to the road here for a while said strider,afraid must go back road said strider
112,"'We have now come to the River Hoarwell, that the Elves call Mitheithel.",we have now come to the river hoarwell that the elves call mitheithel,come river hoarwell elves call mitheithel
113,"It flows down out of the Ettenmoors, the troll-fells north of Rivendell, and joins the Loudwater away in the South.",it flows down out of the ettenmoors the trollfells north of rivendell and joins the loudwater away in the south,flows ettenmoors trollfells north rivendell joins loudwater away south
114,Some call it the Greyflood after that.,some call it the greyflood after that,call greyflood
115,It is a great water before it finds the Sea.,it is a great water before it finds the sea,great water finds sea
116,"There is no way over it below its sources in the Ettenmoors, except by the Last Bridge on which the Road crosses.'",there is no way over it below its sources in the ettenmoors except by the last bridge on which the road crosses,way sources ettenmoors except last bridge road crosses
117,'What is that other river we can see far away there?',what is that other river we can see far away there,river see far away
