sentence_id,sentence,cleaned_sentence,tokens
0,"_
            The Mirror of Galadriel

     The sun was sinking behind the mountains, and the shadows were deepening in the woods, when they went on again.",the mirror of galadriel the sun was sinking behind the mountains and the shadows were deepening in the woods when they went on again,mirror galadriel sun sinking behind mountains shadows deepening woods went
1,Their paths now went into thickets where the dusk had already gathered.,their paths now went into thickets where the dusk had already gathered,paths went thickets dusk already gathered
2,"Night came beneath the trees as they walked, and the Elves uncovered their silver lamps.",night came beneath the trees as they walked and the elves uncovered their silver lamps,night came beneath trees walked elves uncovered silver lamps
3,Suddenly they came out into the open again and found themselves under a pale evening sky pricked by a few early stars.,suddenly they came out into the open again and found themselves under a pale evening sky pricked by a few early stars,suddenly came open found pale evening sky pricked early stars
4,"There was a wide treeless space before them, running in a great circle and bending away on either hand.",there was a wide treeless space before them running in a great circle and bending away on either hand,wide treeless space running great circle bending away either hand
5,"Beyond it was a deep fosse lost in soft shadow, but the grass upon its brink was green, as if it glowed still in memory of the sun that had gone.",beyond it was a deep fosse lost in soft shadow but the grass upon its brink was green as if it glowed still in memory of the sun that had gone,beyond deep fosse lost soft shadow grass upon brink green glowed still memory sun gone
6,Upon the further side there rose to a great height a green wall encircling a green hill thronged with mallorn-trees taller than any they had yet seen in all the land.,upon the further side there rose to a great height a green wall encircling a green hill thronged with mallorntrees taller than any they had yet seen in all the land,upon side rose great height green wall encircling green hill thronged mallorntrees taller yet seen land
7,"Their height could not be guessed, but they stood up in the twilight like living towers.",their height could not be guessed but they stood up in the twilight like living towers,height could guessed stood twilight like living towers
8,"In their, many-tiered branches and amid their ever-moving leaves countless lights were gleaming, green and gold and silver.",in their manytiered branches and amid their evermoving leaves countless lights were gleaming green and gold and silver,manytiered branches amid evermoving leaves countless lights gleaming green gold silver
9,Haldir turned towards the Company.,haldir turned towards the company,haldir turned towards company
10,`Welcome to Caras Galadhon! ',welcome to caras galadhon,welcome caras galadhon
11,he said.,he said,said
12,'Here is the city of the Galadhrim where dwell the Lord Celeborn and Galadriel the Lady of Lórien.,here is the city of the galadhrim where dwell the lord celeborn and galadriel the lady of lorien,city galadhrim dwell lord celeborn galadriel lady lorien
13,"But we cannot enter here, for the gates do not look northward.",but we cannot enter here for the gates do not look northward,enter gates look northward
14,"We must go round to the southern side, and the way is not short, for the city is great.'",we must go round to the southern side and the way is not short for the city is great,must go round southern side way short city great
15,There was a road paved with white stone running on the outer brink of the fosse.,there was a road paved with white stone running on the outer brink of the fosse,road paved white stone running outer brink fosse
16,"Along this they went westward, with the city ever climbing up like a green cloud upon their left; and as the night deepened more lights sprang forth, until all the hill seemed afire with stars.",along this they went westward with the city ever climbing up like a green cloud upon their left and as the night deepened more lights sprang forth until all the hill seemed afire with stars,along went westward city ever climbing like green cloud upon left night deepened lights sprang forth hill seemed afire stars
17,"They came at last to a white bridge, and crossing found the great gates of the city: they faced south-west, set between the ends of the encircling wall that here overlapped, and they were tall and strong, and hung with many lamps.",they came at last to a white bridge and crossing found the great gates of the city they faced southwest set between the ends of the encircling wall that here overlapped and they were tall and strong and hung with many lamps,came last white bridge crossing found great gates city faced southwest set ends encircling wall overlapped tall strong hung many lamps
18,"Haldir knocked and spoke, and the gates opened soundlessly; but of guards Frodo could see no sign.",haldir knocked and spoke and the gates opened soundlessly but of guards frodo could see no sign,haldir knocked spoke gates opened soundlessly guards frodo could see sign
19,"The travellers passed within, and the gates shut behind them.",the travellers passed within and the gates shut behind them,travellers passed within gates shut behind
20,"They were in a deep lane between the ends of the wall, and passing quickly through it they entered the City of the Trees.",they were in a deep lane between the ends of the wall and passing quickly through it they entered the city of the trees,deep lane ends wall passing quickly entered city trees
21,"No folk could they see, nor hear any feet upon the paths; but there were many voices, about them, and in the air above.",no folk could they see nor hear any feet upon the paths but there were many voices about them and in the air above,folk could see hear feet upon paths many voices air
22,Far away up on the hill they could hear the sound of singing falling from on high like soft rain upon leaves.,far away up on the hill they could hear the sound of singing falling from on high like soft rain upon leaves,far away hill could hear sound singing falling high like soft rain upon leaves
23,"They went along many paths and climbed many stairs, until they came to the high places and saw before them amid a wide lawn a fountain shimmering.",they went along many paths and climbed many stairs until they came to the high places and saw before them amid a wide lawn a fountain shimmering,went along many paths climbed many stairs came high places saw amid wide lawn fountain shimmering
24,"It was lit by silver lamps that swung from the boughs of trees, and it fell into a basin of silver, from which a white stream spilled.",it was lit by silver lamps that swung from the boughs of trees and it fell into a basin of silver from which a white stream spilled,lit silver lamps swung boughs trees fell basin silver white stream spilled
25,"Upon the south side of the lawn there stood the mightiest of all the trees; its great smooth bole gleamed like grey silk, and up it towered, until its first branches, far above, opened their huge limbs under shadowy clouds of leaves.",upon the south side of the lawn there stood the mightiest of all the trees its great smooth bole gleamed like grey silk and up it towered until its first branches far above opened their huge limbs under shadowy clouds of leaves,upon south side lawn stood mightiest trees great smooth bole gleamed like grey silk towered first branches far opened huge limbs shadowy clouds leaves
26,"Beside it a broad white ladder stood, and at its foot three Elves were seated.",beside it a broad white ladder stood and at its foot three elves were seated,beside broad white ladder stood foot three elves seated
27,"They sprang up as the travellers approached, and Frodo saw that they were tall and clad in grey mail, and from their shoulders hung long white cloaks.",they sprang up as the travellers approached and frodo saw that they were tall and clad in grey mail and from their shoulders hung long white cloaks,sprang travellers approached frodo saw tall clad grey mail shoulders hung long white cloaks
28,"'Here dwell Celeborn and Galadriel,' said Haldir.",here dwell celeborn and galadriel said haldir,dwell celeborn galadriel said haldir
29,`It is their wish that you should ascend and speak with them.',it is their wish that you should ascend and speak with them,wish ascend speak
30,"One of the Elf-wardens then blew a clear note on a small horn, and it was answered three times from far above.",one of the elfwardens then blew a clear note on a small horn and it was answered three times from far above,one elfwardens blew clear note small horn answered three times far
31,"`I will go first,' said Haldir.",i will go first said haldir,go first said haldir
32,'Let Frodo come next and with him Legolas.,let frodo come next and with him legolas,let frodo come next legolas
33,The others may follow as they wish.,the others may follow as they wish,others may follow wish
34,"It is a long climb for those that are not accustomed to such stairs, but you may rest upon the way.'",it is a long climb for those that are not accustomed to such stairs but you may rest upon the way,long climb accustomed stairs may rest upon way
35,"As he climbed slowly up Frodo passed many flets: some on one side, some on another, and some set about the bole of the tree, so that the ladder passed through them.",as he climbed slowly up frodo passed many flets some on one side some on another and some set about the bole of the tree so that the ladder passed through them,climbed slowly frodo passed many flets one side another set bole tree ladder passed
36,"At a great height above the ground he came to a wide _talan_, like the deck of a great ship.",at a great height above the ground he came to a wide talan like the deck of a great ship,great height ground came wide talan like deck great ship
37,"On it was built a house, so large that almost it would have served for a hall of Men upon the earth.",on it was built a house so large that almost it would have served for a hall of men upon the earth,built house large almost would served hall men upon earth
38,"He entered behind Haldir, and found that he was in a chamber of oval shape, in the midst of which grew the trunk of the great mallorn, now tapering towards its crown, and yet making still a pillar of wide girth.",he entered behind haldir and found that he was in a chamber of oval shape in the midst of which grew the trunk of the great mallorn now tapering towards its crown and yet making still a pillar of wide girth,entered behind haldir found chamber oval shape midst grew trunk great mallorn tapering towards crown yet making still pillar wide girth
39,The chamber was filled with a soft light; its walls were green and silver and its roof of gold.,the chamber was filled with a soft light its walls were green and silver and its roof of gold,chamber filled soft light walls green silver roof gold
40,Many Elves were seated there.,many elves were seated there,many elves seated
41,"On two chairs beneath the bole of the tree and canopied by a living bough there sat, side by side, Celeborn and Galadriel.",on two chairs beneath the bole of the tree and canopied by a living bough there sat side by side celeborn and galadriel,two chairs beneath bole tree canopied living bough sat side side celeborn galadriel
42,"They stood up to greet their guests, after the manner of Elves, even those who were accounted mighty kings.",they stood up to greet their guests after the manner of elves even those who were accounted mighty kings,stood greet guests manner elves even accounted mighty kings
43,"Very tall they were, and the Lady no less tall than the Lord; and they were grave and beautiful.",very tall they were and the lady no less tall than the lord and they were grave and beautiful,tall lady less tall lord grave beautiful
44,"They were clad wholly in white; and the hair of the Lady was of deep gold, and the hair of the Lord Celeborn was of silver long and bright; but no sign of age was upon them, unless it were in the depths of their eyes; for these were keen as lances in the starlight, and yet profound, the wells of deep memory.",they were clad wholly in white and the hair of the lady was of deep gold and the hair of the lord celeborn was of silver long and bright but no sign of age was upon them unless it were in the depths of their eyes for these were keen as lances in the starlight and yet profound the wells of deep memory,clad wholly white hair lady deep gold hair lord celeborn silver long bright sign age upon unless depths eyes keen lances starlight yet profound wells deep memory
45,"Haldir led Frodo before them, and the Lord welcomed him in his own tongue.",haldir led frodo before them and the lord welcomed him in his own tongue,haldir led frodo lord welcomed tongue
46,The Lady Galadriel said no word but looked long upon his face.,the lady galadriel said no word but looked long upon his face,lady galadriel said word looked long upon face
47,"`Sit now beside my chair, Frodo of the Shire! '",sit now beside my chair frodo of the shire,sit beside chair frodo shire
48,said Celeborn.,said celeborn,said celeborn
49,`When all have come we will speak together.',when all have come we will speak together,come speak together
50,Each of the companions he greeted courteously by name as they entered.,each of the companions he greeted courteously by name as they entered,companions greeted courteously name entered
51,`Welcome Aragorn son of Arathorn! ',welcome aragorn son of arathorn,welcome aragorn son arathorn
52,he said.,he said,said
53,`It is eight and thirty years of the world outside since you came to this land; and those years lie heavy on you.,it is eight and thirty years of the world outside since you came to this land and those years lie heavy on you,eight thirty years world outside since came land years lie heavy
54,"But the end is near, for good or ill.",but the end is near for good or ill,end near good ill
55,Here lay aside your burden for a while! ',here lay aside your burden for a while,lay aside burden
56,'Welcome son of Thranduil!,welcome son of thranduil,welcome son thranduil
57,Too seldom do my kindred journey hither from the North.',too seldom do my kindred journey hither from the north,seldom kindred journey hither north
58,`Welcome Gimli son of Glóin!,welcome gimli son of gloin,welcome gimli son gloin
59,It is long indeed since we saw one of Durin's folk in Caras Galadhon.,it is long indeed since we saw one of durins folk in caras galadhon,long indeed since saw one durins folk caras galadhon
60,But today we have broken our long law.,but today we have broken our long law,today broken long law
61,"May it be a sign that though the world is now dark better days are at hand, and that friendship shall be renewed between our peoples.'",may it be a sign that though the world is now dark better days are at hand and that friendship shall be renewed between our peoples,may sign though world dark better days hand friendship shall renewed peoples
62,Gimli bowed low.,gimli bowed low,gimli bowed low
63,When all the guests were seated before his chair the Lord looked at them again.,when all the guests were seated before his chair the lord looked at them again,guests seated chair lord looked
64,"'Here there are eight,' he said.",here there are eight he said,eight said
65,`Nine were to set out: so said the messages.,nine were to set out so said the messages,nine set said messages
66,But maybe there has been some change of counsel that we have not heard.,but maybe there has been some change of counsel that we have not heard,maybe change counsel heard
67,"Elrond is far away, and darkness gathers between us, and all this year the shadows have grown longer.'",elrond is far away and darkness gathers between us and all this year the shadows have grown longer,elrond far away darkness gathers us year shadows grown longer
68,"`Nay, there was no change of counsel,' said the Lady Galadriel speaking for the first time.",nay there was no change of counsel said the lady galadriel speaking for the first time,nay change counsel said lady galadriel speaking first time
69,"Her voice was clear and musical, but deeper than woman's wont.",her voice was clear and musical but deeper than womans wont,voice clear musical deeper womans wont
70,"`Gandalf the Grey set out with the Company, but he did not pass the borders of this land.",gandalf the grey set out with the company but he did not pass the borders of this land,gandalf grey set company pass borders land
71,Now tell us where he is; for I much desired to speak with him again.,now tell us where he is for i much desired to speak with him again,tell us much desired speak
72,"But I cannot see him from afar, unless he comes within the fences of Lothlórien: a grey mist is about him, and the ways of his feet and of his mind are hidden from me.'",but i cannot see him from afar unless he comes within the fences of lothlorien a grey mist is about him and the ways of his feet and of his mind are hidden from me,see afar unless comes within fences lothlorien grey mist ways feet mind hidden
73,'Alas! ',alas,alas
74,said Aragorn.,said aragorn,said aragorn
75,`Gandalf the Grey fell into shadow.,gandalf the grey fell into shadow,gandalf grey fell shadow
76,He remained in Moria and did not escape.',he remained in moria and did not escape,remained moria escape
77,At these words all the Elves in the hall cried aloud in grief and amazement.,at these words all the elves in the hall cried aloud in grief and amazement,words elves hall cried aloud grief amazement
78,"`These are evil tidings,' said Celeborn, `the most evil that have been spoken here in long years full of grievous deeds.'",these are evil tidings said celeborn the most evil that have been spoken here in long years full of grievous deeds,evil tidings said celeborn evil spoken long years full grievous deeds
79,He turned to Haldir.,he turned to haldir,turned haldir
80,`Why has nothing of this been told to me before? ',why has nothing of this been told to me before,nothing told
81,he asked in the Elven-tongue.,he asked in the elventongue,asked elventongue
82,"'We have not spoken to Haldir of our deeds or our purpose,' said Legolas.",we have not spoken to haldir of our deeds or our purpose said legolas,spoken haldir deeds purpose said legolas
83,"`At first we were weary and danger was too close behind and afterwards we almost forgot our grief for a time, as we walked in gladness on the fair paths of Lórien.'",at first we were weary and danger was too close behind and afterwards we almost forgot our grief for a time as we walked in gladness on the fair paths of lorien,first weary danger close behind afterwards almost forgot grief time walked gladness fair paths lorien
84,"`Yet our grief is great and our loss cannot be mended,' said Frodo.",yet our grief is great and our loss cannot be mended said frodo,yet grief great loss mended said frodo
85,"'Gandalf was our guide, and he led us through Moria; and when our escape seemed beyond hope he saved us, and he fell.'",gandalf was our guide and he led us through moria and when our escape seemed beyond hope he saved us and he fell,gandalf guide led us moria escape seemed beyond hope saved us fell
86,'Tell us now the full tale! ',tell us now the full tale,tell us full tale
87,"said Celeborn:
     Then Aragorn recounted all that had happened upon the pass of Caradhras, and in the days that followed; and he spoke of Balin and his book, and the fight in the Chamber of Mazarbul, and the fire, and the narrow bridge, and the coming of the Terror.",said celeborn then aragorn recounted all that had happened upon the pass of caradhras and in the days that followed and he spoke of balin and his book and the fight in the chamber of mazarbul and the fire and the narrow bridge and the coming of the terror,said celeborn aragorn recounted happened upon pass caradhras days followed spoke balin book fight chamber mazarbul fire narrow bridge coming terror
88,"'An evil of the Ancient World it seemed, such as I have never seen before,' said Aragorn.",an evil of the ancient world it seemed such as i have never seen before said aragorn,evil ancient world seemed never seen said aragorn
89,"`It was both a shadow and a flame, strong and terrible.'",it was both a shadow and a flame strong and terrible,shadow flame strong terrible
90,"'It was a Balrog of Morgoth,' said Legolas; `of all elf-banes the most deadly, save the One who sits in the Dark Tower.'",it was a balrog of morgoth said legolas of all elfbanes the most deadly save the one who sits in the dark tower,balrog morgoth said legolas elfbanes deadly save one sits dark tower
91,"`Indeed I saw upon the bridge that which haunts our darkest dreams I saw Durin's Bane,' said Gimli in a low voice, and dread was in his eyes.",indeed i saw upon the bridge that which haunts our darkest dreams i saw durins bane said gimli in a low voice and dread was in his eyes,indeed saw upon bridge haunts darkest dreams saw durins bane said gimli low voice dread eyes
92,'Alas! ',alas,alas
93,said Celeborn.,said celeborn,said celeborn
94,`We long have feared that under Caradhras a terror slept.,we long have feared that under caradhras a terror slept,long feared caradhras terror slept
95,"But had I known that the Dwarves had stirred up this evil in Moria again, I would have forbidden you to pass the northern borders, you and all that went with you.",but had i known that the dwarves had stirred up this evil in moria again i would have forbidden you to pass the northern borders you and all that went with you,known dwarves stirred evil moria would forbidden pass northern borders went
96,"And if it were possible, one would say that at the last Gandalf fell from wisdom into folly, going needlessly into the net of Moria.'",and if it were possible one would say that at the last gandalf fell from wisdom into folly going needlessly into the net of moria,possible one would say last gandalf fell wisdom folly going needlessly net moria
97,"`He would be rash indeed that said that thing,' said Galadriel gravely.",he would be rash indeed that said that thing said galadriel gravely,would rash indeed said thing said galadriel gravely
98,`Needless were none of the deeds of Gandalf in life.,needless were none of the deeds of gandalf in life,needless none deeds gandalf life
99,Those that followed him knew not his mind and cannot report his full purpose.,those that followed him knew not his mind and cannot report his full purpose,followed knew mind report full purpose
100,"But however it may be with the guide, the followers are blameless.",but however it may be with the guide the followers are blameless,however may guide followers blameless
101,Do not repent of your welcome to the Dwarf.,do not repent of your welcome to the dwarf,repent welcome dwarf
102,"If our folk had been exiled long and far from Lothlórien, who of the Galadhrim, even Celeborn the Wise, would pass nigh and would not wish to look upon their ancient home, though it had become an abode of dragons?",if our folk had been exiled long and far from lothlorien who of the galadhrim even celeborn the wise would pass nigh and would not wish to look upon their ancient home though it had become an abode of dragons,folk exiled long far lothlorien galadhrim even celeborn wise would pass nigh would wish look upon ancient home though become abode dragons
103,"'Dark is the water of Kheled-zâram, and cold are the springs of Kibil-nâla, and fair were the many-pillared halls of Khazad-dûm in Elder Days before the fall of mighty kings beneath the stone.'",dark is the water of kheledzaram and cold are the springs of kibilnala and fair were the manypillared halls of khazaddum in elder days before the fall of mighty kings beneath the stone,dark water kheledzaram cold springs kibilnala fair manypillared halls khazaddum elder days fall mighty kings beneath stone
104,"She looked upon Gimli, who sat glowering and sad, and she smiled.",she looked upon gimli who sat glowering and sad and she smiled,looked upon gimli sat glowering sad smiled
105,"And the Dwarf, hearing the names given in his own ancient tongue, looked up and met her eyes; and it seemed to him that he looked suddenly into the heart of an enemy and saw there love and understanding.",and the dwarf hearing the names given in his own ancient tongue looked up and met her eyes and it seemed to him that he looked suddenly into the heart of an enemy and saw there love and understanding,dwarf hearing names given ancient tongue looked met eyes seemed looked suddenly heart enemy saw love understanding
106,"Wonder came into his face, and then he smiled in answer.",wonder came into his face and then he smiled in answer,wonder came face smiled answer
107,"He rose clumsily and bowed in dwarf-fashion, saying: `Yet more fair is the living land of Lórien, and the Lady Galadriel is above all the jewels that lie beneath the earth! '",he rose clumsily and bowed in dwarffashion saying yet more fair is the living land of lorien and the lady galadriel is above all the jewels that lie beneath the earth,rose clumsily bowed dwarffashion saying yet fair living land lorien lady galadriel jewels lie beneath earth
108,There was a silence.,there was a silence,silence
109,At length Celeborn spoke again.,at length celeborn spoke again,length celeborn spoke
110,"`I did not know that your plight was so evil,' he said.",i did not know that your plight was so evil he said,know plight evil said
111,`Let Gimli forget my harsh words: I spoke in the trouble of my heart.,let gimli forget my harsh words i spoke in the trouble of my heart,let gimli forget harsh words spoke trouble heart
