sentence_id,sentence,cleaned_sentence,tokens
112,"I will do what I can to aid you, each according to his wish and need, but especially that one of the little folk who bears the burden.'",i will do what i can to aid you each according to his wish and need but especially that one of the little folk who bears the burden,aid according wish need especially one little folk bears burden
113,"'Your quest is known to us,' said Galadriel, looking at Frodo.",your quest is known to us said galadriel looking at frodo,quest known us said galadriel looking frodo
114,`But we will not here speak of it more openly.,but we will not here speak of it more openly,speak openly
115,"Yet not in vain will it prove, maybe, that you came to this land seeking aid, as Gandalf himself plainly purposed.",yet not in vain will it prove maybe that you came to this land seeking aid as gandalf himself plainly purposed,yet vain prove maybe came land seeking aid gandalf plainly purposed
116,"For the Lord of the Galadhrim is accounted the wisest of the Elves of Middle-earth, and a giver of gifts beyond the power of kings.",for the lord of the galadhrim is accounted the wisest of the elves of middleearth and a giver of gifts beyond the power of kings,lord galadhrim accounted wisest elves middleearth giver gifts beyond power kings
117,"He has dwelt in the West since the days of dawn, and I have dwelt with him years uncounted; for ere the fall of Nargothrond or Gondolin I passed over the mountains, and together through ages of the world we have fought the long defeat.",he has dwelt in the west since the days of dawn and i have dwelt with him years uncounted for ere the fall of nargothrond or gondolin i passed over the mountains and together through ages of the world we have fought the long defeat,dwelt west since days dawn dwelt years uncounted ere fall nargothrond gondolin passed mountains together ages world fought long defeat
118,'I it was who first summoned the White Council.,i it was who first summoned the white council,first summoned white council
119,"And if my designs had not gone amiss, it would have been governed by Gandalf the Grey, and then mayhap things would have gone otherwise.",and if my designs had not gone amiss it would have been governed by gandalf the grey and then mayhap things would have gone otherwise,designs gone amiss would governed gandalf grey mayhap things would gone otherwise
120,But even now there is hope left.,but even now there is hope left,even hope left
121,"I will not give you counsel, saying do this, or do that.",i will not give you counsel saying do this or do that,give counsel saying
122,"For not in doing or contriving, nor in choosing between this course and another, can I avail; but only in knowing what was and is, and in part also what shall be.",for not in doing or contriving nor in choosing between this course and another can i avail but only in knowing what was and is and in part also what shall be,contriving choosing course another avail knowing part also shall
123,But this I will say to you: your Quest stands upon the edge of a knife.,but this i will say to you your quest stands upon the edge of a knife,say quest stands upon edge knife
124,"Stray but a little and it will fail, to the ruin of all.",stray but a little and it will fail to the ruin of all,stray little fail ruin
125,Yet hope remains while all the Company is true.',yet hope remains while all the company is true,yet hope remains company true
126,"And with that word she held them with her eyes, and in silence looked searchingly at each of them in turn.",and with that word she held them with her eyes and in silence looked searchingly at each of them in turn,word held eyes silence looked searchingly turn
127,None save Legolas and Aragorn could long endure her glance.,none save legolas and aragorn could long endure her glance,none save legolas aragorn could long endure glance
128,Sam quickly blushed and hung his head.,sam quickly blushed and hung his head,sam quickly blushed hung head
129,"At length the Lady Galadriel released them from her eyes, and she smiled.",at length the lady galadriel released them from her eyes and she smiled,length lady galadriel released eyes smiled
130,"`Do not let your hearts be troubled,' she said.",do not let your hearts be troubled she said,let hearts troubled said
131,'Tonight you shall sleep in peace.',tonight you shall sleep in peace,tonight shall sleep peace
132,"Then they sighed and felt suddenly weary, as those who have been questioned long and deeply, though no words had been spoken openly.",then they sighed and felt suddenly weary as those who have been questioned long and deeply though no words had been spoken openly,sighed felt suddenly weary questioned long deeply though words spoken openly
133,`Go now! ',go now,go
134,said Celeborn.,said celeborn,said celeborn
135,`You are worn with sorrow and much toil.,you are worn with sorrow and much toil,worn sorrow much toil
136,"Even if your Quest did not concern us closely, you should have refuge in this City, until you were healed and refreshed.",even if your quest did not concern us closely you should have refuge in this city until you were healed and refreshed,even quest concern us closely refuge city healed refreshed
137,"Now you shall rest, and we will not speak of your further road for a while.'",now you shall rest and we will not speak of your further road for a while,shall rest speak road
138,"That night the Company slept upon the ground, much to the satisfaction of the hobbits.",that night the company slept upon the ground much to the satisfaction of the hobbits,night company slept upon ground much satisfaction hobbits
139,"The Elves spread for them a pavilion among the trees near the fountain, and in it they laid soft couches; then speaking words of peace with fair elvish voices they left them.",the elves spread for them a pavilion among the trees near the fountain and in it they laid soft couches then speaking words of peace with fair elvish voices they left them,elves spread pavilion among trees near fountain laid soft couches speaking words peace fair elvish voices left
140,"For a little while the travellers talked of their night before in the tree-tops, and of their day's journey, and of the Lord and Lady; for they had not yet the heart to look further back.",for a little while the travellers talked of their night before in the treetops and of their days journey and of the lord and lady for they had not yet the heart to look further back,little travellers talked night treetops days journey lord lady yet heart look back
141,"`What did you blush for, Sam? '",what did you blush for sam,blush sam
142,said Pippin.,said pippin,said pippin
143,`You soon broke down.,you soon broke down,soon broke
144,Anyone would have thought you had a guilty conscience.,anyone would have thought you had a guilty conscience,anyone would thought guilty conscience
145,I hope it was nothing worse than a wicked plot to steal one of my blankets.',i hope it was nothing worse than a wicked plot to steal one of my blankets,hope nothing worse wicked plot steal one blankets
146,"`I never thought no such thing,' answered Sam, in no mood for jest.",i never thought no such thing answered sam in no mood for jest,never thought thing answered sam mood jest
147,"'If you want to know, I felt as if I hadn't got nothing on, and I didn't like it.",if you want to know i felt as if i hadnt got nothing on and i didnt like it,want know felt hadnt got nothing didnt like
148,She seemed to be looking inside me and asking me what I would do if she gave me the chance of flying back home to the Shire to a nice little hole with-with a bit of garden of my own.',she seemed to be looking inside me and asking me what i would do if she gave me the chance of flying back home to the shire to a nice little hole withwith a bit of garden of my own,seemed looking inside asking would gave chance flying back home shire nice little hole withwith bit garden
149,"`That's funny,' said Merry.",thats funny said merry,thats funny said merry
150,"'Almost exactly what I felt myself; only, only well, I don't think I'II say any more,' he ended lamely.",almost exactly what i felt myself only only well i dont think iii say any more he ended lamely,almost exactly felt well dont think iii say ended lamely
151,"All of them, it seemed, had fared alike: each had felt that he was offered a choice between a shadow full of fear that lay ahead, and something that he greatly desired: clear before his mind it lay, and to get it he had only to turn aside from the road and leave the Quest and the war against Sauron to others.",all of them it seemed had fared alike each had felt that he was offered a choice between a shadow full of fear that lay ahead and something that he greatly desired clear before his mind it lay and to get it he had only to turn aside from the road and leave the quest and the war against sauron to others,seemed fared alike felt offered choice shadow full fear lay ahead something greatly desired clear mind lay get turn aside road leave quest war sauron others
152,"`And it seemed to me, too,' said Gimli, `that my choice would remain secret and known only to myself.'",and it seemed to me too said gimli that my choice would remain secret and known only to myself,seemed said gimli choice would remain secret known
153,"'To me it seemed exceedingly strange,' said Boromir.",to me it seemed exceedingly strange said boromir,seemed exceedingly strange said boromir
154,"`Maybe it was only a test, and she thought to read our thoughts for her own good purpose; but almost I should have said that she was tempting us, and offering what she pretended to have the power to give.",maybe it was only a test and she thought to read our thoughts for her own good purpose but almost i should have said that she was tempting us and offering what she pretended to have the power to give,maybe test thought read thoughts good purpose almost said tempting us offering pretended power give
155,It need not be said that I refused to listen.,it need not be said that i refused to listen,need said refused listen
156,The Men of Minas Tirith are true to their word.',the men of minas tirith are true to their word,men minas tirith true word
157,But what he thought that the Lady had offered him Boromir did not tell.,but what he thought that the lady had offered him boromir did not tell,thought lady offered boromir tell
158,"And as for Frodo, he would not speak, though Boromir pressed him with questions.",and as for frodo he would not speak though boromir pressed him with questions,frodo would speak though boromir pressed questions
159,"`She held you long in her gaze, Ring-bearer,' he said.",she held you long in her gaze ringbearer he said,held long gaze ringbearer said
160,"`Yes,' said Frodo; `but whatever came into my mind then I will keep there.'",yes said frodo but whatever came into my mind then i will keep there,yes said frodo whatever came mind keep
161,"`Well, have a care! '",well have a care,well care
162,said Boromir.,said boromir,said boromir
163,`I do not feel too sure of this Elvish Lady and her purposes.',i do not feel too sure of this elvish lady and her purposes,feel sure elvish lady purposes
164,`Speak no evil of the Lady Galadriel! ',speak no evil of the lady galadriel,speak evil lady galadriel
165,said Aragorn sternly.,said aragorn sternly,said aragorn sternly
166,'You know not what you say.,you know not what you say,know say
167,"There is in her and in this land no evil, unless a man bring it hither himself.",there is in her and in this land no evil unless a man bring it hither himself,land evil unless man bring hither
168,Then let him beware!,then let him beware,let beware
169,But tonight I shall sleep without fear for the first time since I left Rivendell.,but tonight i shall sleep without fear for the first time since i left rivendell,tonight shall sleep without fear first time since left rivendell
170,"And may I sleep deep, and forget for a while my grief!",and may i sleep deep and forget for a while my grief,may sleep deep forget grief
171,I am weary in body and in heart.',i am weary in body and in heart,weary body heart
172,He cast himself down upon his couch and fell at once into a long sleep.,he cast himself down upon his couch and fell at once into a long sleep,cast upon couch fell long sleep
173,"The others soon did the same, and no sound or dream disturbed their slumber.",the others soon did the same and no sound or dream disturbed their slumber,others soon sound dream disturbed slumber
174,When they woke they found that the light of day was broad upon the lawn before the pavilion.,when they woke they found that the light of day was broad upon the lawn before the pavilion,woke found light day broad upon lawn pavilion
175,and the fountain rose and fell glittering in the sun.,and the fountain rose and fell glittering in the sun,fountain rose fell glittering sun
176,"They remained some days in Lothlórien, so far as they could tell or remember.",they remained some days in lothlorien so far as they could tell or remember,remained days lothlorien far could tell remember
177,"All the while that they dwelt there the sun shone clear, save for a gentle rain that fell at times, and passed away leaving all things fresh and clean.",all the while that they dwelt there the sun shone clear save for a gentle rain that fell at times and passed away leaving all things fresh and clean,dwelt sun shone clear save gentle rain fell times passed away leaving things fresh clean
178,"The air was cool and soft, as if it were early spring, yet they felt about them the deep and thoughtful quiet of winter.",the air was cool and soft as if it were early spring yet they felt about them the deep and thoughtful quiet of winter,air cool soft early spring yet felt deep thoughtful quiet winter
179,"It seemed to them that they did little but eat and drink and rest, and walk among the trees; and it was enough.",it seemed to them that they did little but eat and drink and rest and walk among the trees and it was enough,seemed little eat drink rest walk among trees enough
180,"They had not seen the Lord and Lady again, and they had little speech with the Elven-folk; for few of these knew or would use the Westron tongue.",they had not seen the lord and lady again and they had little speech with the elvenfolk for few of these knew or would use the westron tongue,seen lord lady little speech elvenfolk knew would use westron tongue
181,"Haldir had bidden them farewell and gone back again to the fences of the North, where great watch was now kept since the tidings of Moria that the Company had brought.",haldir had bidden them farewell and gone back again to the fences of the north where great watch was now kept since the tidings of moria that the company had brought,haldir bidden farewell gone back fences north great watch kept since tidings moria company brought
182,"Legolas was away much among the Galadhrim, and after the first night he did not sleep with the other companions, though he returned to eat and talk with them.",legolas was away much among the galadhrim and after the first night he did not sleep with the other companions though he returned to eat and talk with them,legolas away much among galadhrim first night sleep companions though returned eat talk
183,"Often he took Gimli with him when he went abroad in the land, and the others wondered at this change.",often he took gimli with him when he went abroad in the land and the others wondered at this change,often took gimli went abroad land others wondered change
184,"Now as the companions sat or walked together they spoke of Gandalf, and all that each had known and seen of him came clear before their minds.",now as the companions sat or walked together they spoke of gandalf and all that each had known and seen of him came clear before their minds,companions sat walked together spoke gandalf known seen came clear minds
185,As they were healed of hurt and weariness of body the grief of their loss grew more keen.,as they were healed of hurt and weariness of body the grief of their loss grew more keen,healed hurt weariness body grief loss grew keen
186,"Often they heard nearby Elvish voices singing, and knew that they were making songs of lamentation for his fall, for they caught his name among the sweet sad words that they could not understand.",often they heard nearby elvish voices singing and knew that they were making songs of lamentation for his fall for they caught his name among the sweet sad words that they could not understand,often heard nearby elvish voices singing knew making songs lamentation fall caught name among sweet sad words could understand
187,"_Mithrandir, Mithrandir_ sang the Elves, _O Pilgrim Grey!_For so they loved to call him.",mithrandir mithrandir sang the elves o pilgrim greyfor so they loved to call him,mithrandir mithrandir sang elves pilgrim greyfor loved call
188,"But if Legolas was with the Company, he would not interpret the songs for them, saying that he had not the skill, and that for him the grief was still too near, a matter for tears and not yet for song.",but if legolas was with the company he would not interpret the songs for them saying that he had not the skill and that for him the grief was still too near a matter for tears and not yet for song,legolas company would interpret songs saying skill grief still near matter tears yet song
189,It was Frodo who first put something of his sorrow into halting words.,it was frodo who first put something of his sorrow into halting words,frodo first put something sorrow halting words
190,"He was seldom moved to make song or rhyme; even in Rivendell he had listened and had not sung himself, though his memory was stored with many things that others had made before him.",he was seldom moved to make song or rhyme even in rivendell he had listened and had not sung himself though his memory was stored with many things that others had made before him,seldom moved make song rhyme even rivendell listened sung though memory stored many things others made
191,"But now as he sat beside the fountain in Lórien and heard about him the voices of the Elves, his thought took shape in a song that seemed fair to him; yet when he tried to repeat it to Sam only snatches remained, faded as a handful of withered leaves.",but now as he sat beside the fountain in lorien and heard about him the voices of the elves his thought took shape in a song that seemed fair to him yet when he tried to repeat it to sam only snatches remained faded as a handful of withered leaves,sat beside fountain lorien heard voices elves thought took shape song seemed fair yet tried repeat sam snatches remained faded handful withered leaves
192,"When evening in the Shire was grey
           his footsteps on the Hill were heard;
           before the dawn he went away
           on journey long without a word.",when evening in the shire was grey his footsteps on the hill were heard before the dawn he went away on journey long without a word,evening shire grey footsteps hill heard dawn went away journey long without word
193,"From Wilderland to Western shore,
           from northern waste to southern hill,
           through dragon-lair and hidden door
           and darkling woods he walked at will.",from wilderland to western shore from northern waste to southern hill through dragonlair and hidden door and darkling woods he walked at will,wilderland western shore northern waste southern hill dragonlair hidden door darkling woods walked
194,"With Dwarf and Hobbit, Elves and Men,
           with mortal and immortal folk,
           with bird on bough and beast in den,
           in their own secret tongues he spoke.",with dwarf and hobbit elves and men with mortal and immortal folk with bird on bough and beast in den in their own secret tongues he spoke,dwarf hobbit elves men mortal immortal folk bird bough beast den secret tongues spoke
195,"A deadly sword, a healing hand,
           a back that bent beneath its load;
           a trumpet-voice, a burning brand,
           a weary pilgrim on the road.",a deadly sword a healing hand a back that bent beneath its load a trumpetvoice a burning brand a weary pilgrim on the road,deadly sword healing hand back bent beneath load trumpetvoice burning brand weary pilgrim road
196,"A lord of wisdom throned he sat,
           swift in anger, quick to laugh;
           an old man in a battered hat
           who leaned upon a thorny staff.",a lord of wisdom throned he sat swift in anger quick to laugh an old man in a battered hat who leaned upon a thorny staff,lord wisdom throned sat swift anger quick laugh old man battered hat leaned upon thorny staff
197,"He stood upon the bridge alone
           and Fire and Shadow both defied;
           his staff was broken on the stone,
           in Khazad-dûm his wisdom died.",he stood upon the bridge alone and fire and shadow both defied his staff was broken on the stone in khazaddum his wisdom died,stood upon bridge alone fire shadow defied staff broken stone khazaddum wisdom died
198,"`Why, you'll be beating Mr. Bilbo next! '",why youll be beating mr bilbo next,youll beating mr bilbo next
199,said Sam.,said sam,said sam
200,"'No, I am afraid not,' said Frodo.",no i am afraid not said frodo,afraid said frodo
201,'But that is the best I can do yet.',but that is the best i can do yet,best yet
202,"'Well, Mr. Frodo, if you do have another go, I hope you'll say a word about his fireworks,' said Sam.",well mr frodo if you do have another go i hope youll say a word about his fireworks said sam,well mr frodo another go hope youll say word fireworks said sam
203,"`Something like this:

          The finest rockets ever seen:
           they burst in stars of blue and green,
           or after thunder golden showers
           came falling like a rain of flowers.",something like this the finest rockets ever seen they burst in stars of blue and green or after thunder golden showers came falling like a rain of flowers,something like finest rockets ever seen burst stars blue green thunder golden showers came falling like rain flowers
204,Though that doesn't do them justice by a long road.',though that doesnt do them justice by a long road,though doesnt justice long road
205,"`No, I'll leave that to you, Sam.",no ill leave that to you sam,ill leave sam
206,Or perhaps to Bilbo.,or perhaps to bilbo,perhaps bilbo
207,But-well.,butwell,butwell
208,I can't talk of it any more.,i cant talk of it any more,cant talk
209,I can't bear to think of bringing the news to him.',i cant bear to think of bringing the news to him,cant bear think bringing news
210,One evening Frodo and Sam were walking together in the cool twilight.,one evening frodo and sam were walking together in the cool twilight,one evening frodo sam walking together cool twilight
211,Both of them felt restless again.,both of them felt restless again,felt restless
212,On Frodo suddenly the shadow of parting had fallen: he knew somehow that the time was very near when he must leave Lothlórien.,on frodo suddenly the shadow of parting had fallen he knew somehow that the time was very near when he must leave lothlorien,frodo suddenly shadow parting fallen knew somehow time near must leave lothlorien
213,"`What do you think of Elves now, Sam? '",what do you think of elves now sam,think elves sam
214,he said.,he said,said
215,`I asked you the same question once before-it seems a very long while ago; but you have seen more of them since then.',i asked you the same question once beforeit seems a very long while ago but you have seen more of them since then,asked question beforeit seems long ago seen since
216,'I have indeed! ',i have indeed,indeed
217,said Sam.,said sam,said sam
218,'And I reckon there's Elves and Elves.,and i reckon theres elves and elves,reckon theres elves elves
219,"They're all elvish enough, but they're not all the same.",theyre all elvish enough but theyre not all the same,theyre elvish enough theyre
220,"Now these folk aren't wanderers or homeless, and seem a bit nearer to the likes of us: they seem to belong here, more even than Hobbits do in the Shire.",now these folk arent wanderers or homeless and seem a bit nearer to the likes of us they seem to belong here more even than hobbits do in the shire,folk arent wanderers homeless seem bit nearer likes us seem belong even hobbits shire
221,"Whether they've made the land, or the land's made them, it's hard to say, if you take my meaning.",whether theyve made the land or the lands made them its hard to say if you take my meaning,whether theyve made land lands made hard say take meaning
222,It's wonderfully quiet here.,its wonderfully quiet here,wonderfully quiet
223,"Nothing seems to be going on, and nobody seems to want it to.",nothing seems to be going on and nobody seems to want it to,nothing seems going nobody seems want
224,"If there's any magic about, it's right down deep, where I can't lay my hands on it, in a manner of speaking.'",if theres any magic about its right down deep where i cant lay my hands on it in a manner of speaking,theres magic right deep cant lay hands manner speaking
225,"'You can see and feel it everywhere,' said Frodo.",you can see and feel it everywhere said frodo,see feel everywhere said frodo
226,"'Well,' said Sam, 'you can't see nobody working it.",well said sam you cant see nobody working it,well said sam cant see nobody working
227,No fireworks like poor Gandalf used to show.,no fireworks like poor gandalf used to show,fireworks like poor gandalf used show
228,I wonder we don't see nothing of the Lord and Lady in all these days.,i wonder we dont see nothing of the lord and lady in all these days,wonder dont see nothing lord lady days
