sentence_id,sentence,cleaned_sentence,tokens
0,"_
            The Breaking of the Fellowship

     Aragorn led them to the right arm of the River.",the breaking of the fellowship aragorn led them to the right arm of the river,breaking fellowship aragorn led right arm river
1,Here upon its western side under the shadow of Tol Brandir a green lawn ran down to the water from the feet of Amon Hen.,here upon its western side under the shadow of tol brandir a green lawn ran down to the water from the feet of amon hen,upon western side shadow tol brandir green lawn ran water feet amon hen
2,"Behind it rose the first gentle slopes of the hill clad with trees, and trees marched away westward along the curving shores of the lake.",behind it rose the first gentle slopes of the hill clad with trees and trees marched away westward along the curving shores of the lake,behind rose first gentle slopes hill clad trees trees marched away westward along curving shores lake
3,A little spring fell tumbling down and fed the grass.,a little spring fell tumbling down and fed the grass,little spring fell tumbling fed grass
4,"'Here we will rest tonight,' said Aragorn.",here we will rest tonight said aragorn,rest tonight said aragorn
5,`This is the lawn of Parth Galen: a fair place in the summer days of old.,this is the lawn of parth galen a fair place in the summer days of old,lawn parth galen fair place summer days old
6,Let us hope that no evil has yet come here.',let us hope that no evil has yet come here,let us hope evil yet come
7,"They drew up their boats on the green banks, and beside them they made their camp.",they drew up their boats on the green banks and beside them they made their camp,drew boats green banks beside made camp
8,"They set a watch, but had no sight nor sound of their enemies.",they set a watch but had no sight nor sound of their enemies,set watch sight sound enemies
9,"If Gollum had contrived to follow them, he remained unseen and unheard.",if gollum had contrived to follow them he remained unseen and unheard,gollum contrived follow remained unseen unheard
10,"Nonetheless as the night wore on Aragorn grew uneasy, tossing often in his sleep and waking.",nonetheless as the night wore on aragorn grew uneasy tossing often in his sleep and waking,nonetheless night wore aragorn grew uneasy tossing often sleep waking
11,"In the small hours he got up and came to Frodo, whose turn it was to watch.",in the small hours he got up and came to frodo whose turn it was to watch,small hours got came frodo whose turn watch
12,`Why are you waking? ',why are you waking,waking
13,asked Frodo.,asked frodo,asked frodo
14,`It is not your watch.',it is not your watch,watch
15,"`I do not know,' answered Aragorn; `but a shadow and a threat has been growing in my sleep.",i do not know answered aragorn but a shadow and a threat has been growing in my sleep,know answered aragorn shadow threat growing sleep
16,It would be well to draw your sword.',it would be well to draw your sword,would well draw sword
17,`Why? ',why,
18,said Frodo.,said frodo,said frodo
19,`Are enemies at hand? ',are enemies at hand,enemies hand
20,"`Let us see what Sting may show,' answered Aragorn.",let us see what sting may show answered aragorn,let us see sting may show answered aragorn
21,Frodo then drew the elf-blade from its sheath.,frodo then drew the elfblade from its sheath,frodo drew elfblade sheath
22,To his dismay the edges gleamed dimly in the night.,to his dismay the edges gleamed dimly in the night,dismay edges gleamed dimly night
23,`Orcs! ',orcs,orcs
24,he said.,he said,said
25,"`Not very near, and yet too near, it seems.'",not very near and yet too near it seems,near yet near seems
26,"`I feared as much,' said Aragorn.",i feared as much said aragorn,feared much said aragorn
27,`But maybe they are not on this side of the River.,but maybe they are not on this side of the river,maybe side river
28,"The light of Sting is faint, and it may point to no more than spies of Mordor roaming on the slopes of Amon Lhaw.",the light of sting is faint and it may point to no more than spies of mordor roaming on the slopes of amon lhaw,light sting faint may point spies mordor roaming slopes amon lhaw
29,I have never heard before of Orcs upon Amon Hen.,i have never heard before of orcs upon amon hen,never heard orcs upon amon hen
30,"Yet who knows what may happen in these evil days, now that Minas Tirith no longer holds secure the passages of Anduin.",yet who knows what may happen in these evil days now that minas tirith no longer holds secure the passages of anduin,yet knows may happen evil days minas tirith longer holds secure passages anduin
31,We must go warily tomorrow.',we must go warily tomorrow,must go warily tomorrow
32,The day came like fire and smoke.,the day came like fire and smoke,day came like fire smoke
33,Low in the East there were black bars of cloud like the fumes of a great burning.,low in the east there were black bars of cloud like the fumes of a great burning,low east black bars cloud like fumes great burning
34,The rising sun lit them from beneath with flames of murky red; but soon it climbed above them into a clear sky.,the rising sun lit them from beneath with flames of murky red but soon it climbed above them into a clear sky,rising sun lit beneath flames murky red soon climbed clear sky
35,The summit of Tol Brandir was tipped with gold.,the summit of tol brandir was tipped with gold,summit tol brandir tipped gold
36,Frodo looked out eastward and gazed at the tall island.,frodo looked out eastward and gazed at the tall island,frodo looked eastward gazed tall island
37,Its sides sprang sheer out of the running water.,its sides sprang sheer out of the running water,sides sprang sheer running water
38,"High up above the tall cliffs were steep slopes upon which trees climbed, mounting one head above another; and above them again were grey faces of inaccessible rock, crowned by a great spire of stone.",high up above the tall cliffs were steep slopes upon which trees climbed mounting one head above another and above them again were grey faces of inaccessible rock crowned by a great spire of stone,high tall cliffs steep slopes upon trees climbed mounting one head another grey faces inaccessible rock crowned great spire stone
39,"Many birds were circling about it, but no sign of other living things could be seen.",many birds were circling about it but no sign of other living things could be seen,many birds circling sign living things could seen
40,"When they had eaten, Aragorn called the Company together.",when they had eaten aragorn called the company together,eaten aragorn called company together
41,"`The day has come at last,' he said: 'the day of choice which we have long delayed.",the day has come at last he said the day of choice which we have long delayed,day come last said day choice long delayed
42,What shall now become of our Company that has travelled so far in fellowship?,what shall now become of our company that has travelled so far in fellowship,shall become company travelled far fellowship
43,Shall we turn west with Boromir and go to the wars of Gondor; or turn east to the Fear and Shadow; or shall we break our fellowship and go this way and that as each may choose?,shall we turn west with boromir and go to the wars of gondor or turn east to the fear and shadow or shall we break our fellowship and go this way and that as each may choose,shall turn west boromir go wars gondor turn east fear shadow shall break fellowship go way may choose
44,Whatever we do must be done soon.,whatever we do must be done soon,whatever must done soon
45,We cannot long halt here.,we cannot long halt here,long halt
46,"The enemy is on the eastern shore, we know; but I fear that the Orcs may already be on this side of the water.'",the enemy is on the eastern shore we know but i fear that the orcs may already be on this side of the water,enemy eastern shore know fear orcs may already side water
47,There was a long silence in which no one spoke or moved.,there was a long silence in which no one spoke or moved,long silence one spoke moved
48,"'Well, Frodo,' said Aragorn at last.",well frodo said aragorn at last,well frodo said aragorn last
49,`I fear that the burden is laid upon you.,i fear that the burden is laid upon you,fear burden laid upon
50,You are the Bearer appointed by the Council.,you are the bearer appointed by the council,bearer appointed council
51,Your own way you alone can choose.,your own way you alone can choose,way alone choose
52,In this matter I cannot advise you.,in this matter i cannot advise you,matter advise
53,"I am not Gandalf, and though I have tried to bear his part, I do not know what design or hope he had for this hour, if indeed he had any.",i am not gandalf and though i have tried to bear his part i do not know what design or hope he had for this hour if indeed he had any,gandalf though tried bear part know design hope hour indeed
54,Most likely it seems that if he were here now the choice would still wait on you.,most likely it seems that if he were here now the choice would still wait on you,likely seems choice would still wait
55,Such is your fate.',such is your fate,fate
56,Frodo did not answer at once.,frodo did not answer at once,frodo answer
57,Then he spoke slowly.,then he spoke slowly,spoke slowly
58,"`I know that haste is needed, yet I cannot choose.",i know that haste is needed yet i cannot choose,know haste needed yet choose
59,The burden is heavy.,the burden is heavy,burden heavy
60,"Give me an hour longer, and I will speak.",give me an hour longer and i will speak,give hour longer speak
61,Let me be alone! ',let me be alone,let alone
62,Aragorn looked at him with kindly pity.,aragorn looked at him with kindly pity,aragorn looked kindly pity
63,"`Very well, Frodo son of Drogo,' he said.",very well frodo son of drogo he said,well frodo son drogo said
64,"`You shall have an hour, and you shall be alone.",you shall have an hour and you shall be alone,shall hour shall alone
65,We will stay here for a while.,we will stay here for a while,stay
66,But do not stray far or out of call.',but do not stray far or out of call,stray far call
67,Frodo sat for a moment with his head bowed.,frodo sat for a moment with his head bowed,frodo sat moment head bowed
68,"Sam, who had been watching his master with great concern, shook his head and muttered: 'Plain as a pikestaff it is, but it's no good Sam Gamgee putting in his spoke just now.'",sam who had been watching his master with great concern shook his head and muttered plain as a pikestaff it is but its no good sam gamgee putting in his spoke just now,sam watching master great concern shook head muttered plain pikestaff good sam gamgee putting spoke
69,",
     Presently Frodo got up and walked away; and Sam saw that while the others restrained themselves and did not stare at him, the eyes of Boromir followed Frodo intently, until he passed out of sight in the trees at the foot of Amon Hen.",presently frodo got up and walked away and sam saw that while the others restrained themselves and did not stare at him the eyes of boromir followed frodo intently until he passed out of sight in the trees at the foot of amon hen,presently frodo got walked away sam saw others restrained stare eyes boromir followed frodo intently passed sight trees foot amon hen
70,"Wandering aimlessly at first in the wood, Frodo found that his feet were leading him up towards the slopes of the hill.",wandering aimlessly at first in the wood frodo found that his feet were leading him up towards the slopes of the hill,wandering aimlessly first wood frodo found feet leading towards slopes hill
71,"He came to a path, the dwindling ruins of a road of long ago.",he came to a path the dwindling ruins of a road of long ago,came path dwindling ruins road long ago
72,"In steep places stairs of stone had been hewn, but now they were cracked and worn, and split by the roots of trees.",in steep places stairs of stone had been hewn but now they were cracked and worn and split by the roots of trees,steep places stairs stone hewn cracked worn split roots trees
73,"For some while he climbed, not caring which way he went, until he came to a grassy place.",for some while he climbed not caring which way he went until he came to a grassy place,climbed caring way went came grassy place
74,"Rowan-trees grew about it, and in the midst was a wide flat stone.",rowantrees grew about it and in the midst was a wide flat stone,rowantrees grew midst wide flat stone
75,The little upland lawn was open upon the East and was filled now with the early sunlight.,the little upland lawn was open upon the east and was filled now with the early sunlight,little upland lawn open upon east filled early sunlight
76,"Frodo halted and looked out over the River, far below him, to Tol Brandir and the birds wheeling in the great gulf of air between him and the untrodden isle.",frodo halted and looked out over the river far below him to tol brandir and the birds wheeling in the great gulf of air between him and the untrodden isle,frodo halted looked river far tol brandir birds wheeling great gulf air untrodden isle
77,The voice of Rauros was a mighty roaring mingled with a deep throbbing boom.,the voice of rauros was a mighty roaring mingled with a deep throbbing boom,voice rauros mighty roaring mingled deep throbbing boom
78,"He sat down upon the stone and cupped his chin in his hands, staring eastwards but seeing little with his eyes.",he sat down upon the stone and cupped his chin in his hands staring eastwards but seeing little with his eyes,sat upon stone cupped chin hands staring eastwards seeing little eyes
79,"All that had happened since Bilbo left the Shire was passing through his mind, and he recalled and pondered everything that he could remember of Gandalf's words.",all that had happened since bilbo left the shire was passing through his mind and he recalled and pondered everything that he could remember of gandalfs words,happened since bilbo left shire passing mind recalled pondered everything could remember gandalfs words
80,"Time went on, and still he was no nearer to a choice.",time went on and still he was no nearer to a choice,time went still nearer choice
81,"Suddenly he awoke from his thoughts: a strange feeling came to him that something was behind him, that unfriendly eyes were upon him.",suddenly he awoke from his thoughts a strange feeling came to him that something was behind him that unfriendly eyes were upon him,suddenly awoke thoughts strange feeling came something behind unfriendly eyes upon
82,"He sprang up and turned; but all that he saw to his surprise was Boromir, and his face was smiling and kind.",he sprang up and turned but all that he saw to his surprise was boromir and his face was smiling and kind,sprang turned saw surprise boromir face smiling kind
83,"`I was afraid for you, Frodo,' he said, coming forward.",i was afraid for you frodo he said coming forward,afraid frodo said coming forward
84,"`If Aragorn is right and Orcs are near, then none of us should wander alone, and you least of all: so much depends on you.",if aragorn is right and orcs are near then none of us should wander alone and you least of all so much depends on you,aragorn right orcs near none us wander alone least much depends
85,And my heart too is heavy.,and my heart too is heavy,heart heavy
86,"May I stay now and talk for a while, since I have found you?",may i stay now and talk for a while since i have found you,may stay talk since found
87,It would comfort me.,it would comfort me,would comfort
88,"Where there are so many, all speech becomes a debate without end.",where there are so many all speech becomes a debate without end,many speech becomes debate without end
89,But two together may perhaps find wisdom.',but two together may perhaps find wisdom,two together may perhaps find wisdom
90,"`You are kind,' answered Frodo.",you are kind answered frodo,kind answered frodo
91,'But I do not think that any speech will help me.,but i do not think that any speech will help me,think speech help
92,"For I know what I should do, but I am afraid of doing it, Boromir: afraid.'",for i know what i should do but i am afraid of doing it boromir afraid,know afraid boromir afraid
93,Boromir stood silent.,boromir stood silent,boromir stood silent
94,Rauros roared endlessly on.,rauros roared endlessly on,rauros roared endlessly
95,The wind murmured in the branches of the trees.,the wind murmured in the branches of the trees,wind murmured branches trees
96,Frodo shivered.,frodo shivered,frodo shivered
97,Suddenly Boromir came and sat beside him.,suddenly boromir came and sat beside him,suddenly boromir came sat beside
98,`Are you sure that you do not suffer needlessly? ',are you sure that you do not suffer needlessly,sure suffer needlessly
99,he said.,he said,said
100,`I wish to help you.,i wish to help you,wish help
101,You need counsel in your hard choice.,you need counsel in your hard choice,need counsel hard choice
102,Will you not take mine? ',will you not take mine,take mine
103,"'I think I know already what counsel you would give, Boromir,' said Frodo.",i think i know already what counsel you would give boromir said frodo,think know already counsel would give boromir said frodo
104,'And it would seem like wisdom but for the warning of my heart.',and it would seem like wisdom but for the warning of my heart,would seem like wisdom warning heart
105,`Warning?,warning,warning
106,Warning against what? ',warning against what,warning
107,said Boromir sharply.,said boromir sharply,said boromir sharply
108,'Against delay.,against delay,delay
109,Against the way that seems easier.,against the way that seems easier,way seems easier
110,Against refusal of the burden that is laid on me.,against refusal of the burden that is laid on me,refusal burden laid
111,"Against-well, if it must be said, against trust in the strength and truth of Men.'",againstwell if it must be said against trust in the strength and truth of men,againstwell must said trust strength truth men
112,"`Yet that strength has long protected you far away in your little country, though you knew it not.'",yet that strength has long protected you far away in your little country though you knew it not,yet strength long protected far away little country though knew
113,'I do not doubt the valour of your people.,i do not doubt the valour of your people,doubt valour people
114,But the world is changing.,but the world is changing,world changing
115,"The walls of Minas Tirith may be strong, but they are not strong enough.",the walls of minas tirith may be strong but they are not strong enough,walls minas tirith may strong strong enough
116,"If they fail, what then? '",if they fail what then,fail
117,'We shall fall in battle valiantly.,we shall fall in battle valiantly,shall fall battle valiantly
118,Yet there is still hope that they will not fail.',yet there is still hope that they will not fail,yet still hope fail
119,"'No hope while the Ring lasts,' said Frodo.",no hope while the ring lasts said frodo,hope ring lasts said frodo
120,'Ah!,ah,ah
121,The Ring! ',the ring,ring
122,"said Boromir, his eyes lighting.",said boromir his eyes lighting,said boromir eyes lighting
123,'The Ring!,the ring,ring
124,Is it not a strange fate that we should suffer so much fear and doubt for so small a thing?,is it not a strange fate that we should suffer so much fear and doubt for so small a thing,strange fate suffer much fear doubt small thing
125,So small a thing!,so small a thing,small thing
126,And I have seen it only for an instant in the House of Elrond.,and i have seen it only for an instant in the house of elrond,seen instant house elrond
127,Could I not have a sight of it again? ',could i not have a sight of it again,could sight
128,Frodo looked up.,frodo looked up,frodo looked
129,His heart went suddenly cold.,his heart went suddenly cold,heart went suddenly cold
130,"He caught the strange gleam in Boromir's eyes, yet his face was still kind and friendly.",he caught the strange gleam in boromirs eyes yet his face was still kind and friendly,caught strange gleam boromirs eyes yet face still kind friendly
131,"'It is best that it should lie hidden,' he answered.",it is best that it should lie hidden he answered,best lie hidden answered
132,'As you wish.,as you wish,wish
133,"I care not,' said Boromir.",i care not said boromir,care said boromir
134,'Yet may I not even speak of it?,yet may i not even speak of it,yet may even speak
135,For you seem ever to think only of its power in the hands of the Enemy: of its evil uses not of its good.,for you seem ever to think only of its power in the hands of the enemy of its evil uses not of its good,seem ever think power hands enemy evil uses good
136,"The world is changing, you say.",the world is changing you say,world changing say
137,"Minas Tirith will fall, if the Ring lasts.",minas tirith will fall if the ring lasts,minas tirith fall ring lasts
138,But why?,but why,
139,"Certainly, if the Ring were with the Enemy.",certainly if the ring were with the enemy,certainly ring enemy
140,"But why, if it were with us? '",but why if it were with us,us
141,'Were you not at the Council? ',were you not at the council,council
142,answered Frodo.,answered frodo,answered frodo
143,"`Because we cannot use it, and what is done with it turns to evil.'",because we cannot use it and what is done with it turns to evil,use done turns evil
144,Boromir got up and walked about impatiently.,boromir got up and walked about impatiently,boromir got walked impatiently
145,"'So you go on,' he cried.",so you go on he cried,go cried
146,"'Gandalf, Elrond  all these folk have taught you to say so.",gandalf elrond all these folk have taught you to say so,gandalf elrond folk taught say
147,For themselves they may be right.,for themselves they may be right,may right
148,"These elves and half-elves and wizards, they would come to grief perhaps.",these elves and halfelves and wizards they would come to grief perhaps,elves halfelves wizards would come grief perhaps
149,Yet often I doubt if they are wise and not merely timid.,yet often i doubt if they are wise and not merely timid,yet often doubt wise merely timid
150,But each to his own kind.,but each to his own kind,kind
151,"True-hearted Men, they will not be corrupted.",truehearted men they will not be corrupted,truehearted men corrupted
152,We of Minas Tirith have been staunch through long years of trial.,we of minas tirith have been staunch through long years of trial,minas tirith staunch long years trial
153,"We do not desire the power of wizard-lords, only strength to defend ourselves, strength in a just cause.",we do not desire the power of wizardlords only strength to defend ourselves strength in a just cause,desire power wizardlords strength defend strength cause
154,And behold!,and behold,behold
155,in our need chance brings to light the -Ring of Power.,in our need chance brings to light the ring of power,need chance brings light ring power
156,"It is a gift, I say; a gift to the foes of Mordor.",it is a gift i say a gift to the foes of mordor,gift say gift foes mordor
157,"It is mad not to use it, to use the power of the Enemy against him.",it is mad not to use it to use the power of the enemy against him,mad use use power enemy
158,"The fearless, the ruthless, these alone will achieve victory.",the fearless the ruthless these alone will achieve victory,fearless ruthless alone achieve victory
159,"What could not a warrior do in this hour, a great leader?",what could not a warrior do in this hour a great leader,could warrior hour great leader
160,What could not Aragorn do?,what could not aragorn do,could aragorn
161,"Or if he refuses, why not Boromir?",or if he refuses why not boromir,refuses boromir
162,The Ring would give me power of Command.,the ring would give me power of command,ring would give power command
163,"How I would drive the hosts of Mordor, and all men would flock to my banner!'",how i would drive the hosts of mordor and all men would flock to my banner,would drive hosts mordor men would flock banner
164,"Boromir strode up and down, speaking ever more loudly: Almost he seemed to have forgotten Frodo, while his talk dwelt on walls and weapons, and the mustering of men; and he drew plans for great alliances and glorious victories to be; and he cast down Mordor, and became himself a mighty king, benevolent and wise.",boromir strode up and down speaking ever more loudly almost he seemed to have forgotten frodo while his talk dwelt on walls and weapons and the mustering of men and he drew plans for great alliances and glorious victories to be and he cast down mordor and became himself a mighty king benevolent and wise,boromir strode speaking ever loudly almost seemed forgotten frodo talk dwelt walls weapons mustering men drew plans great alliances glorious victories cast mordor became mighty king benevolent wise
165,Suddenly he stopped and waved his arms.,suddenly he stopped and waved his arms,suddenly stopped waved arms
166,'And they tell us to throw it away!',and they tell us to throw it away,tell us throw away
167,he cried.,he cried,cried
168,`I do not say _destroy_ it.,i do not say destroy it,say destroy
169,"That might be well, if reason could show any hope of doing so.",that might be well if reason could show any hope of doing so,might well reason could show hope
170,It does not.,it does not,
171,The only plan that is proposed to us is that a halfling should walk blindly into Mordor and offer the Enemy every chance of recapturing it for himself.,the only plan that is proposed to us is that a halfling should walk blindly into mordor and offer the enemy every chance of recapturing it for himself,plan proposed us halfling walk blindly mordor offer enemy every chance recapturing
172,Folly!,folly,folly
