sentence_id,sentence,cleaned_sentence,tokens
118,asked Merry.,asked merry,asked merry
119,"'That is Loudwater, the Bruinen of Rivendell,' answered Strider.",that is loudwater the bruinen of rivendell answered strider,loudwater bruinen rivendell answered strider
120,'The Road runs along the edge of the hills for many miles from the Bridge to the Ford of Bruinen.,the road runs along the edge of the hills for many miles from the bridge to the ford of bruinen,road runs along edge hills many miles bridge ford bruinen
121,But I have not yet thought how we shall cross that water.,but i have not yet thought how we shall cross that water,yet thought shall cross water
122,One river at a time!,one river at a time,one river time
123,We shall be fortunate indeed if we do not find the Last Bridge held against us.',we shall be fortunate indeed if we do not find the last bridge held against us,shall fortunate indeed find last bridge held us
124,"Next day, early in the morning, they came down again to the borders of the Road.",next day early in the morning they came down again to the borders of the road,next day early morning came borders road
125,"Sam and Strider went forward, but they found no sign of any travellers or riders.",sam and strider went forward but they found no sign of any travellers or riders,sam strider went forward found sign travellers riders
126,Here under the shadow of the hills there had been some rain.,here under the shadow of the hills there had been some rain,shadow hills rain
127,"Strider judged that it had fallen two days before, and had washed away all footprints.",strider judged that it had fallen two days before and had washed away all footprints,strider judged fallen two days washed away footprints
128,"No horseman had passed since then, as far as he could see.",no horseman had passed since then as far as he could see,horseman passed since far could see
129,"They hurried along with all the speed they could make, and after a mile or two they saw the Last Bridge ahead, at the bottom of a short steep slope.",they hurried along with all the speed they could make and after a mile or two they saw the last bridge ahead at the bottom of a short steep slope,hurried along speed could make mile two saw last bridge ahead bottom short steep slope
130,"They dreaded to see black figures waiting there, but they saw none.",they dreaded to see black figures waiting there but they saw none,dreaded see black figures waiting saw none
131,"Strider made them take cover in a thicket at the side of the Road, while he went forward to explore.",strider made them take cover in a thicket at the side of the road while he went forward to explore,strider made take cover thicket side road went forward explore
132,Before long he came hurrying back.,before long he came hurrying back,long came hurrying back
133,"'I can see no sign of the enemy,' he said, 'and I wonder very much what that means.",i can see no sign of the enemy he said and i wonder very much what that means,see sign enemy said wonder much means
134,But I have found something very strange.',but i have found something very strange,found something strange
135,"He held out his hand, and showed a single pale-green jewel.",he held out his hand and showed a single palegreen jewel,held hand showed single palegreen jewel
136,"'I found it in the mud in the middle of the Bridge,' he said.",i found it in the mud in the middle of the bridge he said,found mud middle bridge said
137,"'It is a beryl, an elf-stone.",it is a beryl an elfstone,beryl elfstone
138,"Whether it was set there, or let fall by chance, I cannot say; but it brings hope to me.",whether it was set there or let fall by chance i cannot say but it brings hope to me,whether set let fall chance say brings hope
139,"I will take it as a sign that we may pass the Bridge; but beyond that I dare not keep to the Road, without some clearer token.'",i will take it as a sign that we may pass the bridge but beyond that i dare not keep to the road without some clearer token,take sign may pass bridge beyond dare keep road without clearer token
140,At once they went on again.,at once they went on again,went
141,"They crossed the Bridge in safety, hearing no sound but the water swirling against its three great arches.",they crossed the bridge in safety hearing no sound but the water swirling against its three great arches,crossed bridge safety hearing sound water swirling three great arches
142,A mile further on they came to a narrow ravine that led away northwards through the steep lands on the left of the Road.,a mile further on they came to a narrow ravine that led away northwards through the steep lands on the left of the road,mile came narrow ravine led away northwards steep lands left road
143,"Here Strider turned aside, and soon they were lost in a sombre country of dark trees winding among the feet of sullen hills.",here strider turned aside and soon they were lost in a sombre country of dark trees winding among the feet of sullen hills,strider turned aside soon lost sombre country dark trees winding among feet sullen hills
144,The hobbits were glad to leave the cheerless lands and the perilous Road behind them; but this new country seemed threatening and unfriendly.,the hobbits were glad to leave the cheerless lands and the perilous road behind them but this new country seemed threatening and unfriendly,hobbits glad leave cheerless lands perilous road behind new country seemed threatening unfriendly
145,As they went forward the hills about them steadily rose.,as they went forward the hills about them steadily rose,went forward hills steadily rose
146,"Here and there upon heights and ridges they caught glimpses of ancient walls of stone, and the ruins of towers: they had an ominous look.",here and there upon heights and ridges they caught glimpses of ancient walls of stone and the ruins of towers they had an ominous look,upon heights ridges caught glimpses ancient walls stone ruins towers ominous look
147,"Frodo, who was not walking, had time to gaze ahead and to think.",frodo who was not walking had time to gaze ahead and to think,frodo walking time gaze ahead think
148,"He recalled Bilbo's account of his journey and the threatening towers on the hills north of the Road, in the country near the Troll's wood where his first serious adventure had happened.",he recalled bilbos account of his journey and the threatening towers on the hills north of the road in the country near the trolls wood where his first serious adventure had happened,recalled bilbos account journey threatening towers hills north road country near trolls wood first serious adventure happened
149,"Frodo guessed that they were now in the same region, and wondered if by chance they would pass near the spot.",frodo guessed that they were now in the same region and wondered if by chance they would pass near the spot,frodo guessed region wondered chance would pass near spot
150,'Who lives in this land?',who lives in this land,lives land
151,he asked.,he asked,asked
152,'And who built these towers?,and who built these towers,built towers
153,Is this troll-country?',is this trollcountry,trollcountry
154,'No!',no,
155,said Strider.,said strider,said strider
156,'Trolls do not build.,trolls do not build,trolls build
157,No one lives in this land.,no one lives in this land,one lives land
158,"Men once dwelt here, ages ago; but none remain now.",men once dwelt here ages ago but none remain now,men dwelt ages ago none remain
159,"They became an evil people, as legends tell, for they fell under the shadow of Angmar.",they became an evil people as legends tell for they fell under the shadow of angmar,became evil people legends tell fell shadow angmar
160,But all were destroyed in the war that brought the North Kingdom to its end.,but all were destroyed in the war that brought the north kingdom to its end,destroyed war brought north kingdom end
161,"But that is now so long ago that the hills have forgotten them, though a shadow still lies on the land.'",but that is now so long ago that the hills have forgotten them though a shadow still lies on the land,long ago hills forgotten though shadow still lies land
162,"'Where did you learn such tales, if all the land is empty and forgetful?'",where did you learn such tales if all the land is empty and forgetful,learn tales land empty forgetful
163,asked Peregrin.,asked peregrin,asked peregrin
164,'The birds and beasts do not tell tales of that son.',the birds and beasts do not tell tales of that son,birds beasts tell tales son
165,"'The heirs of Elendil do not forget all things past,' said Strider; 'and many more things than I can tell are remembered in Rivendell.'",the heirs of elendil do not forget all things past said strider and many more things than i can tell are remembered in rivendell,heirs elendil forget things past said strider many things tell remembered rivendell
166,'Have you often been to Rivendell?',have you often been to rivendell,often rivendell
167,said Frodo.,said frodo,said frodo
168,"'I have,' said Strider.",i have said strider,said strider
169,"'I dwelt there once, and still I return when I may.",i dwelt there once and still i return when i may,dwelt still return may
170,"There my heart is; but it is not my fate to sit in peace, even in the fair house of Elrond.'",there my heart is but it is not my fate to sit in peace even in the fair house of elrond,heart fate sit peace even fair house elrond
171,The hills now began to shut them in.,the hills now began to shut them in,hills began shut
172,"The Road behind held on its way to the River Bruinen, but both were now hidden from view.",the road behind held on its way to the river bruinen but both were now hidden from view,road behind held way river bruinen hidden view
173,"The travellers came into a long valley; narrow, deeply cloven, dark and silent.",the travellers came into a long valley narrow deeply cloven dark and silent,travellers came long valley narrow deeply cloven dark silent
174,"Trees with old and twisted roots hung over cliffs, and piled up behind into mounting slopes of pine-wood.",trees with old and twisted roots hung over cliffs and piled up behind into mounting slopes of pinewood,trees old twisted roots hung cliffs piled behind mounting slopes pinewood
175,The hobbits grew very weary.,the hobbits grew very weary,hobbits grew weary
176,"They advanced slowly, for they had to pick their way through a pathless country, encumbered by fallen trees and tumbled rocks.",they advanced slowly for they had to pick their way through a pathless country encumbered by fallen trees and tumbled rocks,advanced slowly pick way pathless country encumbered fallen trees tumbled rocks
177,"As long as they could they avoided climbing for Frodo's sake, and because it was in fact difficult to find any way up out of the narrow dales.",as long as they could they avoided climbing for frodos sake and because it was in fact difficult to find any way up out of the narrow dales,long could avoided climbing frodos sake fact difficult find way narrow dales
178,They had been two days in this country when the weather turned wet.,they had been two days in this country when the weather turned wet,two days country weather turned wet
179,The wind began to blow steadily out of the West and pour the water of the distant seas on the dark heads of the hills in fine drenching rain.,the wind began to blow steadily out of the west and pour the water of the distant seas on the dark heads of the hills in fine drenching rain,wind began blow steadily west pour water distant seas dark heads hills fine drenching rain
180,"By nightfall they were all soaked, and their camp was cheerless, for they could not get any fire to burn.",by nightfall they were all soaked and their camp was cheerless for they could not get any fire to burn,nightfall soaked camp cheerless could get fire burn
181,"The next day the hills rose still higher and steeper before them, and they were forced to turn away northwards out of their course.",the next day the hills rose still higher and steeper before them and they were forced to turn away northwards out of their course,next day hills rose still higher steeper forced turn away northwards course
182,"Strider seemed to be getting anxious: they were nearly ten days out from Weathertop, and their stock of provisions was beginning to run low.",strider seemed to be getting anxious they were nearly ten days out from weathertop and their stock of provisions was beginning to run low,strider seemed getting anxious nearly ten days weathertop stock provisions beginning run low
183,It went on raining.,it went on raining,went raining
184,"That night they camped on a stony shelf with a rock-wall behind them, in which there was a shallow cave, a mere scoop in the cliff.",that night they camped on a stony shelf with a rockwall behind them in which there was a shallow cave a mere scoop in the cliff,night camped stony shelf rockwall behind shallow cave mere scoop cliff
185,Frodo was restless.,frodo was restless,frodo restless
186,"The cold and wet had made his wound more painful than ever, and the ache and sense of deadly chill took away all sleep.",the cold and wet had made his wound more painful than ever and the ache and sense of deadly chill took away all sleep,cold wet made wound painful ever ache sense deadly chill took away sleep
187,"He lay tossing and turning and listening fearfully to the stealthy night-noises: wind in chinks of rock, water dripping, a crack, the sudden rattling fall of a loosened stone.",he lay tossing and turning and listening fearfully to the stealthy nightnoises wind in chinks of rock water dripping a crack the sudden rattling fall of a loosened stone,lay tossing turning listening fearfully stealthy nightnoises wind chinks rock water dripping crack sudden rattling fall loosened stone
188,"He felt that black shapes were advancing to smother him; but when he sat up he saw nothing but the back of Strider sitting hunched up, smoking his pipe, and watching.",he felt that black shapes were advancing to smother him but when he sat up he saw nothing but the back of strider sitting hunched up smoking his pipe and watching,felt black shapes advancing smother sat saw nothing back strider sitting hunched smoking pipe watching
189,"He lay down again and passed into an uneasy dream, in which he walked on the grass in his garden in the Shire, but it seemed faint and dim, less clear than the tall black shadows that stood looking over the hedge.",he lay down again and passed into an uneasy dream in which he walked on the grass in his garden in the shire but it seemed faint and dim less clear than the tall black shadows that stood looking over the hedge,lay passed uneasy dream walked grass garden shire seemed faint dim less clear tall black shadows stood looking hedge
190,In the morning he woke to find that the rain had stopped.,in the morning he woke to find that the rain had stopped,morning woke find rain stopped
191,"The clouds were still thick, but they were breaking, and pale strips of blue appeared between them.",the clouds were still thick but they were breaking and pale strips of blue appeared between them,clouds still thick breaking pale strips blue appeared
192,The wind was shifting again.,the wind was shifting again,wind shifting
193,They did not start early.,they did not start early,start early
194,"Immediately after their cold and comfortless breakfast Strider went off alone, telling the others to remain under the shelter of the cliff, until he came back.",immediately after their cold and comfortless breakfast strider went off alone telling the others to remain under the shelter of the cliff until he came back,immediately cold comfortless breakfast strider went alone telling others remain shelter cliff came back
195,"He was going to climb up, if he could, and get a look at the lie of the land.",he was going to climb up if he could and get a look at the lie of the land,going climb could get look lie land
196,When he returned he was not reassuring.,when he returned he was not reassuring,returned reassuring
197,"'We have come too far to the north,' he said, 'and we must find some way to turn back southwards again.",we have come too far to the north he said and we must find some way to turn back southwards again,come far north said must find way turn back southwards
198,If we keep on as we are going we shall get up into the Ettendales far north of Rivendell.,if we keep on as we are going we shall get up into the ettendales far north of rivendell,keep going shall get ettendales far north rivendell
199,"That is troll-country, and little known to me.",that is trollcountry and little known to me,trollcountry little known
200,"We could perhaps find our way through and come round to Rivendell from the north; but it would take too long, for I do not know the way, and our food would not last.",we could perhaps find our way through and come round to rivendell from the north but it would take too long for i do not know the way and our food would not last,could perhaps find way come round rivendell north would take long know way food would last
201,So somehow or other we must find the Ford of Bruinen.',so somehow or other we must find the ford of bruinen,somehow must find ford bruinen
202,The rest of that day they spent scrambling over rocky ground.,the rest of that day they spent scrambling over rocky ground,rest day spent scrambling rocky ground
203,"They found a passage between two hills that led them into a valley running south-east, the direction that they wished to take; but towards the end of the day they found their road again barred by a ridge of high land; its dark edge against the sky was broken into many bare points like teeth of a blunted saw.",they found a passage between two hills that led them into a valley running southeast the direction that they wished to take but towards the end of the day they found their road again barred by a ridge of high land its dark edge against the sky was broken into many bare points like teeth of a blunted saw,found passage two hills led valley running southeast direction wished take towards end day found road barred ridge high land dark edge sky broken many bare points like teeth blunted saw
204,They had a choice between going back or climbing over it.,they had a choice between going back or climbing over it,choice going back climbing
205,"They decided to attempt the climb, but it proved very difficult.",they decided to attempt the climb but it proved very difficult,decided attempt climb proved difficult
206,Before long Frodo was obliged to dismount and struggle along on foot.,before long frodo was obliged to dismount and struggle along on foot,long frodo obliged dismount struggle along foot
207,"Even so they often despaired of getting their pony up, or indeed of finding a path for themselves, burdened as they were.",even so they often despaired of getting their pony up or indeed of finding a path for themselves burdened as they were,even often despaired getting pony indeed finding path burdened
208,"The light was nearly gone, and they were all exhausted, when at last they reached the top.",the light was nearly gone and they were all exhausted when at last they reached the top,light nearly gone exhausted last reached top
209,"They had climbed on to a narrow saddle between two higher points, and the land fell steeply away again, only a short distance ahead.",they had climbed on to a narrow saddle between two higher points and the land fell steeply away again only a short distance ahead,climbed narrow saddle two higher points land fell steeply away short distance ahead
210,"Frodo threw himself down, and lay on the ground shivering.",frodo threw himself down and lay on the ground shivering,frodo threw lay ground shivering
211,"His left arm was lifeless, and his side and shoulder felt as if icy claws were laid upon them.",his left arm was lifeless and his side and shoulder felt as if icy claws were laid upon them,left arm lifeless side shoulder felt icy claws laid upon
212,The trees and rocks about him seemed shadowy and dim.,the trees and rocks about him seemed shadowy and dim,trees rocks seemed shadowy dim
213,"'We cannot go any further,' said Merry to Strider.",we cannot go any further said merry to strider,go said merry strider
214,'I am afraid this has been too much for Frodo.,i am afraid this has been too much for frodo,afraid much frodo
215,I am dreadfully anxious about him.,i am dreadfully anxious about him,dreadfully anxious
216,What are we to do?,what are we to do,
217,"Do you think they will be able to cure him in Rivendell, if we ever get there?'",do you think they will be able to cure him in rivendell if we ever get there,think able cure rivendell ever get
218,"'We shall see,' answered Strider.",we shall see answered strider,shall see answered strider
219,'There is nothing more that I can do in the wilderness; and it is chiefly because of his wound that I am so anxious to press on.,there is nothing more that i can do in the wilderness and it is chiefly because of his wound that i am so anxious to press on,nothing wilderness chiefly wound anxious press
220,But I agree that we can go no further tonight.',but i agree that we can go no further tonight,agree go tonight
221,'What is the matter with my master?',what is the matter with my master,matter master
222,"asked Sam in a low voice, looking appealingly at Strider.",asked sam in a low voice looking appealingly at strider,asked sam low voice looking appealingly strider
223,"'His wound was small, and it is already closed.",his wound was small and it is already closed,wound small already closed
224,There's nothing to be seen but a cold white mark on his shoulder.',theres nothing to be seen but a cold white mark on his shoulder,theres nothing seen cold white mark shoulder
225,"'Frodo has been touched by the weapons of the Enemy,' said Strider, 'and there is some poison or evil at work that is beyond my skill to drive out.",frodo has been touched by the weapons of the enemy said strider and there is some poison or evil at work that is beyond my skill to drive out,frodo touched weapons enemy said strider poison evil work beyond skill drive
226,"But do not give up hope, Sam!'",but do not give up hope sam,give hope sam
227,Night was cold up on the high ridge.,night was cold up on the high ridge,night cold high ridge
228,"They lit a small fire down under the gnarled roots of an old pine, that hung over a shallow pit: it looked as if stone had once been quarried there.",they lit a small fire down under the gnarled roots of an old pine that hung over a shallow pit it looked as if stone had once been quarried there,lit small fire gnarled roots old pine hung shallow pit looked stone quarried
229,They sat huddled together.,they sat huddled together,sat huddled together
230,"The wind blew chill through the pass, and they heard the tree-tops lower down moaning and sighing.",the wind blew chill through the pass and they heard the treetops lower down moaning and sighing,wind blew chill pass heard treetops lower moaning sighing
231,"Frodo lay half in a dream, imagining that endless dark wings were sweeping by above him, and that on the wings rode pursuers that sought him in all the hollows of the hills.",frodo lay half in a dream imagining that endless dark wings were sweeping by above him and that on the wings rode pursuers that sought him in all the hollows of the hills,frodo lay half dream imagining endless dark wings sweeping wings rode pursuers sought hollows hills
232,"The morning dawned bright and fair; the air was clean, and the light pale and clear in a rain-washed sky.",the morning dawned bright and fair the air was clean and the light pale and clear in a rainwashed sky,morning dawned bright fair air clean light pale clear rainwashed sky
233,"Their hearts were encouraged, but (hey longed for the sun to warm their cold stiff limbs.",their hearts were encouraged but hey longed for the sun to warm their cold stiff limbs,hearts encouraged hey longed sun warm cold stiff limbs
234,"As soon as it was light, Strider took Merry with him and went to survey the country from the height to the east of the pass.",as soon as it was light strider took merry with him and went to survey the country from the height to the east of the pass,soon light strider took merry went survey country height east pass
235,The sun had risen and was shining brightly when he returned with more comforting news.,the sun had risen and was shining brightly when he returned with more comforting news,sun risen shining brightly returned comforting news
236,They were now going more or less in the right direction.,they were now going more or less in the right direction,going less right direction
237,"If they went on, down the further side of the ridge, they would have the Mountains on their left.",if they went on down the further side of the ridge they would have the mountains on their left,went side ridge would mountains left
238,"Some way ahead Strider had caught a glimpse of the Loudwater again, and he knew that, though it was hidden from view, the Road to the Ford was not far from the River and lay on the side nearest to them.",some way ahead strider had caught a glimpse of the loudwater again and he knew that though it was hidden from view the road to the ford was not far from the river and lay on the side nearest to them,way ahead strider caught glimpse loudwater knew though hidden view road ford far river lay side nearest
239,"'We must make for the Road again,' he said.",we must make for the road again he said,must make road said
240,'We cannot hope to find a path through these hills.,we cannot hope to find a path through these hills,hope find path hills
