sentence_id,sentence,cleaned_sentence,tokens
516,Three dwarves came out of different rooms where they had been busy.,three dwarves came out of different rooms where they had been busy,three dwarves came different rooms busy
517,'Is everything ready?',is everything ready,everything ready
518,asked Bilbo.,asked bilbo,asked bilbo
519,'Everything packed and labelled?',everything packed and labelled,everything packed labelled
520,"'Everything,' they answered.",everything they answered,everything answered
521,"'Well, let's start then!'",well lets start then,well lets start
522,He stepped out of the front-door.,he stepped out of the frontdoor,stepped frontdoor
523,"It was a fine night, and the black sky was dotted with stars.",it was a fine night and the black sky was dotted with stars,fine night black sky dotted stars
524,"He looked up, sniffing the air.",he looked up sniffing the air,looked sniffing air
525,'What fun!,what fun,fun
526,"What fun to be off again, off on the Road with dwarves!",what fun to be off again off on the road with dwarves,fun road dwarves
527,"This is what I have really been longing for, for years!",this is what i have really been longing for for years,really longing years
528,Good-bye! ',goodbye,goodbye
529,"he said, looking at his old home and bowing to the door.",he said looking at his old home and bowing to the door,said looking old home bowing door
530,"'Good-bye, Gandalf!'",goodbye gandalf,goodbye gandalf
531,"'Good-bye, for the present, Bilbo.",goodbye for the present bilbo,goodbye present bilbo
532,Take care of yourself!,take care of yourself,take care
533,"You are old enough, and perhaps wise enough.'",you are old enough and perhaps wise enough,old enough perhaps wise enough
534,'Take care!,take care,take care
535,I don't care.,i dont care,dont care
536,Don't you worry about me!,dont you worry about me,dont worry
537,"I am as happy now as I have ever been, and that is saying a great deal.",i am as happy now as i have ever been and that is saying a great deal,happy ever saying great deal
538,But the time has come.,but the time has come,time come
539,"I am being swept off my feet at last,' he added, and then in a low voice, as if to himself, he sang softly in the dark:

          The Road goes ever on and on
            Down from the door where it began.",i am being swept off my feet at last he added and then in a low voice as if to himself he sang softly in the dark the road goes ever on and on down from the door where it began,swept feet last added low voice sang softly dark road goes ever door began
540,"Now far ahead the Road has gone,
            And I must follow, if I can,
           Pursuing it with eager feet,
            Until it joins some larger way
           Where many paths and errands meet.",now far ahead the road has gone and i must follow if i can pursuing it with eager feet until it joins some larger way where many paths and errands meet,far ahead road gone must follow pursuing eager feet joins larger way many paths errands meet
541,And whither then?,and whither then,whither
542,I cannot say.,i cannot say,say
543,"He paused, silent for a moment.",he paused silent for a moment,paused silent moment
544,"Then without another word he turned away from the lights and voices in the fields and tents, and followed by his three companions went round into his garden, and trotted down the long sloping path.",then without another word he turned away from the lights and voices in the fields and tents and followed by his three companions went round into his garden and trotted down the long sloping path,without another word turned away lights voices fields tents followed three companions went round garden trotted long sloping path
545,"He jumped over a low place in the hedge at the bottom, and took to the meadows, passing into the night like a rustle of wind in the grass.",he jumped over a low place in the hedge at the bottom and took to the meadows passing into the night like a rustle of wind in the grass,jumped low place hedge bottom took meadows passing night like rustle wind grass
546,Gandalf remained for a while staring after him into the darkness.,gandalf remained for a while staring after him into the darkness,gandalf remained staring darkness
547,"'Goodbye, my dear Bilbo  until our next meeting!'",goodbye my dear bilbo until our next meeting,goodbye dear bilbo next meeting
548,he said softly and went back indoors.,he said softly and went back indoors,said softly went back indoors
549,"Frodo came in soon afterwards, and found him sitting in the dark, deep in thought.",frodo came in soon afterwards and found him sitting in the dark deep in thought,frodo came soon afterwards found sitting dark deep thought
550,'Has he gone?',has he gone,gone
551,he asked.,he asked,asked
552,"'Yes,' answered Gandalf, 'he has gone at last.'",yes answered gandalf he has gone at last,yes answered gandalf gone last
553,"' I wish  I mean, I hoped until this evening that it was only a joke,' said Frodo.",i wish i mean i hoped until this evening that it was only a joke said frodo,wish mean hoped evening joke said frodo
554,'But I knew in my heart that he really meant to go.,but i knew in my heart that he really meant to go,knew heart really meant go
555,He always used to joke about serious things.,he always used to joke about serious things,always used joke serious things
556,"I wish I had come back sooner, just to see him off.'",i wish i had come back sooner just to see him off,wish come back sooner see
557,"I think really he preferred slipping off quietly in the end,' said Gandalf.",i think really he preferred slipping off quietly in the end said gandalf,think really preferred slipping quietly end said gandalf
558,'Don't be too troubled.,dont be too troubled,dont troubled
559,He'll be all right  now.,hell be all right now,hell right
560,He left a packet for you.,he left a packet for you,left packet
561,There it is!',there it is,
562,"Frodo took the envelope from the mantelpiece, and glanced at it, but did not open it.",frodo took the envelope from the mantelpiece and glanced at it but did not open it,frodo took envelope mantelpiece glanced open
563,"'You'll find his will and all the other documents in there, I think,' said the wizard.",youll find his will and all the other documents in there i think said the wizard,youll find documents think said wizard
564,'You are the master of Bag End now.,you are the master of bag end now,master bag end
565,"And also, I fancy, you'll find a golden ring.'",and also i fancy youll find a golden ring,also fancy youll find golden ring
566,'The ring!',the ring,ring
567,exclaimed Frodo.,exclaimed frodo,exclaimed frodo
568,'Has he left me that?,has he left me that,left
569,I wonder why.,i wonder why,wonder
570,"Still, it may be useful.'",still it may be useful,still may useful
571,"'It may, and it may not,' said Gandalf.",it may and it may not said gandalf,may may said gandalf
572,"'I should not make use of it, if I were you.",i should not make use of it if i were you,make use
573,"But keep it secret, and keep it safe!",but keep it secret and keep it safe,keep secret keep safe
574,Now I am going to bed.',now i am going to bed,going bed
575,As master of Bag End Frodo felt it his painful duty to say good-bye to the guests.,as master of bag end frodo felt it his painful duty to say goodbye to the guests,master bag end frodo felt painful duty say goodbye guests
576,"Rumours of strange events had by now spread all over the field, but Frodo would only say _no doubt everything will be cleared up in the morning_.",rumours of strange events had by now spread all over the field but frodo would only say no doubt everything will be cleared up in the morning,rumours strange events spread field frodo would say doubt everything cleared morning
577,About midnight carriages came for the important folk.,about midnight carriages came for the important folk,midnight carriages came important folk
578,"One by one they rolled away, filled with full but very unsatisfied hobbits.",one by one they rolled away filled with full but very unsatisfied hobbits,one one rolled away filled full unsatisfied hobbits
579,"Gardeners came by arrangement, and removed in wheel-barrows those that had inadvertently remained behind.",gardeners came by arrangement and removed in wheelbarrows those that had inadvertently remained behind,gardeners came arrangement removed wheelbarrows inadvertently remained behind
580,Night slowly passed.,night slowly passed,night slowly passed
581,The sun rose.,the sun rose,sun rose
582,The hobbits rose rather later.,the hobbits rose rather later,hobbits rose rather later
583,Morning went on.,morning went on,morning went
584,"People came and began (by orders) to clear away the pavilions and the tables and the chairs, and the spoons and knives and bottles and plates, and the lanterns, and the flowering shrubs in boxes, and the crumbs and cracker-paper, the forgotten bags and gloves and handkerchiefs, and the uneaten food (a very small item).",people came and began by orders to clear away the pavilions and the tables and the chairs and the spoons and knives and bottles and plates and the lanterns and the flowering shrubs in boxes and the crumbs and crackerpaper the forgotten bags and gloves and handkerchiefs and the uneaten food a very small item,people came began orders clear away pavilions tables chairs spoons knives bottles plates lanterns flowering shrubs boxes crumbs crackerpaper forgotten bags gloves handkerchiefs uneaten food small item
585,"Then a number of other people came (without orders): Bagginses, and Boffins, and Bolgers, and Tooks, and other guests that lived or were staying near.",then a number of other people came without orders bagginses and boffins and bolgers and tooks and other guests that lived or were staying near,number people came without orders bagginses boffins bolgers tooks guests lived staying near
586,"By mid-day, when even the best-fed were out and about again, there was a large crowd at Bag End, uninvited but not unexpected.",by midday when even the bestfed were out and about again there was a large crowd at bag end uninvited but not unexpected,midday even bestfed large crowd bag end uninvited unexpected
587,"Frodo was waiting on the step, smiling, but looking rather tired and worried.",frodo was waiting on the step smiling but looking rather tired and worried,frodo waiting step smiling looking rather tired worried
588,"He welcomed all the callers, but he had not much more to say than before.",he welcomed all the callers but he had not much more to say than before,welcomed callers much say
589,His reply to all inquiries was simply this: 'Mr.,his reply to all inquiries was simply this mr,reply inquiries simply mr
590,"Bilbo Baggins has gone away; as far as I know, for good.'",bilbo baggins has gone away as far as i know for good,bilbo baggins gone away far know good
591,"Some of the visitors he invited to come inside, as Bilbo had left 'messages' for them.",some of the visitors he invited to come inside as bilbo had left messages for them,visitors invited come inside bilbo left messages
592,Inside in the hall there was piled a large assortment of packages and parcels and small articles of furniture.,inside in the hall there was piled a large assortment of packages and parcels and small articles of furniture,inside hall piled large assortment packages parcels small articles furniture
593,On every item there was a label tied.,on every item there was a label tied,every item label tied
594,"There were several labels of this sort:
     _For ADELARD TOOK, for his VERY OWN, from Bilbo,_ on an umbrella.",there were several labels of this sort for adelard took for his very own from bilbo on an umbrella,several labels sort adelard took bilbo umbrella
595,Adelard had carried off many unlabelled ones.,adelard had carried off many unlabelled ones,adelard carried many unlabelled ones
596,"_For DORA BAGGINS in memory of a LONG correspondence, with love from Bilbo,_ on a large waste-paper basket.",for dora baggins in memory of a long correspondence with love from bilbo on a large wastepaper basket,dora baggins memory long correspondence love bilbo large wastepaper basket
597,"Dora was Drogo's sister and the eldest surviving female relative of Bilbo and Frodo; she was ninety-nine, and had written reams of good advice for more than half a century.",dora was drogos sister and the eldest surviving female relative of bilbo and frodo she was ninetynine and had written reams of good advice for more than half a century,dora drogos sister eldest surviving female relative bilbo frodo ninetynine written reams good advice half century
598,"_For MILO BURROWS, hoping it will be useful, from B.B.,_ on a gold pen and ink-bottle.",for milo burrows hoping it will be useful from bb on a gold pen and inkbottle,milo burrows hoping useful bb gold pen inkbottle
599,Milo never answered letters.,milo never answered letters,milo never answered letters
600,"_For ANGELICA'S use, from Uncle Bilbo,_ on a round convex mirror.",for angelicas use from uncle bilbo on a round convex mirror,angelicas use uncle bilbo round convex mirror
601,"She was a young Baggins, and too obviously considered her face shapely.",she was a young baggins and too obviously considered her face shapely,young baggins obviously considered face shapely
602,"_For the collection of HUGO BRACEGIRDLE, from a contributor,_ on an (empty) book-case.",for the collection of hugo bracegirdle from a contributor on an empty bookcase,collection hugo bracegirdle contributor empty bookcase
603,"Hugo was a great borrower of books, and worse than usual at returning them.",hugo was a great borrower of books and worse than usual at returning them,hugo great borrower books worse usual returning
604,"_For LOBELIA SACKVILLE-BAGGINS, as a PRESENT,_ on a case of silver spoons.",for lobelia sackvillebaggins as a present on a case of silver spoons,lobelia sackvillebaggins present case silver spoons
605,"Bilbo believed that she had acquired a good many of his spoons, while he was away on his former journey.",bilbo believed that she had acquired a good many of his spoons while he was away on his former journey,bilbo believed acquired good many spoons away former journey
606,Lobelia knew that quite well.,lobelia knew that quite well,lobelia knew quite well
607,"When she arrived later in the day, she took the point at once, but she also took the spoons.",when she arrived later in the day she took the point at once but she also took the spoons,arrived later day took point also took spoons
608,This is only a small selection of the assembled presents.,this is only a small selection of the assembled presents,small selection assembled presents
609,Bilbo's residence had got rather cluttered up with things in the course of his long life.,bilbos residence had got rather cluttered up with things in the course of his long life,bilbos residence got rather cluttered things course long life
610,It was a tendency of hobbit-holes to get cluttered up: for which the custom of giving so many birthday-presents was largely responsible.,it was a tendency of hobbitholes to get cluttered up for which the custom of giving so many birthdaypresents was largely responsible,tendency hobbitholes get cluttered custom giving many birthdaypresents largely responsible
611,"Not, of course, that the birthday-presents were always _new,_ there were one or two old _mathoms_ of forgotten uses that had circulated all around the district; but Bilbo had usually given new presents, and kept those that he received.",not of course that the birthdaypresents were always new there were one or two old mathoms of forgotten uses that had circulated all around the district but bilbo had usually given new presents and kept those that he received,course birthdaypresents always new one two old mathoms forgotten uses circulated around district bilbo usually given new presents kept received
612,The old hole was now being cleared a little.,the old hole was now being cleared a little,old hole cleared little
613,"Every one of the various parting gifts had labels, written out personally by Bilbo, and several had some point, or some joke.",every one of the various parting gifts had labels written out personally by bilbo and several had some point or some joke,every one various parting gifts labels written personally bilbo several point joke
614,"But, of course, most of the things were given where they would be wanted and welcome.",but of course most of the things were given where they would be wanted and welcome,course things given would wanted welcome
615,"The poorer hobbits, and especially those of Bagshot Row, did very well.",the poorer hobbits and especially those of bagshot row did very well,poorer hobbits especially bagshot row well
616,"Old Gaffer Gamgee got two sacks of potatoes, a new spade, a woollen waistcoat, and a bottle of ointment for creaking joints.",old gaffer gamgee got two sacks of potatoes a new spade a woollen waistcoat and a bottle of ointment for creaking joints,old gaffer gamgee got two sacks potatoes new spade woollen waistcoat bottle ointment creaking joints
617,"Old Rory Brandybuck, in return for much hospitality, got a dozen bottles of Old Winyards: a strong red wine from the Southfarthing, and now quite mature, as it had been laid down by Bilbo's father.",old rory brandybuck in return for much hospitality got a dozen bottles of old winyards a strong red wine from the southfarthing and now quite mature as it had been laid down by bilbos father,old rory brandybuck return much hospitality got dozen bottles old winyards strong red wine southfarthing quite mature laid bilbos father
618,"Rory quite forgave Bilbo, and voted him a capital fellow after the first bottle.",rory quite forgave bilbo and voted him a capital fellow after the first bottle,rory quite forgave bilbo voted capital fellow first bottle
619,There was plenty of everything left for Frodo.,there was plenty of everything left for frodo,plenty everything left frodo
620,"And, of course, all the chief treasures, as well as the books, pictures, and more than enough furniture, were left in his possession.",and of course all the chief treasures as well as the books pictures and more than enough furniture were left in his possession,course chief treasures well books pictures enough furniture left possession
621,"There was, however, no sign nor mention of money or jewellery: not a penny-piece or a glass bead was given away.",there was however no sign nor mention of money or jewellery not a pennypiece or a glass bead was given away,however sign mention money jewellery pennypiece glass bead given away
622,Frodo had a very trying time that afternoon.,frodo had a very trying time that afternoon,frodo trying time afternoon
623,"A false rumour that the whole household was being distributed free spread like wildfire; and before long the place was packed with people who had no business there, but could not be kept out.",a false rumour that the whole household was being distributed free spread like wildfire and before long the place was packed with people who had no business there but could not be kept out,false rumour whole household distributed free spread like wildfire long place packed people business could kept
624,"Labels got torn off and mixed, and quarrels broke out.",labels got torn off and mixed and quarrels broke out,labels got torn mixed quarrels broke
625,"Some people tried to do swaps and deals in the hall; and others tried to make _off_ with minor items not addressed to them, or with anything that seemed unwanted or unwatched.",some people tried to do swaps and deals in the hall and others tried to make off with minor items not addressed to them or with anything that seemed unwanted or unwatched,people tried swaps deals hall others tried make minor items addressed anything seemed unwanted unwatched
626,The road to the gate was blocked with barrows and handcarts.,the road to the gate was blocked with barrows and handcarts,road gate blocked barrows handcarts
627,In the middle of the commotion the Sackville-Bagginses arrived.,in the middle of the commotion the sackvillebagginses arrived,middle commotion sackvillebagginses arrived
628,Frodo had retired for a while and left his friend Merry Brandybuck to keep an eye on things.,frodo had retired for a while and left his friend merry brandybuck to keep an eye on things,frodo retired left friend merry brandybuck keep eye things
629,"When Otho loudly demanded to see Frodo, Merry bowed politely.",when otho loudly demanded to see frodo merry bowed politely,otho loudly demanded see frodo merry bowed politely
630,"'He is indisposed,' he said.",he is indisposed he said,indisposed said
631,'He is resting.',he is resting,resting
632,"'Hiding, you mean,' said Lobelia.",hiding you mean said lobelia,hiding mean said lobelia
633,'Anyway we want to see him and we mean to see him.,anyway we want to see him and we mean to see him,anyway want see mean see
634,Just go and tell him so!',just go and tell him so,go tell
635,"Merry left them a long while in the hall, and they had time to discover their parting gift of spoons.",merry left them a long while in the hall and they had time to discover their parting gift of spoons,merry left long hall time discover parting gift spoons
636,It did not improve their tempers.,it did not improve their tempers,improve tempers
637,Eventually they were shown into the study.,eventually they were shown into the study,eventually shown study
638,Frodo was sitting at a table with a lot of papers in front of him.,frodo was sitting at a table with a lot of papers in front of him,frodo sitting table lot papers front
639,"He looked indisposed  to see Sackville-Bagginses at any rate; and he stood up, fidgeting with something in his pocket.",he looked indisposed to see sackvillebagginses at any rate and he stood up fidgeting with something in his pocket,looked indisposed see sackvillebagginses rate stood fidgeting something pocket
640,But he spoke quite politely.,but he spoke quite politely,spoke quite politely
641,The Sackville-Bagginses were rather offensive.,the sackvillebagginses were rather offensive,sackvillebagginses rather offensive
642,They began by offering him bad bargain-prices (as between friends) for various valuable and unlabelled things.,they began by offering him bad bargainprices as between friends for various valuable and unlabelled things,began offering bad bargainprices friends various valuable unlabelled things
643,"When Frodo replied that only the things specially directed by Bilbo were being given away, they said the whole affair was very fishy.",when frodo replied that only the things specially directed by bilbo were being given away they said the whole affair was very fishy,frodo replied things specially directed bilbo given away said whole affair fishy
644,"'Only one thing is clear to me,' said Otho, 'and that is that you are doing exceedingly well out of it.",only one thing is clear to me said otho and that is that you are doing exceedingly well out of it,one thing clear said otho exceedingly well
645,I insist on seeing the will.',i insist on seeing the will,insist seeing
646,"Otho would have been Bilbo's heir, but for the adoption of Frodo.",otho would have been bilbos heir but for the adoption of frodo,otho would bilbos heir adoption frodo
647,He read the will carefully and snorted.,he read the will carefully and snorted,read carefully snorted
648,"It was, unfortunately, very clear and correct (according to the legal customs of hobbits, which demand among other things seven signatures of witnesses in red ink).",it was unfortunately very clear and correct according to the legal customs of hobbits which demand among other things seven signatures of witnesses in red ink,unfortunately clear correct according legal customs hobbits demand among things seven signatures witnesses red ink
649,'Foiled again!',foiled again,foiled
650,he said to his wife.,he said to his wife,said wife
651,'And after waiting _sixty_ years.,and after waiting sixty years,waiting sixty years
652,Spoons?,spoons,spoons
653,Fiddlesticks!',fiddlesticks,fiddlesticks
654,He snapped his fingers under Frodo's nose and slumped off.,he snapped his fingers under frodos nose and slumped off,snapped fingers frodos nose slumped
655,But Lobelia was not so easily got rid of.,but lobelia was not so easily got rid of,lobelia easily got rid
656,"A little later Frodo came out of the study to see how things were going on and found her still about the place, investigating nooks and comers and tapping the floors.",a little later frodo came out of the study to see how things were going on and found her still about the place investigating nooks and comers and tapping the floors,little later frodo came study see things going found still place investigating nooks comers tapping floors
657,"He escorted her firmly off the premises, after he had relieved her of several small (but rather valuable) articles that had somehow fallen inside her umbrella.",he escorted her firmly off the premises after he had relieved her of several small but rather valuable articles that had somehow fallen inside her umbrella,escorted firmly premises relieved several small rather valuable articles somehow fallen inside umbrella
658,"Her face looked as if she was in the throes of thinking out a really crushing parting remark; but all she found to say, turning round on the step, was:
     'You'll live to regret it, young fellow!",her face looked as if she was in the throes of thinking out a really crushing parting remark but all she found to say turning round on the step was youll live to regret it young fellow,face looked throes thinking really crushing parting remark found say turning round step youll live regret young fellow
659,Why didn't you go too?,why didnt you go too,didnt go
