sentence_id,sentence,cleaned_sentence,tokens
173,"'Surely you see it, my friend?'",surely you see it my friend,surely see friend
174,"he said, turning now suddenly to Frodo again.",he said turning now suddenly to frodo again,said turning suddenly frodo
175,`You say that you are afraid.,you say that you are afraid,say afraid
176,"If it is so, the boldest should pardon you.",if it is so the boldest should pardon you,boldest pardon
177,But is it not really your good sense that revolts?',but is it not really your good sense that revolts,really good sense revolts
178,"'No, I am afraid,' said Frodo.",no i am afraid said frodo,afraid said frodo
179,'Simply afraid.,simply afraid,simply afraid
180,But I am glad to have heard you speak so fully.,but i am glad to have heard you speak so fully,glad heard speak fully
181,My mind is clearer now.',my mind is clearer now,mind clearer
182,`Then you will come to Minas Tirith? ',then you will come to minas tirith,come minas tirith
183,cried Boromir.,cried boromir,cried boromir
184,His eyes were shining and his face eager.,his eyes were shining and his face eager,eyes shining face eager
185,"`You misunderstand me,' said Frodo.",you misunderstand me said frodo,misunderstand said frodo
186,"'But you will come, at least for a while? '",but you will come at least for a while,come least
187,Boromir persisted.,boromir persisted,boromir persisted
188,'My city is not far now; and it is little further from there to Mordor than from here.,my city is not far now and it is little further from there to mordor than from here,city far little mordor
189,"We have been long in the wilderness, and you need news of what the Enemy is doing before you make a move.",we have been long in the wilderness and you need news of what the enemy is doing before you make a move,long wilderness need news enemy make move
190,"Come with me, Frodo,' he said.",come with me frodo he said,come frodo said
191,`You need rest before your venture.,you need rest before your venture,need rest venture
192,if go you must.',if go you must,go must
193,He laid his hand on the hobbit's shoulder in friendly fashion; but Frodo felt the hand trembling with suppressed excitement.,he laid his hand on the hobbits shoulder in friendly fashion but frodo felt the hand trembling with suppressed excitement,laid hand hobbits shoulder friendly fashion frodo felt hand trembling suppressed excitement
194,"He stepped quickly away, and eyed with alarm the tall Man, nearly twice his height and many times his match in strength.",he stepped quickly away and eyed with alarm the tall man nearly twice his height and many times his match in strength,stepped quickly away eyed alarm tall man nearly twice height many times match strength
195,`Why are you so unfriendly? ',why are you so unfriendly,unfriendly
196,said Boromir.,said boromir,said boromir
197,"`I am a true man, neither thief nor tracker.",i am a true man neither thief nor tracker,true man neither thief tracker
198,I need your Ring: that you know now; but I give you my word that I do not desire to keep it.,i need your ring that you know now but i give you my word that i do not desire to keep it,need ring know give word desire keep
199,Will you not at least let me make trial of my plan?,will you not at least let me make trial of my plan,least let make trial plan
200,Lend me the Ring! ',lend me the ring,lend ring
201,`No!,no,
202,no! ',no,
203,cried Frodo.,cried frodo,cried frodo
204,'The Council laid it upon me to bear it.',the council laid it upon me to bear it,council laid upon bear
205,"`It is by our own folly that the Enemy will defeat us,' cried Boromir.",it is by our own folly that the enemy will defeat us cried boromir,folly enemy defeat us cried boromir
206,`How it angers me!,how it angers me,angers
207,Fool!,fool,fool
208,Obstinate fool!,obstinate fool,obstinate fool
209,Running wilfully to death and ruining our cause.,running wilfully to death and ruining our cause,running wilfully death ruining cause
210,"If any mortals have claim to the Ring, it is the men of Númenor, and not Halflings.",if any mortals have claim to the ring it is the men of numenor and not halflings,mortals claim ring men numenor halflings
211,It is not yours save by unhappy chance.,it is not yours save by unhappy chance,save unhappy chance
212,It might have been mine.,it might have been mine,might mine
213,It should be mine.,it should be mine,mine
214,Give it to me! ',give it to me,give
215,"Frodo did not answer, but moved away till the great flat stone stood between them.",frodo did not answer but moved away till the great flat stone stood between them,frodo answer moved away till great flat stone stood
216,"`Come, come, my friend! '",come come my friend,come come friend
217,said Boromir in a softer voice.,said boromir in a softer voice,said boromir softer voice
218,'Why not get rid of it?,why not get rid of it,get rid
219,Why not be free of your doubt and fear?,why not be free of your doubt and fear,free doubt fear
220,"You can lay the blame on me, if you will.",you can lay the blame on me if you will,lay blame
221,You can say that I was too strong and took it by force.,you can say that i was too strong and took it by force,say strong took force
222,"For I am too strong for you, halfling,' he cried; and suddenly he sprang over the stone and leaped at Frodo.",for i am too strong for you halfling he cried and suddenly he sprang over the stone and leaped at frodo,strong halfling cried suddenly sprang stone leaped frodo
223,His fair and pleasant face was hideously changed; a raging fire was in his eyes.,his fair and pleasant face was hideously changed a raging fire was in his eyes,fair pleasant face hideously changed raging fire eyes
224,Frodo dodged aside and again put the stone between them.,frodo dodged aside and again put the stone between them,frodo dodged aside put stone
225,"There was only one thing he could do: trembling he pulled out the Ring upon its chain and quickly slipped it on his finger, even as Boromir sprang at him again.",there was only one thing he could do trembling he pulled out the ring upon its chain and quickly slipped it on his finger even as boromir sprang at him again,one thing could trembling pulled ring upon chain quickly slipped finger even boromir sprang
226,"The Man gasped, stared for a moment amazed, and then ran wildly about, seeking here and there among the rocks and trees.",the man gasped stared for a moment amazed and then ran wildly about seeking here and there among the rocks and trees,man gasped stared moment amazed ran wildly seeking among rocks trees
227,'Miserable trickster!',miserable trickster,miserable trickster
228,he shouted.,he shouted,shouted
229,`Let me get my hands on you!,let me get my hands on you,let get hands
230,Now I see your mind.,now i see your mind,see mind
231,You will take the Ring to Sauron and sell us all.,you will take the ring to sauron and sell us all,take ring sauron sell us
232,You have only waited your chance to leave us in the lurch.,you have only waited your chance to leave us in the lurch,waited chance leave us lurch
233,Curse you and all halflings to death and darkness! ',curse you and all halflings to death and darkness,curse halflings death darkness
234,"Then, catching his foot on a stone, he fell sprawling and lay upon his face.",then catching his foot on a stone he fell sprawling and lay upon his face,catching foot stone fell sprawling lay upon face
235,For a while he was as still as if his own curse had struck him down; then suddenly he wept.,for a while he was as still as if his own curse had struck him down then suddenly he wept,still curse struck suddenly wept
236,"He rose and passed his hand over his eyes, dashing away the tears.",he rose and passed his hand over his eyes dashing away the tears,rose passed hand eyes dashing away tears
237,'What have I said? ',what have i said,said
238,he cried.,he cried,cried
239,`What have I done?,what have i done,done
240,"Frodo, Frodo! '",frodo frodo,frodo frodo
241,he called.,he called,called
242,'Come back!,come back,come back
243,"A madness took me, but it has passed.",a madness took me but it has passed,madness took passed
244,Come back! ',come back,come back
245,There was no answer.,there was no answer,answer
246,Frodo did not even hear his cries.,frodo did not even hear his cries,frodo even hear cries
247,"He was already far away, leaping blindly up the path to the hill-top.",he was already far away leaping blindly up the path to the hilltop,already far away leaping blindly path hilltop
248,"Terror and grief shook him, seeing in his thought the mad fierce face of Boromir, and his burning eyes.",terror and grief shook him seeing in his thought the mad fierce face of boromir and his burning eyes,terror grief shook seeing thought mad fierce face boromir burning eyes
249,"Soon he came out alone on the summit of Amon Hen, and halted, gasping for breath.",soon he came out alone on the summit of amon hen and halted gasping for breath,soon came alone summit amon hen halted gasping breath
250,"He saw as through a mist a wide flat circle, paved with mighty flags, and surrounded with a crumbling battlement; and in the middle, set upon four carven pillars, was a high seat, reached by a stair of many steps.",he saw as through a mist a wide flat circle paved with mighty flags and surrounded with a crumbling battlement and in the middle set upon four carven pillars was a high seat reached by a stair of many steps,saw mist wide flat circle paved mighty flags surrounded crumbling battlement middle set upon four carven pillars high seat reached stair many steps
251,"Up he went and sat upon the ancient chair, feeling like a lost child that had clambered upon the throne of mountain-kings.",up he went and sat upon the ancient chair feeling like a lost child that had clambered upon the throne of mountainkings,went sat upon ancient chair feeling like lost child clambered upon throne mountainkings
252,At first he could see little.,at first he could see little,first could see little
253,He seemed to be in a world of mist in which there were only shadows: the Ring was upon him.,he seemed to be in a world of mist in which there were only shadows the ring was upon him,seemed world mist shadows ring upon
254,"Then here and there the mist gave way and he saw many visions: small and clear as if they were under his eyes upon a table, and yet remote.",then here and there the mist gave way and he saw many visions small and clear as if they were under his eyes upon a table and yet remote,mist gave way saw many visions small clear eyes upon table yet remote
255,"There was no sound, only bright living images.",there was no sound only bright living images,sound bright living images
256,The world seemed to have shrunk and fallen silent.,the world seemed to have shrunk and fallen silent,world seemed shrunk fallen silent
257,"He was sitting upon the Seat of Seeing, on Amon Hen, the Hill of the Eye of the Men of Númenor.",he was sitting upon the seat of seeing on amon hen the hill of the eye of the men of numenor,sitting upon seat seeing amon hen hill eye men numenor
258,"Eastward he looked into wide uncharted lands, nameless plains, and forests unexplored.",eastward he looked into wide uncharted lands nameless plains and forests unexplored,eastward looked wide uncharted lands nameless plains forests unexplored
259,"Northward he looked, and the Great River lay like a ribbon beneath him, and the Misty Mountains stood small and hard as broken teeth.",northward he looked and the great river lay like a ribbon beneath him and the misty mountains stood small and hard as broken teeth,northward looked great river lay like ribbon beneath misty mountains stood small hard broken teeth
260,"Westward he looked and saw the broad pastures of Rohan; and Orthanc, the pinnacle of Isengard, like a black spike.",westward he looked and saw the broad pastures of rohan and orthanc the pinnacle of isengard like a black spike,westward looked saw broad pastures rohan orthanc pinnacle isengard like black spike
261,"Southward he looked, and below his very feet the Great River curled like a toppling wave and plunged over the falls of Rauros into a foaming pit; a glimmering rainbow played upon the fume.",southward he looked and below his very feet the great river curled like a toppling wave and plunged over the falls of rauros into a foaming pit a glimmering rainbow played upon the fume,southward looked feet great river curled like toppling wave plunged falls rauros foaming pit glimmering rainbow played upon fume
262,"And Ethir Anduin he saw, the mighty delta of the River, and myriads of sea-birds whirling like a white dust in the sun, and beneath them a green and silver sea, rippling in endless lines.",and ethir anduin he saw the mighty delta of the river and myriads of seabirds whirling like a white dust in the sun and beneath them a green and silver sea rippling in endless lines,ethir anduin saw mighty delta river myriads seabirds whirling like white dust sun beneath green silver sea rippling endless lines
263,But everywhere he looked he saw the signs of war.,but everywhere he looked he saw the signs of war,everywhere looked saw signs war
264,The Misty Mountains were crawling like anthills: orcs were issuing out of a thousand holes.,the misty mountains were crawling like anthills orcs were issuing out of a thousand holes,misty mountains crawling like anthills orcs issuing thousand holes
265,Under the boughs of Mirkwood there was deadly strife of Elves and Men and fell beasts.,under the boughs of mirkwood there was deadly strife of elves and men and fell beasts,boughs mirkwood deadly strife elves men fell beasts
266,The land of the Beornings was aflame; a cloud was over Moria; smoke rose on the borders of Lórien.,the land of the beornings was aflame a cloud was over moria smoke rose on the borders of lorien,land beornings aflame cloud moria smoke rose borders lorien
267,Horsemen were galloping on the grass of Rohan; wolves poured from Isengard.,horsemen were galloping on the grass of rohan wolves poured from isengard,horsemen galloping grass rohan wolves poured isengard
268,"From the havens of Harad ships of war put out to sea; and out of the East Men were moving endlessly: swordsmen, spearmen, bowmen upon horses, chariots of chieftains and laden wains.",from the havens of harad ships of war put out to sea and out of the east men were moving endlessly swordsmen spearmen bowmen upon horses chariots of chieftains and laden wains,havens harad ships war put sea east men moving endlessly swordsmen spearmen bowmen upon horses chariots chieftains laden wains
269,All the power of the Dark Lord was in motion.,all the power of the dark lord was in motion,power dark lord motion
270,Then turning south again he beheld Minas Tirith.,then turning south again he beheld minas tirith,turning south beheld minas tirith
271,Far away it seemed.,far away it seemed,far away seemed
272,"and beautiful: white-walled, many-towered, proud and fair upon its mountain-seat; its battlements glittered with steel, and its turrets were bright with many banners.",and beautiful whitewalled manytowered proud and fair upon its mountainseat its battlements glittered with steel and its turrets were bright with many banners,beautiful whitewalled manytowered proud fair upon mountainseat battlements glittered steel turrets bright many banners
273,Hope leaped in his heart.,hope leaped in his heart,hope leaped heart
274,"But against Minas Tirith was set another fortress, greater and more strong.",but against minas tirith was set another fortress greater and more strong,minas tirith set another fortress greater strong
275,"Thither, eastward, unwilling his eye was drawn.",thither eastward unwilling his eye was drawn,thither eastward unwilling eye drawn
276,"It passed the ruined bridges of Osgiliath, the grinning gates of Minas Morgul.",it passed the ruined bridges of osgiliath the grinning gates of minas morgul,passed ruined bridges osgiliath grinning gates minas morgul
277,"and the haunted Mountains, and it looked upon Gorgoroth, the valley of terror in the Land of Mordor.",and the haunted mountains and it looked upon gorgoroth the valley of terror in the land of mordor,haunted mountains looked upon gorgoroth valley terror land mordor
278,Darkness lay there under the Sun.,darkness lay there under the sun,darkness lay sun
279,Fire glowed amid the smoke.,fire glowed amid the smoke,fire glowed amid smoke
280,"Mount Doom was burning, and a great reek rising.",mount doom was burning and a great reek rising,mount doom burning great reek rising
281,"Then at last his gaze was held: wall upon wall, battlement upon battlement, black, immeasurably strong, mountain of iron, gate of steel, tower of adamant, he saw it: Barad-dûr, Fortress of Sauron.",then at last his gaze was held wall upon wall battlement upon battlement black immeasurably strong mountain of iron gate of steel tower of adamant he saw it baraddur fortress of sauron,last gaze held wall upon wall battlement upon battlement black immeasurably strong mountain iron gate steel tower adamant saw baraddur fortress sauron
282,All hope left him.,all hope left him,hope left
283,And suddenly he felt the Eye.,and suddenly he felt the eye,suddenly felt eye
284,There was an eye in the Dark Tower that did not sleep.,there was an eye in the dark tower that did not sleep,eye dark tower sleep
285,He knew that it had become aware of his gaze.,he knew that it had become aware of his gaze,knew become aware gaze
286,A fierce eager will was there.,a fierce eager will was there,fierce eager
287,"It leaped towards him; almost like a finger he felt it, searching for him.",it leaped towards him almost like a finger he felt it searching for him,leaped towards almost like finger felt searching
288,"Very soon it would nail him down, know just exactly where he was.",very soon it would nail him down know just exactly where he was,soon would nail know exactly
289,Amon Lhaw it touched.,amon lhaw it touched,amon lhaw touched
290,"It glanced upon Tol Brandir he threw himself from the seat, crouching, covering his head with his grey hood.",it glanced upon tol brandir he threw himself from the seat crouching covering his head with his grey hood,glanced upon tol brandir threw seat crouching covering head grey hood
291,"He heard himself crying out: _Never, never!_Or was it: _Verily I come, I come to you_?",he heard himself crying out never neveror was it verily i come i come to you,heard crying never neveror verily come come
292,He could not tell.,he could not tell,could tell
293,Then as a flash from some other point of power there came to his mind another thought: _Take it off!,then as a flash from some other point of power there came to his mind another thought take it off,flash point power came mind another thought take
294,Take it off!,take it off,take
295,"Fool, take it off!",fool take it off,fool take
296,"Take off the Ring!_
     The two powers strove in him.",take off the ring the two powers strove in him,take ring two powers strove
297,"For a moment, perfectly balanced between their piercing points, he writhed, tormented.",for a moment perfectly balanced between their piercing points he writhed tormented,moment perfectly balanced piercing points writhed tormented
298,Suddenly he was aware of himself again.,suddenly he was aware of himself again,suddenly aware
299,"Frodo, neither the Voice nor the Eye: free to choose, and with one remaining instant in which to do so.",frodo neither the voice nor the eye free to choose and with one remaining instant in which to do so,frodo neither voice eye free choose one remaining instant
300,He took the Ring off his finger.,he took the ring off his finger,took ring finger
301,He was kneeling in clear sunlight before the high seat.,he was kneeling in clear sunlight before the high seat,kneeling clear sunlight high seat
302,"A black shadow seemed to pass like an arm above him; it missed Amon Hen and groped out west, and faded.",a black shadow seemed to pass like an arm above him it missed amon hen and groped out west and faded,black shadow seemed pass like arm missed amon hen groped west faded
303,Then all the sky was clean and blue and birds sang in every tree.,then all the sky was clean and blue and birds sang in every tree,sky clean blue birds sang every tree
304,Frodo rose to his feet.,frodo rose to his feet,frodo rose feet
305,"A great weariness was on him, but his will was firm and his heart lighter.",a great weariness was on him but his will was firm and his heart lighter,great weariness firm heart lighter
306,He spoke aloud to himself.,he spoke aloud to himself,spoke aloud
307,"`I will do now what I must,' he said.",i will do now what i must he said,must said
308,"'This at least is plain: the evil of the Ring is already at work even in the Company, and the Ring must leave them before it does more harm.",this at least is plain the evil of the ring is already at work even in the company and the ring must leave them before it does more harm,least plain evil ring already work even company ring must leave harm
309,I will go alone.,i will go alone,go alone
310,"Some I cannot trust, and those I can trust are too dear to me: poor old Sam, and Merry and Pippin.",some i cannot trust and those i can trust are too dear to me poor old sam and merry and pippin,trust trust dear poor old sam merry pippin
311,"Strider, too: his heart yearns for Minas Tirith, and he will be needed there, now Boromir has fallen into evil.",strider too his heart yearns for minas tirith and he will be needed there now boromir has fallen into evil,strider heart yearns minas tirith needed boromir fallen evil
312,I will go alone.,i will go alone,go alone
313,At once.',at once,
314,He went quickly down the path and came back to the lawn where Boromir had found him.,he went quickly down the path and came back to the lawn where boromir had found him,went quickly path came back lawn boromir found
315,"Then he halted, listening.",then he halted listening,halted listening
316,He thought he could hear cries and calls from the woods near the shore below.,he thought he could hear cries and calls from the woods near the shore below,thought could hear cries calls woods near shore
317,"'They'll be hunting for me,' he said.",theyll be hunting for me he said,theyll hunting said
318,`I wonder how long I have been away.,i wonder how long i have been away,wonder long away
319,"Hours, I should think.'",hours i should think,hours think
320,He hesitated.,he hesitated,hesitated
321,'What can I do? ',what can i do,
322,he muttered.,he muttered,muttered
323,'I must go now or I shall never go.,i must go now or i shall never go,must go shall never go
324,I shan't get a chance again.,i shant get a chance again,shant get chance
325,"I hate leaving them, and like this without any explanation.",i hate leaving them and like this without any explanation,hate leaving like without explanation
326,But surely they will understand.,but surely they will understand,surely understand
327,Sam will.,sam will,sam
328,And what else can I do?',and what else can i do,else
329,Slowly he drew out the Ring and put it on once more.,slowly he drew out the ring and put it on once more,slowly drew ring put
330,"He vanished and passed down the hill, less than a rustle of the wind.",he vanished and passed down the hill less than a rustle of the wind,vanished passed hill less rustle wind
331,The others remained long by the river-side.,the others remained long by the riverside,others remained long riverside
332,"For some time they had been silent, moving restlessly about; but now they were sitting in a circle, and they were talking.",for some time they had been silent moving restlessly about but now they were sitting in a circle and they were talking,time silent moving restlessly sitting circle talking
333,"Every now and again they made efforts to speak of other things, of their long road and many adventures; they questioned Aragorn concerning the realm of Gondor and its ancient history, and the remnants of its great works that could still be seen in this strange border-land of the Emyn Muil: the stone kings and the seats of Lhaw and Hen, and the great Stair beside the falls of Rauros.",every now and again they made efforts to speak of other things of their long road and many adventures they questioned aragorn concerning the realm of gondor and its ancient history and the remnants of its great works that could still be seen in this strange borderland of the emyn muil the stone kings and the seats of lhaw and hen and the great stair beside the falls of rauros,every made efforts speak things long road many adventures questioned aragorn concerning realm gondor ancient history remnants great works could still seen strange borderland emyn muil stone kings seats lhaw hen great stair beside falls rauros
334,But always their thoughts and words strayed back to Frodo and the Ring.,but always their thoughts and words strayed back to frodo and the ring,always thoughts words strayed back frodo ring
335,What would Frodo choose to do?,what would frodo choose to do,would frodo choose
336,Why was he hesitating?,why was he hesitating,hesitating
337,"`He is debating which course is the most desperate, I think,' said Aragorn.",he is debating which course is the most desperate i think said aragorn,debating course desperate think said aragorn
338,'And well he may.,and well he may,well may
339,"It is now more hopeless than ever for the Company to go east, since we have been tracked by Gollum, and must fear that the secret of our journey is already betrayed.",it is now more hopeless than ever for the company to go east since we have been tracked by gollum and must fear that the secret of our journey is already betrayed,hopeless ever company go east since tracked gollum must fear secret journey already betrayed
