sentence_id,sentence
0,"_
            The Old Forest

     Frodo woke suddenly."
1,It was still dark in the room.
2,"Merry was standing there with a candle in one hand, and banging on the door with the other."
3,'All right!
4,What is it?'
5,"said Frodo, still shaken and bewildered."
6,'What is it!'
7,cried Merry.
8,'It is time to get up.
9,It is half past four and very foggy.
10,Come on!
11,Sam is already getting breakfast ready.
12,Even Pippin is up.
13,"I am just going to saddle the ponies, and fetch the one that is to be the baggage-carrier."
14,Wake that sluggard Fatty!
15,At least he must get up and see us off.'
16,Soon after six o'clock the five hobbits were ready to start.
17,Fatty Bolger was still yawning.
18,They stole quietly out of the house.
19,"Merry went in front leading a laden pony, and took his way along a path that went through a spinney behind the house, and then cut across several fields."
20,"The leaves of trees were glistening, and every twig was dripping; the grass was grey with cold dew."
21,"Everything was still, and far-away noises seemed near and clear: fowls chattering in a yard, someone closing a door of a distant house."
22,"In their shed they found the ponies; sturdy little beasts of the kind loved by hobbits, not speedy, but good for a long day's work."
23,"They mounted, and soon they were riding off into the mist, which seemed to open reluctantly before them and close forbiddingly behind them."
24,"After riding for about an hour, slowly and without talking, they saw the Hedge looming suddenly ahead."
25,It was tall and netted over with silver cobwebs.
26,'How are you going to get through this?'
27,asked Fredegar.
28,'Follow me!'
29,"said Merry, 'and you will see.'"
30,"He turned to the left along the Hedge, and soon they came to a point where it bent inwards, running along the lip of a hollow."
31,"A cutting had been made, at some distance from the Hedge, and went sloping gently down into the ground."
32,"It had walls of brick at the sides, which rose steadily, until suddenly they arched over and formed a tunnel that dived deep under the Hedge and came out in the hollow on the other side."
33,Here Fatty Bolger halted.
34,"'Good-bye, Frodo!'"
35,he said.
36,'I wish you were not going into the Forest.
37,I only hope you will not need rescuing before the day is out.
38,But good luck to you  today and every day!'
39,"'If there are no worse things ahead than the Old Forest, I shall be lucky,' said Frodo."
40,'Tell Gandalf to hurry along the East Road: we shall soon be back on it and going as fast as we can.'
41,'Good-bye!'
42,"they cried, and rode down the slope and disappeared from Fredegar's sight into the tunnel."
43,It was dark and damp.
44,At the far end it was closed by a gate of thick-set iron bars.
45,"Merry got down and unlocked the gate, and when they had all passed through he pushed it to again."
46,"It shut with a clang, and the lock clicked."
47,The sound was ominous.
48,'There!'
49,said Merry.
50,"'You have left the Shire, and are now outside, and on the edge of the Old Forest.'"
51,'Are the stories about it true?'
52,asked Pippin.
53,"'I don't know what stories you mean,' Merry answered."
54,"'If you mean the old bogey-stories Fatty's nurses used to tell him, about goblins and wolves and things of that sort, I should say no."
55,At any rate I don't believe them.
56,But the Forest _is_ queer.
57,"Everything in it is very much more alive, more aware of what is going on, so to speak, than things are in the Shire."
58,And the trees do not like strangers.
59,They watch you.
60,"They are usually content merely to watch you, as long as daylight lasts, and don't do much."
61,"Occasionally the most unfriendly ones may drop a branch, or stick a root out, or grasp at you with a long trailer."
62,"But at night things can be most alarming, or so I am told."
63,"I have only once or twice been in here after dark, and then only near the hedge."
64,"I thought all the trees were whispering to each other, passing news and plots along in an unintelligible language; and the branches swayed and groped without any wind."
65,"They do say the trees do actually move, and can surround strangers and hem them in."
66,"In fact long ago they attacked the Hedge: they came and planted themselves right by it, and leaned over it."
67,"But the hobbits came and cut down hundreds of trees, and made a great bonfire in the Forest, and burned all the ground in a long strip east of the Hedge."
68,"After that the trees gave up the attack, but they became very unfriendly."
69,There is still a wide bare space not far inside where the bonfire was made.'
70,'Is it only the trees that are dangerous?'
71,asked Pippin.
72,"'There are various queer things living deep in the Forest, and on the far side,' said Merry, 'or at least I have heard so; but I have never seen any of them."
73,But something makes paths.
74,Whenever one comes inside one finds open tracks; but they seem to shift and change from time to time in a queer fashion.
75,"Not far from this tunnel there is, or was for a long time, the beginning of quite a broad path leading to the Bonfire Glade, and then on more or less in our direction, east and a little north."
76,That is the path I am going to try and find.'
77,The hobbits now left the tunnel-gate and rode across the wide hollow.
78,"On the far side was a faint path leading up on to the floor of the Forest, a hundred yards and more beyond the Hedge; but it vanished as soon as it brought them under the trees."
79,Looking back they could see the dark line of the Hedge through the stems of trees that were already thick about them.
80,"Looking ahead they could see only tree-trunks of innumerable sizes and shapes: straight or bent, twisted, leaning, squat or slender, smooth or gnarled and branched; and all the stems were green or grey with moss and slimy, shaggy growths."
81,Merry alone seemed fairly cheerful.
82,"'You had better lead on and find that path,' Frodo said to him."
83,"'Don't let us lose one another, or forget which way the Hedge lies!'"
84,"They picked a way among the trees, and their ponies plodded along, carefully avoiding the many writhing and interlacing roots."
85,There was no undergrowth.
86,"The ground was rising steadily, and as they went forward it seemed that the trees became taller, darker, and thicker."
87,"There was no sound, except an occasional drip of moisture falling through the still leaves."
88,"For the moment there was no whispering or movement among the branches; but they all got an uncomfortable feeling that they were being watched with disapproval, deepening to dislike and even enmity."
89,"The feeling steadily grew, until they found themselves looking up quickly, or glancing back over their shoulders, as if they expected a sudden blow."
90,"There was not as yet any sign of a path, and the trees seemed constantly to bar their way."
91,"Pippin suddenly felt that he could not bear it any longer, and without warning let out a shout."
92,'Oi!
93,Oi!'
94,he cried.
95,'I am not going to do anything.
96,"Just let me pass through, will you!'"
97,The others halted startled; but the cry fell as if muffled by a heavy curtain.
98,There was no echo or answer though the wood seemed to become more crowded and more watchful than before.
99,"'I should not shout, if I were you,' said Merry."
100,It does more harm than good.'
101,"Frodo began to wonder if it were possible to find a way through, and if he had been right to make the others come into this abominable wood."
102,"Merry was looking from side to side, and seemed already uncertain which way to go."
103,Pippin noticed it.
104,"'It has not taken you long to lose us,' he said."
105,But at that moment Merry gave a whistle of relief and pointed ahead.
106,"'Well, well!'"
107,he said.
108,'These trees _do_ shift.
109,"There is the Bonfire Glade in front of us (or I hope so), but the path to it seems to have moved away!'"
110,The light grew clearer as they went forward.
111,Suddenly they came out of the trees and found themselves in a wide circular space.
112,"There was sky above them, blue and clear to their surprise, for down under the Forest-roof they had not been able to see the rising morning and the lifting of the mist."
113,"The sun was not, however, high enough yet to shine down into the clearing, though its light was on the tree-tops."
114,"The leaves were all thicker and greener about the edges of the glade, enclosing it with an almost solid wall."
115,"No tree grew there, only rough grass and many tall plants: stalky and faded hemlocks and wood-parsley, fire-weed seeding into fluffy ashes, and rampant nettles and thistles."
116,A dreary place: but it seemed a charming and cheerful garden after the close Forest.
117,"The hobbits felt encouraged, and looked up hopefully at the broadening daylight in the sky."
118,"At the far side of the glade there was a break in the wall of trees, and a clear path beyond it."
119,"They could see it running on into the wood, wide in places and open above, though every now and again the trees drew in and overshadowed it with their dark boughs."
120,Up this path they rode.
121,"They were still climbing gently, but they now went much quicker, and with better heart; for it seemed to them that the Forest had relented, and was going to let them pass unhindered after all."
122,But after a while the air began to get hot and stuffy.
123,"The trees drew close again on either side, and they could no longer see far ahead."
124,Now stronger than ever they felt again the ill will of the wood pressing on them.
125,"So silent was it that the fall of their ponies' hoofs, rustling on dead leaves and occasionally stumbling on hidden roots, seemed to thud in their ears."
126,"Frodo tried to sing a song to encourage them, but his voice sank to a murmur."
127,O!
128,"Wanderers in the shadowed land
           despair not!"
129,"For though dark they stand,
           all woods there be must end at last,
           and see the open sun go past:
           the setting sun, the rising sun,
           the day's end, or the day begun."
130,"For east or west all woods must fail ...


     _Fail -_ even as he said the word his voice faded into silence."
131,The air seemed heavy and the making of words wearisome.
132,Just behind them a large branch fell from an old overhanging tree with a crash into the path.
133,The trees seemed to close in before them.
134,"'They do not like all that about ending and failing,' said Merry."
135,'I should not sing any more at present.
136,"Wait till we do get to the edge, and then we'll turn and give them a rousing chorus!'"
137,"He spoke cheerfully, and if he felt any great anxiety, he did not show it."
138,The others did not answer.
139,They were depressed.
140,"A heavy weight was settling steadily on Frodo's heart, and he regretted now with every step forward that he had ever thought of challenging the menace of the trees."
141,"He was, indeed, just about to stop and propose going back (if that was still possible), when things took a new turn."
142,"The path stopped climbing, and became for a while nearly level."
143,"The dark trees drew aside, and ahead they could see the path going almost straight forward."
144,"Before them, but some distance off, there stood a green hill-top, treeless, rising like a bald head out of the encircling wood."
145,The path seemed to be making directly for it.
146,"They now hurried forward again, delighted with the thought of climbing out for a while above the roof of the Forest."
147,"The path dipped, and then again began to climb upwards, leading them at last to the foot of the steep hillside."
148,There it left the trees and faded into the turf.
149,The wood stood all round the hill like thick hair that ended sharply in a circle round a shaven crown.
150,"The hobbits led their ponies up, winding round and round until they reached the top."
151,There they stood and gazed about them.
152,"The air was gleaming and sunlit, but hazy; and they could not see to any great distance."
153,"Near at hand the mist was now almost gone; though here and there it lay in hollows of the wood, and to the south of them, out of a deep fold cutting right across the Forest, the fog still rose like steam or wisps of white smoke."
154,"'That,' said Merry, pointing with his hand, 'that is the line of the Withywindle."
155,It comes down out of the Downs and flows south-west through the midst of the Forest to join the Brandywine below Haysend.
156,We don't want to go _that_ way!
157,"The Withywindle valley is said to be the queerest part of the whole wood  the centre from which all the queerness comes, as it were.'"
158,"The others looked in the direction that Merry pointed out, but they could see little but mists over the damp and deep-cut valley; and beyond it the southern half of the Forest faded from view."
159,The sun on the hill-lop was now getting hot.
160,It must have been about eleven o'clock; but the autumn haze still prevented them from seeing much in other directions.
161,In the west they could not make out either the line of the Hedge or the valley of the Brandywine beyond it.
162,"Northward, where they looked most hopefully, they could see nothing that might be the line of the great East Road, for which they were making."
163,"They were on an island in a sea of trees, and the horizon was veiled."
164,"On the south-eastern side the ground fell very steeply, as if the slopes of the hill were continued far down under the trees, like island-shores that really are the sides of a mountain rising out of deep waters."
165,"They sat on the green edge and looked out over the woods below them, while they ate their mid-day meal."
166,As the sun rose and passed noon they glimpsed far off in the east the grey-green lines of the Downs that lay beyond the Old Forest on that side.
167,"That cheered them greatly; for it was good to see a sight of anything beyond the wood's borders, though they did not mean to go that way, if they could help it: the Barrow-downs had as sinister a reputation in hobbit-legend as the Forest itself."
168,At length they made up their minds to go on again.
169,The path that had brought them to the hill reappeared on the northward side; but they had not followed it far before they became aware that it was bending steadily to the right.
170,Soon it began to descend rapidly and they guessed that it must actually be heading towards the Withywindle valley: not at all the direction they wished lo take.
171,"After some discussion they decided to leave this misleading path and strike northward; for although they had not been able to see it from the hill-top, the Road must lie that way, and it could not be many miles off."
172,"Also northward, and to the left of the path, the land seemed lo be drier and more open, climbing up to slopes where the trees were thinner, and pines and firs replaced the oaks and ashes and other strange and nameless trees of the denser wood."
173,"At first their choice seemed to be good: they got along at a fair speed, though whenever they got a glimpse of the sun in an open glade they seemed unaccountably to have veered eastwards."
174,"But after a time the trees began to close in again, just where they had appeared from a distance to be thinner and less tangled."
175,"Then deep folds in the ground were discovered unexpectedly, like the ruts of great giant-wheels or wide moats and sunken roads long disused and choked with brambles."
176,"These lay usually right across their line of march, and could only be crossed by scrambling down and out again, which was troublesome and difficult with their ponies."
177,"Each time they climbed down they found the hollow filled with thick bushes and matted undergrowth, which somehow would not yield to the left, but only gave way when they turned to the right; and they had to go some distance along the bottom before they could find a way up the further bank."
178,"Each time they clambered out, the trees seemed deeper and darker; and always to the left and upwards it was most difficult to find a way, and they were forced to the right and downwards."
179,"After an hour or two they had lost all clear sense of direction, though they knew well enough that they had long ceased to go northward at all."
180,"They were being headed off, and were simply following a course chosen for them  eastwards and southwards, into the heart of the Forest and not out of it."
181,The afternoon was wearing away when they scrambled and stumbled into a fold that was wider and deeper than any they had yet met.
182,"It was so sleep and overhung that it proved impossible to climb out of it again, either forwards or backwards, without leaving their ponies and their baggage behind."
183,All they could do was to follow the fold  downwards.
184,"The ground grew soft, and in places boggy; springs appeared in the banks, and soon they found themselves following a brook that trickled and babbled through a weedy bed."
185,"Then the ground began to fall rapidly, and the brook growing strong and noisy, flowed and leaped swiftly downhill."
186,They were in a deep dim-lit gully over-arched by trees high above them.
187,"After stumbling along for some way along the stream, they came quite suddenly out of the gloom."
188,As if through a gate they saw the sunlight before them.
189,"Coming to the opening they found that they had made their way down through a cleft in a high sleep bank, almost a cliff."
190,At its feet was a wide space of grass and reeds; and in the distance could be glimpsed another bank almost as steep.
191,A golden afternoon of late sunshine lay warm and drowsy upon the hidden land between.
192,"In the midst of it there wound lazily a dark river of brown water, bordered with ancient willows, arched over with willows, blocked with fallen willows, and flecked with thousands of faded willow-leaves."
193,"The air was thick with them, fluttering yellow from the branches; for there was a warm and gentle breeze blowing softly in the valley, and the reeds were rustling, and the willow-boughs were creaking."
194,"'Well, now I have at least some notion of where we are!'"
195,said Merry.
196,'We have come almost in the opposite direction to which we intended.
197,This is the River Withywindle!
198,I will go on and explore.'
199,He passed out into the sunshine and disappeared into the long grasses.
200,"After a while he reappeared, and reported that there was fairly solid ground between the cliff-foot and the river; in some places firm turf went down to the water's edge."
201,"'What's more,' he said, 'there seems to be something like a footpath winding along on this side of the river."
202,"If we turn left and follow it, we shall be bound to come out on the east side of the Forest eventually.'"
203,'I dare say!'
204,said Pippin.
205,"'That is, if the track goes on so far, and does not simply lead us into a bog and leave us there."
206,"Who made the track, do you suppose, and why?"
207,I am sure it was not for our benefit.
208,"I am getting very suspicious of this Forest and everything in it, and I begin to believe all the stories about it."
209,And have you any idea how far eastward we should have to go?'
210,"'No,' said Merry, 'I haven't."
211,"I don't know in the least how far down the Withywindle we are, or who could possibly come here often enough to make a path along it."
212,But there is no other way out that I can see or think of.'
213,"There being nothing else for it, they filed out, and Merry led them to the path that he had discovered."
214,"Everywhere the reeds and grasses were lush and tall, in places far above their heads; but once found, the path was easy to follow, as it turned and twisted, picking out the sounder ground among the bogs and pools."
215,"Here and there it passed over other rills, running down gullies into the Withywindle out of the higher forest-lands, and at these points there were tree-trunks or bundles of brushwood laid carefully across."
216,The hobbits began to feel very hot.
217,"There were armies of flies of all kinds buzzing round their ears, and the afternoon sun was burning on their backs."
218,At last they came suddenly into a thin shade; great grey branches reached across the path.
219,Each step forward became more reluctant than the last.
220,"Sleepiness seemed to be creeping out of the ground and up their legs, and falling softly out of the air upon their heads and eyes."
221,Frodo felt his chin go down and his head nod.
222,Just in front of him Pippin fell forward on to his knees.
223,Frodo halted.
224,"'It's no good,' he heard Merry saying."
225,'Can't go another step without rest.
226,Must have nap.
227,It's cool under the willows.
228,Less flies!'
229,Frodo did not like the sound of this.
230,'Come on!'
231,he cried.
232,'We can't have a nap yet.
233,We must get clear of the Forest first.'
234,But the others were too far gone to care.
235,Beside them Sam stood yawning and blinking stupidly.
236,Suddenly Frodo himself felt sleep overwhelming him.
237,His head swam.
238,There now seemed hardly a sound in the air.
239,The flies had stopped buzzing.
240,"Only a gentle noise on the edge of hearing, a soft fluttering as of a song half whispered, seemed to stir in the boughs above."
241,"He lifted his heavy eyes and saw leaning over him a huge willow-tree, old and hoary."
242,"Enormous it looked, its sprawling branches going up like reaching arms with many long-fingered hands, its knotted and twisted trunk gaping in wide fissures that creaked faintly as the boughs moved."
243,"The leaves fluttering against the bright sky dazzled him, and he toppled over, lying where he fell upon the grass."
244,Merry and Pippin dragged themselves forward and lay down with their backs to the willow-trunk.
245,Behind them the great cracks gaped wide to receive them as the tree swayed and creaked.
246,"They looked up at the grey and yellow leaves, moving softly against the light, and singing."
247,"They shut their eyes, and then it seemed that they could almost hear words, cool words, saying something about water and sleep."
248,They gave themselves up to the spell and fell fast asleep at the foot of the great grey willow.
249,Frodo lay for a while fighting with the sleep that was overpowering him; then with an effort he struggled to his feel again.
250,He felt a compelling desire for cool water.
251,"'Wait for me, Sam,' he stammered."
252,'Must bathe feet a minute.'
253,"Half in a dream he wandered forward to the riverward side of the tree, where great winding roots grew out into the stream, like gnarled dragonets straining down to drink."
254,"He straddled one of these, and paddled his hot feel in the cool brown water; and there he too suddenly fell asleep with his back against the tree."
255,"Sam sat down and scratched his head, and yawned like a cavern."
256,He was worried.
257,"The afternoon was getting late, and he thought this sudden sleepiness uncanny."
258,"'There's more behind this than sun and warm air,' he muttered to himself."
259,'I don't like this great big tree.
260,I don't trust it.
261,Hark at it singing about sleep now!
262,This won't do at all!'
263,"He pulled himself to his feet, and staggered off to see what had become of the ponies."
264,"He found that two had wandered on a good way along the path; and he had just caught them and brought them back towards the others, when he heard two noises; one loud, and the other soft but very clear."
265,One was the splash of something heavy falling into the water; the other was a noise like the snick of a lock when a door quietly closes fast.
266,He rushed back to the bank.
267,"Frodo was in the water close to the edge, and a great tree-root seemed to be over him and holding him down, but he was not struggling."
268,"Sam gripped him by the jacket, and dragged him from under the root; and then with difficulty hauled him on to the bank."
269,"Almost at once he woke, and coughed and spluttered."
270,"'Do you know, Sam,' he said at length, 'the beastly tree _threw_ me in!"
271,I felt it.
272,The big root just twisted round and tipped me in!'
273,"'You were dreaming I expect, Mr. Frodo,' said Sam."
274,"'You shouldn't sit in such a place, if you feel sleepy.'"
275,'What about the others?'
276,Frodo asked.
277,'I wonder what sort of dreams they are having.'
278,"They went round to the other side of the tree, and then Sam understood the click that he had heard."
279,Pippin had vanished.
280,"The crack by which he had laid himself had closed together, so that not a chink could be seen."
281,"Merry was trapped: another crack had closed about his waist; his legs lay outside, but the rest of him was inside a dark opening, the edges of which gripped like a pair of pincers."
282,Frodo and Sam beat first upon the tree-trunk where Pippin had lain.
283,They then struggled frantically to pull open the jaws of the crack that held poor Merry.
284,It was quite useless.
285,'What a foul thing to happen!'
286,cried Frodo wildly.
287,'Why did we ever come into this dreadful Forest?
288,I wish we were all back at Crickhollow!'
289,"He kicked the tree with all his strength, heedless of his own feet."
290,"A hardly perceptible shiver ran through the stem and up into the branches; the leaves rustled and whispered, but with a sound now of faint and far-off laughter."
291,"'I suppose we haven't got an axe among our luggage, Mr."
292,Frodo?'
293,asked Sam.
294,"'I brought a little hatchet for chopping firewood,' said Frodo."
295,'That wouldn't be much use.'
296,'Wait a minute!'
297,"cried Sam, struck by an idea suggested by firewood."
298,'We might do something with fire!'
299,"'We might,' said Frodo doubtfully."
300,'We might succeed in roasting Pippin alive inside.'
301,"'We might try to hurt or frighten this tree to begin with,' said Sam fiercely."
302,"'If it don't let them go, I'll have it down, if I have to gnaw it.'"
