sentence_id,sentence
303,He ran to the ponies and before long came back with two tinder-boxes and a hatchet.
304,"Quickly they gathered dry grass and leaves, and bits of bark; and made a pile of broken twigs and chopped sticks."
305,These they heaped against the trunk on the far side of the tree from the prisoners.
306,"As soon as Sam had struck a spark into the tinder, it kindled the dry grass and a flurry of flame and smoke went up."
307,The twigs crackled.
308,Little fingers of fire licked against the dry scored rind of the ancient tree and scorched it.
309,A tremor ran through the whole willow.
310,The leaves seemed to hiss above their heads with a sound of pain and anger.
311,"A loud scream came from Merry, and from far inside the tree they heard Pippin give a muffled yell."
312,'Put it out!
313,Put it out!'
314,cried Merry.
315,"'He'll squeeze me in two, if you don't."
316,He says so!'
317,'Who?
318,What?'
319,"shouted Frodo, rushing round to the other side of the tree."
320,'Put it out!
321,Put it out!'
322,begged Merry.
323,The branches of the willow began to sway violently.
324,"There was a sound as of a wind rising and spreading outwards to the branches of all the other trees round about, as though they had dropped a stone into the quiet slumber of the river-valley and set up ripples of anger that ran out over the whole Forest."
325,Sam kicked at the little fire and stamped out the sparks.
326,"But Frodo, without any clear idea of why he did so, or what he hoped for, ran along the path crying _help!"
327,help!
328,"help!_It seemed to him that he could hardly hear the sound of his own shrill voice: it was blown away from him by the willow-wind and drowned in a clamour of leaves, as soon as the words left his mouth."
329,He felt desperate: lost and witless.
330,Suddenly he slopped.
331,"There was an answer, or so he thought; but it seemed to come from behind him, away down the path further back in the Forest."
332,"He turned round and listened, and soon there could be no doubt: someone was singing a song; a deep glad voice was singing carelessly and happily, but it was singing nonsense:

          Hey dol!"
333,merry dol!
334,ring a dong dillo!
335,Ring a dong!
336,hop along!
337,fal lal the willow!
338,"Tom Bom, jolly Tom, Tom Bombadillo!"
339,"Half hopeful and half afraid of some new danger, Frodo and Sam now both stood still."
340,"Suddenly out of a long string of nonsense-words (or so they seemed) the voice rose up loud and clear and burst into this song:

          Hey!"
341,Come merry dot!
342,derry dol!
343,My darling!
344,Light goes the weather-wind and the feathered starling.
345,"Down along under Hill, shining in the sunlight,
           Waiting on the doorstep for the cold starlight,
           There my pretty lady is."
346,"River-woman's daughter,
           Slender as the willow-wand, clearer than the water."
347,"Old Tom Bombadil water-lilies bringing
           Comes hopping home again."
348,Can you hear him singing?
349,Hey!
350,Come merry dol!
351,deny dol!
352,"and merry-o,
           Goldberry, Goldberry, merry yellow berry-o!"
353,"Poor old Willow-man, you tuck your roots away!"
354,Tom's in a hurry now.
355,Evening will follow day.
356,Tom's going home again water-lilies bringing.
357,Hey!
358,Come derry dol!
359,Can you hear me singing?
360,Frodo and Sam stood as if enchanted.
361,The wind puffed out.
362,The leaves hung silently again on stiff branches.
363,"There was another burst of song, and then suddenly, hopping and dancing along the path, there appeared above the reeds an old battered hat with a tall crown and a long blue feather stuck in the band."
364,"With another hop and a bound there came into view a man, or so it seemed."
365,"At any rate he was too large and heavy for a hobbit, if not quite tall enough for one of the Big People, though he made noise enough for one, slumping along with great yellow boots on his thick legs, and charging through grass and rushes like a cow going down to drink."
366,"He had a blue coat and a long brown beard; his eyes were blue and bright, and his face was red as a ripe apple, but creased into a hundred wrinkles of laughter."
367,In his hands he carried on a large leaf as on a tray a small pile of white water-lilies.
368,'Help!'
369,cried Frodo and Sam running towards him with their hands stretched out.
370,'Whoa!
371,Whoa!
372,steady there!'
373,"cried the old man, holding up one hand, and they stopped short, as if they had been struck stiff."
374,"'Now, my little fellows, where be you a-going to, puffing like a bellows?"
375,What's the matter here then?
376,Do you know who I am?
377,I'm Tom Bombadil.
378,Tell me what's your trouble!
379,Tom's in a hurry now.
380,Don't you crush my lilies!'
381,"'My friends are caught in the willow-tree,' cried Frodo breathlessly."
382,'Master Merry's being squeezed in a crack!'
383,cried Sam.
384,'What?'
385,"shouted Tom Bombadil, leaping up in the air."
386,'Old Man Willow?
387,"Naught worse than that, eh?"
388,That can soon be mended.
389,I know the tune for him.
390,Old grey Willow-man!
391,"I'll freeze his marrow cold, if he don't behave himself."
392,I'll sing his roots off.
393,I'll sing a wind up and blow leaf and branch away.
394,Old Man Willow!'
395,"Setting down his lilies carefully on the grass, he ran to the tree."
396,There he saw Merry's feet still sticking out  the rest had already been drawn further inside.
397,Tom put his mouth to the crack and began singing into it in a low voice.
398,"They could not catch the words, but evidently Merry was aroused."
399,His legs began to kick.
400,"Tom sprang away, and breaking off a hanging branch smote the side of the willow with it."
401,"'You let them out again, Old Man Willow!'"
402,he said.
403,'What be you a-thinking of?
404,You should not be waking.
405,Eat earth!
406,Dig deep!
407,Drink water!
408,Go to sleep!
409,Bombadil is talking!'
410,He then seized Merry's feet and drew him out of the suddenly widening crack.
411,"There was a tearing creak and the other crack split open, and out of it Pippin sprang, as if he had been kicked."
412,Then with a loud snap both cracks closed fast again.
413,"A shudder ran through the tree from root to tip, and complete silence fell."
414,'Thank you!'
415,"said the hobbits, one after the other."
416,Tom Bombadil burst out laughing.
417,"'Well, my little fellows!'"
418,"said he, stooping so that he peered into their faces."
419,'You shall come home with me!
420,"The table is all laden with yellow cream, honeycomb, and white bread and butter."
421,Goldberry is waiting.
422,Time enough for questions around the supper table.
423,You follow after me as quick as you are able!'
424,"With that he picked up his lilies, and then with a beckoning wave of his hand went hopping and dancing along the path eastward, still singing loudly and nonsensically."
425,"Too surprised and too relieved to talk, the hobbits followed after him as fast as they could."
426,But that was not fast enough.
427,"Tom soon disappeared in front of them, and the noise of his singing got fainter and further away."
428,Suddenly his voice came floating back to them in a loud halloo!
429,"Hop along, my little friends, up the Withywindle!"
430,Tom's going on ahead candles for to kindle.
431,Down west sinks the Sun: soon you will be groping.
432,"When the night-shadows fall, then the door will open,
           Out of the window-panes light will twinkle yellow."
433,Fear no alder black!
434,Heed no hoary willow!
435,Fear neither root nor bough!
436,Tom goes on before you.
437,Hey now!
438,merry dot!
439,We'll be waiting for you!
440,After that the hobbits heard no more.
441,Almost at once the sun seemed to sink into the trees behind them.
442,"They thought of the slanting light of evening glittering on the Brandywine River, and the windows of Bucklebury beginning to gleam with hundreds of lights."
443,Great shadows fell across them; trunks and branches of trees hung dark and threatening over the path.
444,White mists began to rise and curl on the surface of the river and stray about the roots of the trees upon its borders.
445,Out of the very ground at their feet a shadowy steam arose and mingled with the swiftly falling dusk.
446,"It became difficult to follow the path, and they were very tired."
447,Their legs seemed leaden.
448,"Strange furtive noises ran among the bushes and reeds on either side of them; and if they looked up to the pale sky, they caught sight of queer gnarled and knobbly faces that gloomed dark against the twilight, and leered down at them from the high bank and the edges of the wood."
449,"They began to feel that all this country was unreal, and that they were stumbling through an ominous dream that led to no awakening."
450,"Just as they felt their feet slowing down to a standstill, they noticed that the ground was gently rising."
451,The water began to murmur.
452,"In the darkness they caught the white glimmer of foam, where the river flowed over a short fall."
453,Then suddenly the trees came to an end and the mists were left behind.
454,"They stepped out from the Forest, and found a wide sweep of grass welling up before them."
455,"The river, now small and swift, was leaping merrily down to meet them, glinting here and there in the light of the stars, which were already shining in the sky."
456,"The grass under their feet was smooth and short, as if it had been mown or shaven."
457,"The eaves of the Forest behind were clipped, and trim as a hedge."
458,"The path was now plain before them, well-tended and bordered with stone."
459,"It wound up on to the top of a grassy knoll, now grey under the pale starry night; and there, still high above them on a further slope, they saw the twinkling lights of a house."
460,"Down again the path went, and then up again, up a long smooth hillside of turf, towards the light."
461,Suddenly a wide yellow beam flowed out brightly from a door that was opened.
462,"There was Tom Bombadil's house before them, up, down, under hill."
463,"Behind it a steep shoulder of the land lay grey and bare, and beyond that the dark shapes of the Barrow-downs stalked away into the eastern night."
464,"They all hurried forward, hobbits and ponies."
465,Already half their weariness and all their fears had fallen from them.
466,_Hey!
467,Come merry dol!_ rolled out the song to greet them.
468,Hey!
469,Come derry dol!
470,"Hop along, my hearties!"
471,Hobbits!
472,Ponies all!
473,We are fond of parties.
474,Now let the fun begin!
475,Let us sing together!
476,"Then another clear voice, as young and as ancient as Spring, like the song of a glad water flowing down into the night from a bright morning in the hills, came falling like silver to meet them:

          Now let the song begin!"
477,"Let us sing together
           Of sun, stars, moon and mist, rain and cloudy weather,
           Light on the budding leaf, dew on the feather,
           Wind on the open hill, bells on the heather,
           Reeds by the shady pool, lilies on the water:
           Old Tom Bombadil and the River-daughter!"
478,"And with that song the hobbits stood upon the threshold, and a golden light was all about them."
479,_
