sentence_id,sentence
319,When the day came the mood of the world about them had become soft and sad.
320,"Slowly the dawn grew to a pale light, diffused and shadowless."
321,"There was mist on the River, and white fog swathed the shore; the far bank could not be seen."
322,"`I can't abide fog,' said Sam; `but this seems to be a lucky one."
323,Now perhaps we can get away without those cursed goblins seeing us.'
324,"`Perhaps so,' said Aragorn."
325,`But it will be hard to find the path unless the fog lifts a little later on.
326,"And we must find the path, if we are to pass Sarn Gebir and come to the Emyn Muil.'"
327,"'I do not see why we should pass the Rapids or follow the River any further,' said Boromir."
328,"`If the Emyn Muil lie before us, then we can abandon these cockle-boats, and strike westward and southward, until we come to the Entwash and cross into my own land.'"
329,"`We can, if we are making for Minas Tirith,' said Aragorn, `but that is not yet agreed."
330,And such a course may be more perilous than it sounds.
331,"The vale of Entwash is flat and fenny, and fog is a deadly peril there for those on foot and laden."
332,I would not abandon our boats until we must.
333,The River is at least a path that cannot be missed.'
334,"`But the Enemy holds the eastern bank,' objected Boromir."
335,"`And even if you pass the Gates of Argonath and come unmolested to the Tindrock, what will you do then?"
336,Leap down the Falls and land in the marshes? '
337,`No! '
338,answered Aragorn.
339,"`Say rather that we will bear our boats by the ancient way to Rauros-foot, and there take to the water again."
340,"Do you not know, Boromir, or do you choose to forget the North Stair, and the high seat upon Amon Hen, that were made in the days of the great kings?"
341,"I at least have a mind to stand in that high place again, before I decide my further course."
342,"There, maybe, we shall see some sign that will guide us.'"
343,"Boromir held out long against this choice; but when it became plain that Frodo would follow Aragorn, wherever he went, he gave in."
344,"'It is not the way of the Men of Minas Tirith to desert their friends at need,' he said, `and you will need my strength, if ever you are to reach the Tindrock."
345,"To the tall isle I will go, but no further."
346,"There I shall turn to my home, alone if my help has not earned the reward of any companionship.'"
347,"The day was now growing, and the fog had lifted a little."
348,"It was decided that Aragorn and Legolas should at once go forward along the shore, while the others remained by the boats."
349,Aragorn hoped to find some way by which they could carry both their boats and their baggage to the smoother water beyond the Rapids.
350,"`Boats of the Elves would not sink, maybe,' he said, `but that does not say that we should come through Sarn Gebir alive."
351,None have ever done so yet.
352,"No road was made by the Men of Gondor in this region, for even in their great days their realm did not reach up Anduin beyond the Emyn Muil; but there is a portage-way somewhere on the western shore, if I can find it."
353,"It cannot yet have perished; for light boats used to journey out of Wilderland down to Osgiliath, and still did so until a few years ago, when the Orcs of Mordor began to multiply.'"
354,"'Seldom in my life has any boat come out of the North, and the Orcs prowl on the east-shore,' said Boromir."
355,"`If you go forward, peril will grow with every mile, even if you find a path.'"
356,"`Peril lies ahead on every southward road,' answered Aragorn."
357,`Wait for us one day.
358,"If we do not return in that time, you will know that evil has indeed befallen us."
359,Then you must take a new leader and follow him as best you can.'
360,It was with a heavy heart that Frodo saw Aragorn and Legolas climb the steep bank and vanish into the mists; but his fears proved groundless.
361,"Only two or three hours had passed, and it was barely mid-day, when the shadowy shapes of the explorers appeared again."
362,"`All is well,' said Aragorn, as he clambered down the bank."
363,"'There is a track, and it leads to a good landing that is still serviceable."
364,"The distance is not great: the head of the Rapids is but half a mile below us, and they are little more than a mile long."
365,"Not far beyond them the stream becomes clear and smooth again, though it runs swiftly."
366,Our hardest task will be to get our boats and baggage to the old portage-way.
367,"We have found it, but it lies well back from the water-side here, and runs under the lee of a rock-wall, a furlong or more from the shore."
368,We did not find where the northward landing lies.
369,"If it still remains, we must have passed it yesterday night."
370,We might labour far upstream and yet miss it in the fog.
371,"I fear we must leave the River now, and make for the portage-way as best we can from here.'"
372,"`That would not be easy, even if we were all Men,' said Boromir."
373,"`Yet such as we are we will try it,' said Aragorn."
374,"'Aye, we will,' said Gimli."
375,"`The legs of Men will lag on a rough road, while a Dwarf goes on, be the burden twice his own weight, Master Boromir! '"
376,"The task proved hard indeed, yet in the end it was done."
377,"The goods were taken out of the boats and brought to the top of the bank, where there was a level space."
378,Then the boats were drawn out of the water and carried up.
379,They were far less heavy than any had expected.
380,Of what tree growing in the elvish country they were made not even Legolas knew; but the wood was tough and yet strangely light.
381,Merry and Pippin alone could carry their boat with ease along the flat.
382,Nonetheless it needed the strength of the two Men to lift and haul them over the ground that the Company now had to cross.
383,"It sloped up away from the River, a tumbled waste of grey limestone-boulders, with many hidden holes shrouded with weeds and bushes; there were thickets of brambles, and sheer dells; and here and there boggy pools fed by waters trickling from the terraces further inland."
384,"One by one Boromir and Aragorn carried the boats, while the others toiled and scrambled after them with the baggage."
385,At last all was removed and laid on the portage-way.
386,"Then with little further hindrance, save from sprawling briars and many fallen stones, they moved forward all together."
387,"Fog still hung in veils upon the crumbling rock-wall, and to their left mist shrouded the River: they could hear it rushing and foaming over the sharp shelves and stony teeth of Sarn Gebir, but they could not see it."
388,"Twice they made the journey, before all was brought safe to the southern landing."
389,"There the portage-way, turning back to the water-side, ran gently down to the shallow edge of a little pool."
390,"It seemed to have been scooped in the river-side, not by hand, but by the water swirling down from Sarn Gebir against a low pier of rock that jutted out some way into the stream."
391,"Beyond it the shore rose sheer into a grey cliff, and there was no further passage for those on foot."
392,"Already the short afternoon was past, and a dim cloudy dusk was closing in."
393,"They sat beside the water listening to the confused rush and roar of the Rapids hidden in the mist; they were tired and sleepy, and their hearts were as gloomy as the dying day."
394,"'Well, here we are, and here we must pass another night,' said Boromir."
395,"`We need sleep, and even if Aragorn had a mind to pass the Gates of Argonath by night, we are all too tired-except, no doubt, our sturdy dwarf.'"
396,Gimli made no reply: he was nodding as he sat.
397,"`Let us rest as much as we can now,' said Aragorn."
398,`Tomorrow we must journey by day again.
399,"Unless the weather changes once more and cheats us, we shall have a good chance of slipping through, unseen by any eyes on the eastern shore."
400,But tonight two must watch together in turns: three hours off and one on guard.'
401,Nothing happened that night worse than a brief drizzle of rain an hour before dawn.
402,As soon as it was fully light they started.
403,Already the fog was thinning.
404,"They kept as close as they could to the western side, and they could see the dim shapes of the low cliffs rising ever higher, shadowy walls with their feet in the hurrying river."
405,"In the mid-morning the clouds drew down lower, and it began to rain heavily."
406,"They drew the skin-covers over their boats to prevent them from being flooded, and drifted on: little could be seen before them or about them through the grey falling curtains."
407,"The rain, however, did not last long."
408,"Slowly the sky above grew lighter, and then suddenly the clouds broke, and their draggled fringes trailed away northward up the River."
409,The fogs and mists were gone.
410,"Before the travellers lay a wide ravine, with great rocky sides to which clung, upon shelves and in narrow crevices, a few thrawn trees."
411,The channel grew narrower and the River swifter.
412,"Now they were speeding along with little hope of stopping or turning, whatever they might meet ahead."
413,"Over them was a lane of pale-blue sky, around them the dark overshadowed River, and before them black, shutting out the sun, the hills of Emyn Muil, in which no opening could be seen."
414,Frodo peering forward saw in the distance two great rocks approaching: like great pinnacles or pillars of stone they seemed.
415,Tall and sheer and ominous they stood upon either side of the stream.
416,"A narrow gap appeared between them, and the River swept the boats towards it."
417,"`Behold the Argonath, the Pillars of the Kings! '"
418,cried Aragorn.
419,`We shall pass them soon.
420,"Keep the boats in line, and as far apart as you can!"
421,Hold the middle of the stream! '
422,As Frodo was borne towards them the great pillars rose like towers to meet him.
423,"Giants they seemed to him, vast grey figures silent but threatening."
424,"Then he saw that they were indeed shaped and fashioned: the craft and power of old had wrought upon them, and still they preserved through the suns and rains of forgotten years the mighty likenesses in which they had been hewn."
425,Upon great pedestals founded in the deep waters stood two great kings of stone: still with blurred eyes and crannied brows they frowned upon the North.
426,The left hand of each was raised palm outwards in gesture of warning; in each right hand there was an axe; upon each head there was a crumbling helm and crown.
427,"Great power and majesty they still wore, the silent wardens of a long-vanished kingdom."
428,"Awe and fear fell upon Frodo, and he cowered down, shutting his eyes and not daring to look up as the boat drew near."
429,Even Boromir bowed his head as the boats whirled by.
430,"frail and fleeting as little leaves, under the enduring shadow of the sentinels of Númenor."
431,So they passed into the dark chasm of the Gates.
432,Sheer rose the dreadful cliffs to unguessed heights on either side.
433,Far off was the dim sky.
434,"The black waters roared and echoed, and a wind screamed over them."
435,Frodo crouching over his knees heard Sam in front muttering and groaning: `What a place!
436,What a horrible place!
437,"Just let me get out of this boat, and I'll never wet my toes in a puddle again, let alone a river! '"
438,`Fear not! '
439,said a strange voice behind him.
440,"Frodo turned and saw Strider, and yet not Strider; for the weatherworn Ranger was no longer there."
441,"In the stern sat Aragorn son of Arathorn, proud and erect, guiding the boat with skilful strokes; his hood was cast back, and his dark hair was blowing in the wind, a light was in his eyes: a king returning from exile to his own land."
442,'Fear not! '
443,he said.
444,"`Long have I desired to look upon the likenesses of Isildur and Anárion, my sires of old."
445,"Under their shadow Elessar, the Elfstone son of Arathorn of the House of Valandil Isildur's son heir of Elendil, has nought to dread! '"
446,"Then the light of his eyes faded, and he spoke to himself: `Would that Gandalf were here!"
447,How my heart yearns for Minas Anor and the walls of my own city!
448,But whither now shall I go? '
449,"The chasm was long and dark, and filled with the noise of wind and rushing water and echoing stone."
450,"It bent somewhat towards the west so that at first all was dark ahead; but soon Frodo saw a tall gap of light before him, ever growing."
451,"Swiftly it drew near, and suddenly the boats shot through, out into a wide clear light."
452,"The sun, already long fallen from the noon, was shining in a windy sky."
453,"The pent waters spread out into a long oval lake, pale Nen Hithoel, fenced by steep grey hills whose sides were clad with trees, but their heads were bare, cold-gleaming in the sunlight."
454,At the far southern end rose three peaks.
455,"The midmost stood somewhat forward from the others and sundered from them, an island in the waters, about which the flowing River flung pale shimmering arms."
456,Distant but deep there came up on the wind a roaring sound like the roll of thunder heard far away.
457,`Behold Tol Brandir! '
458,"said Aragorn, pointing south to the tall peak."
459,"'Upon the left stands Amon Lhaw, and upon the right is Amon Hen the Hills of Hearing and of Sight."
460,"In the days of the great kings there were high seats upon them, and watch was kept there."
461,But it is said that no foot of man or beast has ever been set upon Tol Brandir.
462,Ere the shade of night falls we shall come to them.
463,I hear the endless voice of Rauros calling.'
464,"The Company rested now for a while, drifting south on the current that flowed through the middle of the lake."
465,"They ate some food, and then they took to their paddles and hastened on their way."
466,"The sides of the westward hills fell into shadow, and the Sun grew round and red."
467,Here and there a misty star peered out.
468,"The three peaks loomed before them, darkling in the twilight."
469,Rauros was roaring with a great voice.
470,Already night was laid on the flowing waters when the travellers came at last under the shadow of the hills.
471,The tenth day of their journey was over.
472,Wilderland was behind them.
473,They could go no further without choice between the east-way and the west.
474,The last stage of the Quest was before them.
475,_
